frame.number,frame.time,ip.src,ip.dst,tcp.srcport,tcp.dstport,frame.len,_ws.col.Info
"1","Dec  8, 2024 14:51:13.863793188 IST",,,,,"42","Who has 172.18.0.3? Tell 172.18.0.2"
"2","Dec  8, 2024 14:51:13.863818322 IST",,,,,"42","172.18.0.3 is at 02:42:ac:12:00:03"
"3","Dec  8, 2024 14:51:14.173515014 IST","172.18.0.2","172.18.0.3","61216","22","58","61216 → 22 [SYN] Seq=0 Win=1024 Len=0 MSS=1460"
"4","Dec  8, 2024 14:51:14.173542977 IST","172.18.0.3","172.18.0.2","22","61216","54","22 → 61216 [RST, ACK] Seq=1 Ack=1 Win=0 Len=0"
"5","Dec  8, 2024 14:51:14.173566646 IST","172.18.0.2","172.18.0.3","61216","25","58","61216 → 25 [SYN] Seq=0 Win=1024 Len=0 MSS=1460"
"6","Dec  8, 2024 14:51:14.173570652 IST","172.18.0.3","172.18.0.2","25","61216","54","25 → 61216 [RST, ACK] Seq=1 Ack=1 Win=0 Len=0"
"7","Dec  8, 2024 14:51:14.173579877 IST","172.18.0.2","172.18.0.3","61216","8080","58","61216 → 8080 [SYN] Seq=0 Win=1024 Len=0 MSS=1460"
"8","Dec  8, 2024 14:51:14.173583014 IST","172.18.0.3","172.18.0.2","8080","61216","54","8080 → 61216 [RST, ACK] Seq=1 Ack=1 Win=0 Len=0"
"9","Dec  8, 2024 14:51:14.173591973 IST","172.18.0.2","172.18.0.3","61216","139","58","61216 → 139 [SYN] Seq=0 Win=1024 Len=0 MSS=1460"
"10","Dec  8, 2024 14:51:14.173595159 IST","172.18.0.3","172.18.0.2","139","61216","54","139 → 61216 [RST, ACK] Seq=1 Ack=1 Win=0 Len=0"
"11","Dec  8, 2024 14:51:14.173603794 IST","172.18.0.2","172.18.0.3","61216","587","58","61216 → 587 [SYN] Seq=0 Win=1024 Len=0 MSS=1460"
"12","Dec  8, 2024 14:51:14.173606920 IST","172.18.0.3","172.18.0.2","587","61216","54","587 → 61216 [RST, ACK] Seq=1 Ack=1 Win=0 Len=0"
"13","Dec  8, 2024 14:51:14.173616109 IST","172.18.0.2","172.18.0.3","61216","21","58","61216 → 21 [SYN] Seq=0 Win=1024 Len=0 MSS=1460"
"14","Dec  8, 2024 14:51:14.173619150 IST","172.18.0.3","172.18.0.2","21","61216","54","21 → 61216 [RST, ACK] Seq=1 Ack=1 Win=0 Len=0"
"15","Dec  8, 2024 14:51:14.173627834 IST","172.18.0.2","172.18.0.3","61216","8888","58","61216 → 8888 [SYN] Seq=0 Win=1024 Len=0 MSS=1460"
"16","Dec  8, 2024 14:51:14.173630811 IST","172.18.0.3","172.18.0.2","8888","61216","54","8888 → 61216 [RST, ACK] Seq=1 Ack=1 Win=0 Len=0"
"17","Dec  8, 2024 14:51:14.173640201 IST","172.18.0.2","172.18.0.3","61216","256","58","61216 → 256 [SYN] Seq=0 Win=1024 Len=0 MSS=1460"
"18","Dec  8, 2024 14:51:14.173643242 IST","172.18.0.3","172.18.0.2","256","61216","54","256 → 61216 [RST, ACK] Seq=1 Ack=1 Win=0 Len=0"
"19","Dec  8, 2024 14:51:14.173652030 IST","172.18.0.2","172.18.0.3","61216","993","58","61216 → 993 [SYN] Seq=0 Win=1024 Len=0 MSS=1460"
"20","Dec  8, 2024 14:51:14.173654997 IST","172.18.0.3","172.18.0.2","993","61216","54","993 → 61216 [RST, ACK] Seq=1 Ack=1 Win=0 Len=0"
"21","Dec  8, 2024 14:51:14.173663842 IST","172.18.0.2","172.18.0.3","61216","110","58","61216 → 110 [SYN] Seq=0 Win=1024 Len=0 MSS=1460"
"22","Dec  8, 2024 14:51:14.173666634 IST","172.18.0.3","172.18.0.2","110","61216","54","110 → 61216 [RST, ACK] Seq=1 Ack=1 Win=0 Len=0"
"23","Dec  8, 2024 14:51:14.173722707 IST","172.18.0.2","172.18.0.3","61216","53","58","61216 → 53 [SYN] Seq=0 Win=1024 Len=0 MSS=1460"
"24","Dec  8, 2024 14:51:14.173726219 IST","172.18.0.3","172.18.0.2","53","61216","54","53 → 61216 [RST, ACK] Seq=1 Ack=1 Win=0 Len=0"
"25","Dec  8, 2024 14:51:14.173736599 IST","172.18.0.2","172.18.0.3","61216","3306","58","61216 → 3306 [SYN] Seq=0 Win=1024 Len=0 MSS=1460"
"26","Dec  8, 2024 14:51:14.173740078 IST","172.18.0.3","172.18.0.2","3306","61216","54","3306 → 61216 [RST, ACK] Seq=1 Ack=1 Win=0 Len=0"
"27","Dec  8, 2024 14:51:14.173748604 IST","172.18.0.2","172.18.0.3","61216","1720","58","61216 → 1720 [SYN] Seq=0 Win=1024 Len=0 MSS=1460"
"28","Dec  8, 2024 14:51:14.173752164 IST","172.18.0.3","172.18.0.2","1720","61216","54","1720 → 61216 [RST, ACK] Seq=1 Ack=1 Win=0 Len=0"
"29","Dec  8, 2024 14:51:14.173761175 IST","172.18.0.2","172.18.0.3","61216","995","58","61216 → 995 [SYN] Seq=0 Win=1024 Len=0 MSS=1460"
"30","Dec  8, 2024 14:51:14.173764011 IST","172.18.0.3","172.18.0.2","995","61216","54","995 → 61216 [RST, ACK] Seq=1 Ack=1 Win=0 Len=0"
"31","Dec  8, 2024 14:51:14.173772705 IST","172.18.0.2","172.18.0.3","61216","23","58","61216 → 23 [SYN] Seq=0 Win=1024 Len=0 MSS=1460"
"32","Dec  8, 2024 14:51:14.173801801 IST","172.18.0.3","172.18.0.2","23","61216","54","23 → 61216 [RST, ACK] Seq=1 Ack=1 Win=0 Len=0"
"33","Dec  8, 2024 14:51:14.173814513 IST","172.18.0.2","172.18.0.3","61216","80","58","61216 → 80 [SYN] Seq=0 Win=1024 Len=0 MSS=1460"
"34","Dec  8, 2024 14:51:14.173826106 IST","172.18.0.3","172.18.0.2","80","61216","58","80 → 61216 [SYN, ACK] Seq=0 Ack=1 Win=64240 Len=0 MSS=1460"
"35","Dec  8, 2024 14:51:14.173833161 IST","172.18.0.2","172.18.0.3","61216","80","54","61216 → 80 [RST] Seq=1 Win=0 Len=0"
"36","Dec  8, 2024 14:51:14.173841468 IST","172.18.0.2","172.18.0.3","61216","1025","58","61216 → 1025 [SYN] Seq=0 Win=1024 Len=0 MSS=1460"
"37","Dec  8, 2024 14:51:14.173844422 IST","172.18.0.3","172.18.0.2","1025","61216","54","1025 → 61216 [RST, ACK] Seq=1 Ack=1 Win=0 Len=0"
"38","Dec  8, 2024 14:51:14.173853545 IST","172.18.0.2","172.18.0.3","61216","1723","58","61216 → 1723 [SYN] Seq=0 Win=1024 Len=0 MSS=1460"
"39","Dec  8, 2024 14:51:14.173856261 IST","172.18.0.3","172.18.0.2","1723","61216","54","1723 → 61216 [RST, ACK] Seq=1 Ack=1 Win=0 Len=0"
"40","Dec  8, 2024 14:51:14.173864206 IST","172.18.0.2","172.18.0.3","61216","113","58","61216 → 113 [SYN] Seq=0 Win=1024 Len=0 MSS=1460"
"41","Dec  8, 2024 14:51:14.173867020 IST","172.18.0.3","172.18.0.2","113","61216","54","113 → 61216 [RST, ACK] Seq=1 Ack=1 Win=0 Len=0"
"42","Dec  8, 2024 14:51:14.173875329 IST","172.18.0.2","172.18.0.3","61216","143","58","61216 → 143 [SYN] Seq=0 Win=1024 Len=0 MSS=1460"
"43","Dec  8, 2024 14:51:14.173877995 IST","172.18.0.3","172.18.0.2","143","61216","54","143 → 61216 [RST, ACK] Seq=1 Ack=1 Win=0 Len=0"
"44","Dec  8, 2024 14:51:14.173886578 IST","172.18.0.2","172.18.0.3","61216","135","58","61216 → 135 [SYN] Seq=0 Win=1024 Len=0 MSS=1460"
"45","Dec  8, 2024 14:51:14.173889280 IST","172.18.0.3","172.18.0.2","135","61216","54","135 → 61216 [RST, ACK] Seq=1 Ack=1 Win=0 Len=0"
"46","Dec  8, 2024 14:51:14.173897787 IST","172.18.0.2","172.18.0.3","61216","3389","58","61216 → 3389 [SYN] Seq=0 Win=1024 Len=0 MSS=1460"
"47","Dec  8, 2024 14:51:14.173900556 IST","172.18.0.3","172.18.0.2","3389","61216","54","3389 → 61216 [RST, ACK] Seq=1 Ack=1 Win=0 Len=0"
"48","Dec  8, 2024 14:51:14.173908678 IST","172.18.0.2","172.18.0.3","61216","554","58","61216 → 554 [SYN] Seq=0 Win=1024 Len=0 MSS=1460"
"49","Dec  8, 2024 14:51:14.173911429 IST","172.18.0.3","172.18.0.2","554","61216","54","554 → 61216 [RST, ACK] Seq=1 Ack=1 Win=0 Len=0"
"50","Dec  8, 2024 14:51:14.173920568 IST","172.18.0.2","172.18.0.3","61216","445","58","61216 → 445 [SYN] Seq=0 Win=1024 Len=0 MSS=1460"
"51","Dec  8, 2024 14:51:14.173923641 IST","172.18.0.3","172.18.0.2","445","61216","54","445 → 61216 [RST, ACK] Seq=1 Ack=1 Win=0 Len=0"
"52","Dec  8, 2024 14:51:14.173932339 IST","172.18.0.2","172.18.0.3","61216","5900","58","61216 → 5900 [SYN] Seq=0 Win=1024 Len=0 MSS=1460"
"53","Dec  8, 2024 14:51:14.173935392 IST","172.18.0.3","172.18.0.2","5900","61216","54","5900 → 61216 [RST, ACK] Seq=1 Ack=1 Win=0 Len=0"
"54","Dec  8, 2024 14:51:14.173944302 IST","172.18.0.2","172.18.0.3","61216","111","58","61216 → 111 [SYN] Seq=0 Win=1024 Len=0 MSS=1460"
"55","Dec  8, 2024 14:51:14.173947135 IST","172.18.0.3","172.18.0.2","111","61216","54","111 → 61216 [RST, ACK] Seq=1 Ack=1 Win=0 Len=0"
"56","Dec  8, 2024 14:51:14.173956319 IST","172.18.0.2","172.18.0.3","61216","443","58","61216 → 443 [SYN] Seq=0 Win=1024 Len=0 MSS=1460"
"57","Dec  8, 2024 14:51:14.173959064 IST","172.18.0.3","172.18.0.2","443","61216","54","443 → 61216 [RST, ACK] Seq=1 Ack=1 Win=0 Len=0"
"58","Dec  8, 2024 14:51:14.173967442 IST","172.18.0.2","172.18.0.3","61216","199","58","61216 → 199 [SYN] Seq=0 Win=1024 Len=0 MSS=1460"
"59","Dec  8, 2024 14:51:14.173970721 IST","172.18.0.3","172.18.0.2","199","61216","54","199 → 61216 [RST, ACK] Seq=1 Ack=1 Win=0 Len=0"
"60","Dec  8, 2024 14:51:14.173978761 IST","172.18.0.2","172.18.0.3","61216","3003","58","61216 → 3003 [SYN] Seq=0 Win=1024 Len=0 MSS=1460"
"61","Dec  8, 2024 14:51:14.173981710 IST","172.18.0.3","172.18.0.2","3003","61216","54","3003 → 61216 [RST, ACK] Seq=1 Ack=1 Win=0 Len=0"
"62","Dec  8, 2024 14:51:14.173989945 IST","172.18.0.2","172.18.0.3","61216","32773","58","61216 → 32773 [SYN] Seq=0 Win=1024 Len=0 MSS=1460"
"63","Dec  8, 2024 14:51:14.173993065 IST","172.18.0.3","172.18.0.2","32773","61216","54","32773 → 61216 [RST, ACK] Seq=1 Ack=1 Win=0 Len=0"
"64","Dec  8, 2024 14:51:14.174035745 IST","172.18.0.2","172.18.0.3","61216","9917","58","61216 → 9917 [SYN] Seq=0 Win=1024 Len=0 MSS=1460"
"65","Dec  8, 2024 14:51:14.174039824 IST","172.18.0.3","172.18.0.2","9917","61216","54","9917 → 61216 [RST, ACK] Seq=1 Ack=1 Win=0 Len=0"
"66","Dec  8, 2024 14:51:14.174048664 IST","172.18.0.2","172.18.0.3","61216","4002","58","61216 → 4002 [SYN] Seq=0 Win=1024 Len=0 MSS=1460"
"67","Dec  8, 2024 14:51:14.174052009 IST","172.18.0.3","172.18.0.2","4002","61216","54","4002 → 61216 [RST, ACK] Seq=1 Ack=1 Win=0 Len=0"
"68","Dec  8, 2024 14:51:14.174061022 IST","172.18.0.2","172.18.0.3","61216","2135","58","61216 → 2135 [SYN] Seq=0 Win=1024 Len=0 MSS=1460"
"69","Dec  8, 2024 14:51:14.174063859 IST","172.18.0.3","172.18.0.2","2135","61216","54","2135 → 61216 [RST, ACK] Seq=1 Ack=1 Win=0 Len=0"
"70","Dec  8, 2024 14:51:14.174072414 IST","172.18.0.2","172.18.0.3","61216","1233","58","61216 → 1233 [SYN] Seq=0 Win=1024 Len=0 MSS=1460"
"71","Dec  8, 2024 14:51:14.174075132 IST","172.18.0.3","172.18.0.2","1233","61216","54","1233 → 61216 [RST, ACK] Seq=1 Ack=1 Win=0 Len=0"
"72","Dec  8, 2024 14:51:14.174083548 IST","172.18.0.2","172.18.0.3","61216","1443","58","61216 → 1443 [SYN] Seq=0 Win=1024 Len=0 MSS=1460"
"73","Dec  8, 2024 14:51:14.174086276 IST","172.18.0.3","172.18.0.2","1443","61216","54","1443 → 61216 [RST, ACK] Seq=1 Ack=1 Win=0 Len=0"
"74","Dec  8, 2024 14:51:14.174094635 IST","172.18.0.2","172.18.0.3","61216","15660","58","61216 → 15660 [SYN] Seq=0 Win=1024 Len=0 MSS=1460"
"75","Dec  8, 2024 14:51:14.174097525 IST","172.18.0.3","172.18.0.2","15660","61216","54","15660 → 61216 [RST, ACK] Seq=1 Ack=1 Win=0 Len=0"
"76","Dec  8, 2024 14:51:14.174105918 IST","172.18.0.2","172.18.0.3","61216","6789","58","61216 → 6789 [SYN] Seq=0 Win=1024 Len=0 MSS=1460"
"77","Dec  8, 2024 14:51:14.174108819 IST","172.18.0.3","172.18.0.2","6789","61216","54","6789 → 61216 [RST, ACK] Seq=1 Ack=1 Win=0 Len=0"
"78","Dec  8, 2024 14:51:14.174117714 IST","172.18.0.2","172.18.0.3","61216","1107","58","61216 → 1107 [SYN] Seq=0 Win=1024 Len=0 MSS=1460"
"79","Dec  8, 2024 14:51:14.174121109 IST","172.18.0.3","172.18.0.2","1107","61216","54","1107 → 61216 [RST, ACK] Seq=1 Ack=1 Win=0 Len=0"
"80","Dec  8, 2024 14:51:14.174130366 IST","172.18.0.2","172.18.0.3","61216","15742","58","61216 → 15742 [SYN] Seq=0 Win=1024 Len=0 MSS=1460"
"81","Dec  8, 2024 14:51:14.174133223 IST","172.18.0.3","172.18.0.2","15742","61216","54","15742 → 61216 [RST, ACK] Seq=1 Ack=1 Win=0 Len=0"
"82","Dec  8, 2024 14:51:14.174142450 IST","172.18.0.2","172.18.0.3","61216","4567","58","61216 → 4567 [SYN] Seq=0 Win=1024 Len=0 MSS=1460"
"83","Dec  8, 2024 14:51:14.174145294 IST","172.18.0.3","172.18.0.2","4567","61216","54","4567 → 61216 [RST, ACK] Seq=1 Ack=1 Win=0 Len=0"
"84","Dec  8, 2024 14:51:14.174153731 IST","172.18.0.2","172.18.0.3","61216","4449","58","61216 → 4449 [SYN] Seq=0 Win=1024 Len=0 MSS=1460"
"85","Dec  8, 2024 14:51:14.174156838 IST","172.18.0.3","172.18.0.2","4449","61216","54","4449 → 61216 [RST, ACK] Seq=1 Ack=1 Win=0 Len=0"
"86","Dec  8, 2024 14:51:14.174165694 IST","172.18.0.2","172.18.0.3","61216","2260","58","61216 → 2260 [SYN] Seq=0 Win=1024 Len=0 MSS=1460"
"87","Dec  8, 2024 14:51:14.174169265 IST","172.18.0.3","172.18.0.2","2260","61216","54","2260 → 61216 [RST, ACK] Seq=1 Ack=1 Win=0 Len=0"
"88","Dec  8, 2024 14:51:14.174178900 IST","172.18.0.2","172.18.0.3","61216","1094","58","61216 → 1094 [SYN] Seq=0 Win=1024 Len=0 MSS=1460"
"89","Dec  8, 2024 14:51:14.174181874 IST","172.18.0.3","172.18.0.2","1094","61216","54","1094 → 61216 [RST, ACK] Seq=1 Ack=1 Win=0 Len=0"
"90","Dec  8, 2024 14:51:14.174190527 IST","172.18.0.2","172.18.0.3","61216","3322","58","61216 → 3322 [SYN] Seq=0 Win=1024 Len=0 MSS=1460"
"91","Dec  8, 2024 14:51:14.174193290 IST","172.18.0.3","172.18.0.2","3322","61216","54","3322 → 61216 [RST, ACK] Seq=1 Ack=1 Win=0 Len=0"
"92","Dec  8, 2024 14:51:14.174226668 IST","172.18.0.2","172.18.0.3","61216","8089","58","61216 → 8089 [SYN] Seq=0 Win=1024 Len=0 MSS=1460"
"93","Dec  8, 2024 14:51:14.174230441 IST","172.18.0.3","172.18.0.2","8089","61216","54","8089 → 61216 [RST, ACK] Seq=1 Ack=1 Win=0 Len=0"
"94","Dec  8, 2024 14:51:14.174238761 IST","172.18.0.2","172.18.0.3","61216","8651","58","61216 → 8651 [SYN] Seq=0 Win=1024 Len=0 MSS=1460"
"95","Dec  8, 2024 14:51:14.174241785 IST","172.18.0.3","172.18.0.2","8651","61216","54","8651 → 61216 [RST, ACK] Seq=1 Ack=1 Win=0 Len=0"
"96","Dec  8, 2024 14:51:14.174250684 IST","172.18.0.2","172.18.0.3","61216","8873","58","61216 → 8873 [SYN] Seq=0 Win=1024 Len=0 MSS=1460"
"97","Dec  8, 2024 14:51:14.174253519 IST","172.18.0.3","172.18.0.2","8873","61216","54","8873 → 61216 [RST, ACK] Seq=1 Ack=1 Win=0 Len=0"
"98","Dec  8, 2024 14:51:14.174261791 IST","172.18.0.2","172.18.0.3","61216","311","58","61216 → 311 [SYN] Seq=0 Win=1024 Len=0 MSS=1460"
"99","Dec  8, 2024 14:51:14.174264618 IST","172.18.0.3","172.18.0.2","311","61216","54","311 → 61216 [RST, ACK] Seq=1 Ack=1 Win=0 Len=0"
"100","Dec  8, 2024 14:51:14.174272999 IST","172.18.0.2","172.18.0.3","61216","5087","58","61216 → 5087 [SYN] Seq=0 Win=1024 Len=0 MSS=1460"
"101","Dec  8, 2024 14:51:14.174287743 IST","172.18.0.3","172.18.0.2","5087","61216","54","5087 → 61216 [RST, ACK] Seq=1 Ack=1 Win=0 Len=0"
"102","Dec  8, 2024 14:51:14.174298933 IST","172.18.0.2","172.18.0.3","61216","10002","58","61216 → 10002 [SYN] Seq=0 Win=1024 Len=0 MSS=1460"
"103","Dec  8, 2024 14:51:14.174302237 IST","172.18.0.3","172.18.0.2","10002","61216","54","10002 → 61216 [RST, ACK] Seq=1 Ack=1 Win=0 Len=0"
"104","Dec  8, 2024 14:51:14.174310906 IST","172.18.0.2","172.18.0.3","61216","5214","58","61216 → 5214 [SYN] Seq=0 Win=1024 Len=0 MSS=1460"
"105","Dec  8, 2024 14:51:14.174314112 IST","172.18.0.3","172.18.0.2","5214","61216","54","5214 → 61216 [RST, ACK] Seq=1 Ack=1 Win=0 Len=0"
"106","Dec  8, 2024 14:51:14.174322766 IST","172.18.0.2","172.18.0.3","61216","50800","58","61216 → 50800 [SYN] Seq=0 Win=1024 Len=0 MSS=1460"
"107","Dec  8, 2024 14:51:14.174325528 IST","172.18.0.3","172.18.0.2","50800","61216","54","50800 → 61216 [RST, ACK] Seq=1 Ack=1 Win=0 Len=0"
"108","Dec  8, 2024 14:51:14.174334943 IST","172.18.0.2","172.18.0.3","61216","7800","58","61216 → 7800 [SYN] Seq=0 Win=1024 Len=0 MSS=1460"
"109","Dec  8, 2024 14:51:14.174337833 IST","172.18.0.3","172.18.0.2","7800","61216","54","7800 → 61216 [RST, ACK] Seq=1 Ack=1 Win=0 Len=0"
"110","Dec  8, 2024 14:51:14.174346858 IST","172.18.0.2","172.18.0.3","61216","1104","58","61216 → 1104 [SYN] Seq=0 Win=1024 Len=0 MSS=1460"
"111","Dec  8, 2024 14:51:14.174349812 IST","172.18.0.3","172.18.0.2","1104","61216","54","1104 → 61216 [RST, ACK] Seq=1 Ack=1 Win=0 Len=0"
"112","Dec  8, 2024 14:51:14.174371433 IST","172.18.0.2","172.18.0.3","61216","2393","58","61216 → 2393 [SYN] Seq=0 Win=1024 Len=0 MSS=1460"
"113","Dec  8, 2024 14:51:14.174374394 IST","172.18.0.3","172.18.0.2","2393","61216","54","2393 → 61216 [RST, ACK] Seq=1 Ack=1 Win=0 Len=0"
"114","Dec  8, 2024 14:51:14.174383233 IST","172.18.0.2","172.18.0.3","61216","749","58","61216 → 749 [SYN] Seq=0 Win=1024 Len=0 MSS=1460"
"115","Dec  8, 2024 14:51:14.174386235 IST","172.18.0.3","172.18.0.2","749","61216","54","749 → 61216 [RST, ACK] Seq=1 Ack=1 Win=0 Len=0"
"116","Dec  8, 2024 14:51:14.174395060 IST","172.18.0.2","172.18.0.3","61216","2191","58","61216 → 2191 [SYN] Seq=0 Win=1024 Len=0 MSS=1460"
"117","Dec  8, 2024 14:51:14.174397845 IST","172.18.0.3","172.18.0.2","2191","61216","54","2191 → 61216 [RST, ACK] Seq=1 Ack=1 Win=0 Len=0"
"118","Dec  8, 2024 14:51:14.174419937 IST","172.18.0.2","172.18.0.3","61216","3370","58","61216 → 3370 [SYN] Seq=0 Win=1024 Len=0 MSS=1460"
"119","Dec  8, 2024 14:51:14.174423242 IST","172.18.0.3","172.18.0.2","3370","61216","54","3370 → 61216 [RST, ACK] Seq=1 Ack=1 Win=0 Len=0"
"120","Dec  8, 2024 14:51:14.174432642 IST","172.18.0.2","172.18.0.3","61216","52822","58","61216 → 52822 [SYN] Seq=0 Win=1024 Len=0 MSS=1460"
"121","Dec  8, 2024 14:51:14.174435972 IST","172.18.0.3","172.18.0.2","52822","61216","54","52822 → 61216 [RST, ACK] Seq=1 Ack=1 Win=0 Len=0"
"122","Dec  8, 2024 14:51:14.174444502 IST","172.18.0.2","172.18.0.3","61216","2008","58","61216 → 2008 [SYN] Seq=0 Win=1024 Len=0 MSS=1460"
"123","Dec  8, 2024 14:51:14.174447239 IST","172.18.0.3","172.18.0.2","2008","61216","54","2008 → 61216 [RST, ACK] Seq=1 Ack=1 Win=0 Len=0"
"124","Dec  8, 2024 14:51:14.174456013 IST","172.18.0.2","172.18.0.3","61216","15004","58","61216 → 15004 [SYN] Seq=0 Win=1024 Len=0 MSS=1460"
"125","Dec  8, 2024 14:51:14.174458685 IST","172.18.0.3","172.18.0.2","15004","61216","54","15004 → 61216 [RST, ACK] Seq=1 Ack=1 Win=0 Len=0"
"126","Dec  8, 2024 14:51:14.174479201 IST","172.18.0.2","172.18.0.3","61216","2920","58","61216 → 2920 [SYN] Seq=0 Win=1024 Len=0 MSS=1460"
"127","Dec  8, 2024 14:51:14.174482427 IST","172.18.0.3","172.18.0.2","2920","61216","54","2920 → 61216 [RST, ACK] Seq=1 Ack=1 Win=0 Len=0"
"128","Dec  8, 2024 14:51:14.174492324 IST","172.18.0.2","172.18.0.3","61216","1073","58","61216 → 1073 [SYN] Seq=0 Win=1024 Len=0 MSS=1460"
"129","Dec  8, 2024 14:51:14.174495150 IST","172.18.0.3","172.18.0.2","1073","61216","54","1073 → 61216 [RST, ACK] Seq=1 Ack=1 Win=0 Len=0"
"130","Dec  8, 2024 14:51:14.174504036 IST","172.18.0.2","172.18.0.3","61216","1041","58","61216 → 1041 [SYN] Seq=0 Win=1024 Len=0 MSS=1460"
"131","Dec  8, 2024 14:51:14.174508209 IST","172.18.0.3","172.18.0.2","1041","61216","54","1041 → 61216 [RST, ACK] Seq=1 Ack=1 Win=0 Len=0"
"132","Dec  8, 2024 14:51:14.174516955 IST","172.18.0.2","172.18.0.3","61216","787","58","61216 → 787 [SYN] Seq=0 Win=1024 Len=0 MSS=1460"
"133","Dec  8, 2024 14:51:14.174519818 IST","172.18.0.3","172.18.0.2","787","61216","54","787 → 61216 [RST, ACK] Seq=1 Ack=1 Win=0 Len=0"
"134","Dec  8, 2024 14:51:14.174541194 IST","172.18.0.2","172.18.0.3","61216","55600","58","61216 → 55600 [SYN] Seq=0 Win=1024 Len=0 MSS=1460"
"135","Dec  8, 2024 14:51:14.174544065 IST","172.18.0.3","172.18.0.2","55600","61216","54","55600 → 61216 [RST, ACK] Seq=1 Ack=1 Win=0 Len=0"
"136","Dec  8, 2024 14:51:14.174552512 IST","172.18.0.2","172.18.0.3","61216","64623","58","61216 → 64623 [SYN] Seq=0 Win=1024 Len=0 MSS=1460"
"137","Dec  8, 2024 14:51:14.174555084 IST","172.18.0.3","172.18.0.2","64623","61216","54","64623 → 61216 [RST, ACK] Seq=1 Ack=1 Win=0 Len=0"
"138","Dec  8, 2024 14:51:14.174563846 IST","172.18.0.2","172.18.0.3","61216","3551","58","61216 → 3551 [SYN] Seq=0 Win=1024 Len=0 MSS=1460"
"139","Dec  8, 2024 14:51:14.174567331 IST","172.18.0.3","172.18.0.2","3551","61216","54","3551 → 61216 [RST, ACK] Seq=1 Ack=1 Win=0 Len=0"
"140","Dec  8, 2024 14:51:14.174575930 IST","172.18.0.2","172.18.0.3","61216","4321","58","61216 → 4321 [SYN] Seq=0 Win=1024 Len=0 MSS=1460"
"141","Dec  8, 2024 14:51:14.174578969 IST","172.18.0.3","172.18.0.2","4321","61216","54","4321 → 61216 [RST, ACK] Seq=1 Ack=1 Win=0 Len=0"
"142","Dec  8, 2024 14:51:14.174599829 IST","172.18.0.2","172.18.0.3","61216","7625","58","61216 → 7625 [SYN] Seq=0 Win=1024 Len=0 MSS=1460"
"143","Dec  8, 2024 14:51:14.174603382 IST","172.18.0.3","172.18.0.2","7625","61216","54","7625 → 61216 [RST, ACK] Seq=1 Ack=1 Win=0 Len=0"
"144","Dec  8, 2024 14:51:14.174686959 IST","172.18.0.2","172.18.0.3","61216","49155","58","61216 → 49155 [SYN] Seq=0 Win=1024 Len=0 MSS=1460"
"145","Dec  8, 2024 14:51:14.174691606 IST","172.18.0.3","172.18.0.2","49155","61216","54","49155 → 61216 [RST, ACK] Seq=1 Ack=1 Win=0 Len=0"
"146","Dec  8, 2024 14:51:14.174701505 IST","172.18.0.2","172.18.0.3","61216","5222","58","61216 → 5222 [SYN] Seq=0 Win=1024 Len=0 MSS=1460"
"147","Dec  8, 2024 14:51:14.174704334 IST","172.18.0.3","172.18.0.2","5222","61216","54","5222 → 61216 [RST, ACK] Seq=1 Ack=1 Win=0 Len=0"
"148","Dec  8, 2024 14:51:14.174713765 IST","172.18.0.2","172.18.0.3","61216","5440","58","61216 → 5440 [SYN] Seq=0 Win=1024 Len=0 MSS=1460"
"149","Dec  8, 2024 14:51:14.174716732 IST","172.18.0.3","172.18.0.2","5440","61216","54","5440 → 61216 [RST, ACK] Seq=1 Ack=1 Win=0 Len=0"
"150","Dec  8, 2024 14:51:14.174727143 IST","172.18.0.2","172.18.0.3","61216","5225","58","61216 → 5225 [SYN] Seq=0 Win=1024 Len=0 MSS=1460"
"151","Dec  8, 2024 14:51:14.174729890 IST","172.18.0.3","172.18.0.2","5225","61216","54","5225 → 61216 [RST, ACK] Seq=1 Ack=1 Win=0 Len=0"
"152","Dec  8, 2024 14:51:14.174738459 IST","172.18.0.2","172.18.0.3","61216","1021","58","61216 → 1021 [SYN] Seq=0 Win=1024 Len=0 MSS=1460"
"153","Dec  8, 2024 14:51:14.174741129 IST","172.18.0.3","172.18.0.2","1021","61216","54","1021 → 61216 [RST, ACK] Seq=1 Ack=1 Win=0 Len=0"
"154","Dec  8, 2024 14:51:14.174750692 IST","172.18.0.2","172.18.0.3","61216","2045","58","61216 → 2045 [SYN] Seq=0 Win=1024 Len=0 MSS=1460"
"155","Dec  8, 2024 14:51:14.174753376 IST","172.18.0.3","172.18.0.2","2045","61216","54","2045 → 61216 [RST, ACK] Seq=1 Ack=1 Win=0 Len=0"
"156","Dec  8, 2024 14:51:14.174761675 IST","172.18.0.2","172.18.0.3","61216","1840","58","61216 → 1840 [SYN] Seq=0 Win=1024 Len=0 MSS=1460"
"157","Dec  8, 2024 14:51:14.174765496 IST","172.18.0.3","172.18.0.2","1840","61216","54","1840 → 61216 [RST, ACK] Seq=1 Ack=1 Win=0 Len=0"
"158","Dec  8, 2024 14:51:14.174801178 IST","172.18.0.2","172.18.0.3","61216","26","58","61216 → 26 [SYN] Seq=0 Win=1024 Len=0 MSS=1460"
"159","Dec  8, 2024 14:51:14.174804613 IST","172.18.0.3","172.18.0.2","26","61216","54","26 → 61216 [RST, ACK] Seq=1 Ack=1 Win=0 Len=0"
"160","Dec  8, 2024 14:51:14.174813720 IST","172.18.0.2","172.18.0.3","61216","1271","58","61216 → 1271 [SYN] Seq=0 Win=1024 Len=0 MSS=1460"
"161","Dec  8, 2024 14:51:14.174816637 IST","172.18.0.3","172.18.0.2","1271","61216","54","1271 → 61216 [RST, ACK] Seq=1 Ack=1 Win=0 Len=0"
"162","Dec  8, 2024 14:51:14.174825156 IST","172.18.0.2","172.18.0.3","61216","5822","58","61216 → 5822 [SYN] Seq=0 Win=1024 Len=0 MSS=1460"
"163","Dec  8, 2024 14:51:14.174828103 IST","172.18.0.3","172.18.0.2","5822","61216","54","5822 → 61216 [RST, ACK] Seq=1 Ack=1 Win=0 Len=0"
"164","Dec  8, 2024 14:51:14.174836524 IST","172.18.0.2","172.18.0.3","61216","1045","58","61216 → 1045 [SYN] Seq=0 Win=1024 Len=0 MSS=1460"
"165","Dec  8, 2024 14:51:14.174839165 IST","172.18.0.3","172.18.0.2","1045","61216","54","1045 → 61216 [RST, ACK] Seq=1 Ack=1 Win=0 Len=0"
"166","Dec  8, 2024 14:51:14.174847705 IST","172.18.0.2","172.18.0.3","61216","31038","58","61216 → 31038 [SYN] Seq=0 Win=1024 Len=0 MSS=1460"
"167","Dec  8, 2024 14:51:14.174850449 IST","172.18.0.3","172.18.0.2","31038","61216","54","31038 → 61216 [RST, ACK] Seq=1 Ack=1 Win=0 Len=0"
"168","Dec  8, 2024 14:51:14.174858468 IST","172.18.0.2","172.18.0.3","61216","1063","58","61216 → 1063 [SYN] Seq=0 Win=1024 Len=0 MSS=1460"
"169","Dec  8, 2024 14:51:14.174861364 IST","172.18.0.3","172.18.0.2","1063","61216","54","1063 → 61216 [RST, ACK] Seq=1 Ack=1 Win=0 Len=0"
"170","Dec  8, 2024 14:51:14.174869380 IST","172.18.0.2","172.18.0.3","61216","5298","58","61216 → 5298 [SYN] Seq=0 Win=1024 Len=0 MSS=1460"
"171","Dec  8, 2024 14:51:14.174872012 IST","172.18.0.3","172.18.0.2","5298","61216","54","5298 → 61216 [RST, ACK] Seq=1 Ack=1 Win=0 Len=0"
"172","Dec  8, 2024 14:51:14.174880472 IST","172.18.0.2","172.18.0.3","61216","15002","58","61216 → 15002 [SYN] Seq=0 Win=1024 Len=0 MSS=1460"
"173","Dec  8, 2024 14:51:14.174883556 IST","172.18.0.3","172.18.0.2","15002","61216","54","15002 → 61216 [RST, ACK] Seq=1 Ack=1 Win=0 Len=0"
"174","Dec  8, 2024 14:51:14.174891997 IST","172.18.0.2","172.18.0.3","61216","10243","58","61216 → 10243 [SYN] Seq=0 Win=1024 Len=0 MSS=1460"
"175","Dec  8, 2024 14:51:14.174894759 IST","172.18.0.3","172.18.0.2","10243","61216","54","10243 → 61216 [RST, ACK] Seq=1 Ack=1 Win=0 Len=0"
"176","Dec  8, 2024 14:51:14.174903039 IST","172.18.0.2","172.18.0.3","61216","64680","58","61216 → 64680 [SYN] Seq=0 Win=1024 Len=0 MSS=1460"
"177","Dec  8, 2024 14:51:14.174905802 IST","172.18.0.3","172.18.0.2","64680","61216","54","64680 → 61216 [RST, ACK] Seq=1 Ack=1 Win=0 Len=0"
"178","Dec  8, 2024 14:51:14.174913790 IST","172.18.0.2","172.18.0.3","61216","711","58","61216 → 711 [SYN] Seq=0 Win=1024 Len=0 MSS=1460"
"179","Dec  8, 2024 14:51:14.174916813 IST","172.18.0.3","172.18.0.2","711","61216","54","711 → 61216 [RST, ACK] Seq=1 Ack=1 Win=0 Len=0"
"180","Dec  8, 2024 14:51:14.174925542 IST","172.18.0.2","172.18.0.3","61216","1947","58","61216 → 1947 [SYN] Seq=0 Win=1024 Len=0 MSS=1460"
"181","Dec  8, 2024 14:51:14.174928555 IST","172.18.0.3","172.18.0.2","1947","61216","54","1947 → 61216 [RST, ACK] Seq=1 Ack=1 Win=0 Len=0"
"182","Dec  8, 2024 14:51:14.174937992 IST","172.18.0.2","172.18.0.3","61216","2196","58","61216 → 2196 [SYN] Seq=0 Win=1024 Len=0 MSS=1460"
"183","Dec  8, 2024 14:51:14.174941536 IST","172.18.0.3","172.18.0.2","2196","61216","54","2196 → 61216 [RST, ACK] Seq=1 Ack=1 Win=0 Len=0"
"184","Dec  8, 2024 14:51:14.174949775 IST","172.18.0.2","172.18.0.3","61216","18040","58","61216 → 18040 [SYN] Seq=0 Win=1024 Len=0 MSS=1460"
"185","Dec  8, 2024 14:51:14.174952595 IST","172.18.0.3","172.18.0.2","18040","61216","54","18040 → 61216 [RST, ACK] Seq=1 Ack=1 Win=0 Len=0"
"186","Dec  8, 2024 14:51:14.174960930 IST","172.18.0.2","172.18.0.3","61216","1049","58","61216 → 1049 [SYN] Seq=0 Win=1024 Len=0 MSS=1460"
"187","Dec  8, 2024 14:51:14.174963755 IST","172.18.0.3","172.18.0.2","1049","61216","54","1049 → 61216 [RST, ACK] Seq=1 Ack=1 Win=0 Len=0"
"188","Dec  8, 2024 14:51:14.174971938 IST","172.18.0.2","172.18.0.3","61216","1130","58","61216 → 1130 [SYN] Seq=0 Win=1024 Len=0 MSS=1460"
"189","Dec  8, 2024 14:51:14.174974825 IST","172.18.0.3","172.18.0.2","1130","61216","54","1130 → 61216 [RST, ACK] Seq=1 Ack=1 Win=0 Len=0"
"190","Dec  8, 2024 14:51:14.174983019 IST","172.18.0.2","172.18.0.3","61216","1086","58","61216 → 1086 [SYN] Seq=0 Win=1024 Len=0 MSS=1460"
"191","Dec  8, 2024 14:51:14.174986197 IST","172.18.0.3","172.18.0.2","1086","61216","54","1086 → 61216 [RST, ACK] Seq=1 Ack=1 Win=0 Len=0"
"192","Dec  8, 2024 14:51:14.174994280 IST","172.18.0.2","172.18.0.3","61216","4446","58","61216 → 4446 [SYN] Seq=0 Win=1024 Len=0 MSS=1460"
"193","Dec  8, 2024 14:51:14.174997364 IST","172.18.0.3","172.18.0.2","4446","61216","54","4446 → 61216 [RST, ACK] Seq=1 Ack=1 Win=0 Len=0"
"194","Dec  8, 2024 14:51:14.175005482 IST","172.18.0.2","172.18.0.3","61216","5730","58","61216 → 5730 [SYN] Seq=0 Win=1024 Len=0 MSS=1460"
"195","Dec  8, 2024 14:51:14.175008379 IST","172.18.0.3","172.18.0.2","5730","61216","54","5730 → 61216 [RST, ACK] Seq=1 Ack=1 Win=0 Len=0"
"196","Dec  8, 2024 14:51:14.175016469 IST","172.18.0.2","172.18.0.3","61216","8085","58","61216 → 8085 [SYN] Seq=0 Win=1024 Len=0 MSS=1460"
"197","Dec  8, 2024 14:51:14.175019158 IST","172.18.0.3","172.18.0.2","8085","61216","54","8085 → 61216 [RST, ACK] Seq=1 Ack=1 Win=0 Len=0"
"198","Dec  8, 2024 14:51:14.175027525 IST","172.18.0.2","172.18.0.3","61216","5679","58","61216 → 5679 [SYN] Seq=0 Win=1024 Len=0 MSS=1460"
"199","Dec  8, 2024 14:51:14.175030226 IST","172.18.0.3","172.18.0.2","5679","61216","54","5679 → 61216 [RST, ACK] Seq=1 Ack=1 Win=0 Len=0"
"200","Dec  8, 2024 14:51:14.175038830 IST","172.18.0.2","172.18.0.3","61216","30000","58","61216 → 30000 [SYN] Seq=0 Win=1024 Len=0 MSS=1460"
"201","Dec  8, 2024 14:51:14.175041768 IST","172.18.0.3","172.18.0.2","30000","61216","54","30000 → 61216 [RST, ACK] Seq=1 Ack=1 Win=0 Len=0"
"202","Dec  8, 2024 14:51:14.175049987 IST","172.18.0.2","172.18.0.3","61216","49160","58","61216 → 49160 [SYN] Seq=0 Win=1024 Len=0 MSS=1460"
"203","Dec  8, 2024 14:51:14.175052852 IST","172.18.0.3","172.18.0.2","49160","61216","54","49160 → 61216 [RST, ACK] Seq=1 Ack=1 Win=0 Len=0"
"204","Dec  8, 2024 14:51:14.175061109 IST","172.18.0.2","172.18.0.3","61216","49157","58","61216 → 49157 [SYN] Seq=0 Win=1024 Len=0 MSS=1460"
"205","Dec  8, 2024 14:51:14.175064264 IST","172.18.0.3","172.18.0.2","49157","61216","54","49157 → 61216 [RST, ACK] Seq=1 Ack=1 Win=0 Len=0"
"206","Dec  8, 2024 14:51:14.175072976 IST","172.18.0.2","172.18.0.3","61216","6156","58","61216 → 6156 [SYN] Seq=0 Win=1024 Len=0 MSS=1460"
"207","Dec  8, 2024 14:51:14.175075672 IST","172.18.0.3","172.18.0.2","6156","61216","54","6156 → 61216 [RST, ACK] Seq=1 Ack=1 Win=0 Len=0"
"208","Dec  8, 2024 14:51:14.175083837 IST","172.18.0.2","172.18.0.3","61216","4443","58","61216 → 4443 [SYN] Seq=0 Win=1024 Len=0 MSS=1460"
"209","Dec  8, 2024 14:51:14.175086637 IST","172.18.0.3","172.18.0.2","4443","61216","54","4443 → 61216 [RST, ACK] Seq=1 Ack=1 Win=0 Len=0"
"210","Dec  8, 2024 14:51:14.175094651 IST","172.18.0.2","172.18.0.3","61216","1503","58","61216 → 1503 [SYN] Seq=0 Win=1024 Len=0 MSS=1460"
"211","Dec  8, 2024 14:51:14.175121567 IST","172.18.0.3","172.18.0.2","1503","61216","54","1503 → 61216 [RST, ACK] Seq=1 Ack=1 Win=0 Len=0"
"212","Dec  8, 2024 14:51:14.175132471 IST","172.18.0.2","172.18.0.3","61216","32785","58","61216 → 32785 [SYN] Seq=0 Win=1024 Len=0 MSS=1460"
"213","Dec  8, 2024 14:51:14.175135615 IST","172.18.0.3","172.18.0.2","32785","61216","54","32785 → 61216 [RST, ACK] Seq=1 Ack=1 Win=0 Len=0"
"214","Dec  8, 2024 14:51:14.175145357 IST","172.18.0.2","172.18.0.3","61216","5631","58","61216 → 5631 [SYN] Seq=0 Win=1024 Len=0 MSS=1460"
"215","Dec  8, 2024 14:51:14.175148233 IST","172.18.0.3","172.18.0.2","5631","61216","54","5631 → 61216 [RST, ACK] Seq=1 Ack=1 Win=0 Len=0"
"216","Dec  8, 2024 14:51:14.175156843 IST","172.18.0.2","172.18.0.3","61216","1085","58","61216 → 1085 [SYN] Seq=0 Win=1024 Len=0 MSS=1460"
"217","Dec  8, 2024 14:51:14.175159609 IST","172.18.0.3","172.18.0.2","1085","61216","54","1085 → 61216 [RST, ACK] Seq=1 Ack=1 Win=0 Len=0"
"218","Dec  8, 2024 14:51:14.175168916 IST","172.18.0.2","172.18.0.3","61216","625","58","61216 → 625 [SYN] Seq=0 Win=1024 Len=0 MSS=1460"
"219","Dec  8, 2024 14:51:14.175171643 IST","172.18.0.3","172.18.0.2","625","61216","54","625 → 61216 [RST, ACK] Seq=1 Ack=1 Win=0 Len=0"
"220","Dec  8, 2024 14:51:14.175179868 IST","172.18.0.2","172.18.0.3","61216","1075","58","61216 → 1075 [SYN] Seq=0 Win=1024 Len=0 MSS=1460"
"221","Dec  8, 2024 14:51:14.175182626 IST","172.18.0.3","172.18.0.2","1075","61216","54","1075 → 61216 [RST, ACK] Seq=1 Ack=1 Win=0 Len=0"
"222","Dec  8, 2024 14:51:14.175191117 IST","172.18.0.2","172.18.0.3","61216","8300","58","61216 → 8300 [SYN] Seq=0 Win=1024 Len=0 MSS=1460"
"223","Dec  8, 2024 14:51:14.175193839 IST","172.18.0.3","172.18.0.2","8300","61216","54","8300 → 61216 [RST, ACK] Seq=1 Ack=1 Win=0 Len=0"
"224","Dec  8, 2024 14:51:14.175202455 IST","172.18.0.2","172.18.0.3","61216","500","58","61216 → 500 [SYN] Seq=0 Win=1024 Len=0 MSS=1460"
"225","Dec  8, 2024 14:51:14.175205234 IST","172.18.0.3","172.18.0.2","500","61216","54","500 → 61216 [RST, ACK] Seq=1 Ack=1 Win=0 Len=0"
"226","Dec  8, 2024 14:51:14.175213641 IST","172.18.0.2","172.18.0.3","61216","4550","58","61216 → 4550 [SYN] Seq=0 Win=1024 Len=0 MSS=1460"
"227","Dec  8, 2024 14:51:14.175216363 IST","172.18.0.3","172.18.0.2","4550","61216","54","4550 → 61216 [RST, ACK] Seq=1 Ack=1 Win=0 Len=0"
"228","Dec  8, 2024 14:51:14.175226141 IST","172.18.0.2","172.18.0.3","61216","1081","58","61216 → 1081 [SYN] Seq=0 Win=1024 Len=0 MSS=1460"
"229","Dec  8, 2024 14:51:14.175228906 IST","172.18.0.3","172.18.0.2","1081","61216","54","1081 → 61216 [RST, ACK] Seq=1 Ack=1 Win=0 Len=0"
"230","Dec  8, 2024 14:51:14.175258383 IST","172.18.0.2","172.18.0.3","61216","2001","58","61216 → 2001 [SYN] Seq=0 Win=1024 Len=0 MSS=1460"
"231","Dec  8, 2024 14:51:14.175261617 IST","172.18.0.3","172.18.0.2","2001","61216","54","2001 → 61216 [RST, ACK] Seq=1 Ack=1 Win=0 Len=0"
"232","Dec  8, 2024 14:51:14.175271195 IST","172.18.0.2","172.18.0.3","61216","10778","58","61216 → 10778 [SYN] Seq=0 Win=1024 Len=0 MSS=1460"
"233","Dec  8, 2024 14:51:14.175274041 IST","172.18.0.3","172.18.0.2","10778","61216","54","10778 → 61216 [RST, ACK] Seq=1 Ack=1 Win=0 Len=0"
"234","Dec  8, 2024 14:51:14.175283108 IST","172.18.0.2","172.18.0.3","61216","1914","58","61216 → 1914 [SYN] Seq=0 Win=1024 Len=0 MSS=1460"
"235","Dec  8, 2024 14:51:14.175285968 IST","172.18.0.3","172.18.0.2","1914","61216","54","1914 → 61216 [RST, ACK] Seq=1 Ack=1 Win=0 Len=0"
"236","Dec  8, 2024 14:51:14.175294504 IST","172.18.0.2","172.18.0.3","61216","1972","58","61216 → 1972 [SYN] Seq=0 Win=1024 Len=0 MSS=1460"
"237","Dec  8, 2024 14:51:14.175297237 IST","172.18.0.3","172.18.0.2","1972","61216","54","1972 → 61216 [RST, ACK] Seq=1 Ack=1 Win=0 Len=0"
"238","Dec  8, 2024 14:51:14.175305593 IST","172.18.0.2","172.18.0.3","61216","2047","58","61216 → 2047 [SYN] Seq=0 Win=1024 Len=0 MSS=1460"
"239","Dec  8, 2024 14:51:14.175308400 IST","172.18.0.3","172.18.0.2","2047","61216","54","2047 → 61216 [RST, ACK] Seq=1 Ack=1 Win=0 Len=0"
"240","Dec  8, 2024 14:51:14.175329831 IST","172.18.0.2","172.18.0.3","61216","1131","58","61216 → 1131 [SYN] Seq=0 Win=1024 Len=0 MSS=1460"
"241","Dec  8, 2024 14:51:14.175332711 IST","172.18.0.3","172.18.0.2","1131","61216","54","1131 → 61216 [RST, ACK] Seq=1 Ack=1 Win=0 Len=0"
"242","Dec  8, 2024 14:51:14.175341568 IST","172.18.0.2","172.18.0.3","61216","27000","58","61216 → 27000 [SYN] Seq=0 Win=1024 Len=0 MSS=1460"
"243","Dec  8, 2024 14:51:14.175344419 IST","172.18.0.3","172.18.0.2","27000","61216","54","27000 → 61216 [RST, ACK] Seq=1 Ack=1 Win=0 Len=0"
"244","Dec  8, 2024 14:51:14.175455835 IST","172.18.0.2","172.18.0.3","61216","10626","58","61216 → 10626 [SYN] Seq=0 Win=1024 Len=0 MSS=1460"
"245","Dec  8, 2024 14:51:14.175461545 IST","172.18.0.3","172.18.0.2","10626","61216","54","10626 → 61216 [RST, ACK] Seq=1 Ack=1 Win=0 Len=0"
"246","Dec  8, 2024 14:51:14.175472139 IST","172.18.0.2","172.18.0.3","61216","2105","58","61216 → 2105 [SYN] Seq=0 Win=1024 Len=0 MSS=1460"
"247","Dec  8, 2024 14:51:14.175474921 IST","172.18.0.3","172.18.0.2","2105","61216","54","2105 → 61216 [RST, ACK] Seq=1 Ack=1 Win=0 Len=0"
"248","Dec  8, 2024 14:51:14.175483321 IST","172.18.0.2","172.18.0.3","61216","2007","58","61216 → 2007 [SYN] Seq=0 Win=1024 Len=0 MSS=1460"
"249","Dec  8, 2024 14:51:14.175486220 IST","172.18.0.3","172.18.0.2","2007","61216","54","2007 → 61216 [RST, ACK] Seq=1 Ack=1 Win=0 Len=0"
"250","Dec  8, 2024 14:51:14.175495040 IST","172.18.0.2","172.18.0.3","61216","44443","58","61216 → 44443 [SYN] Seq=0 Win=1024 Len=0 MSS=1460"
"251","Dec  8, 2024 14:51:14.175498044 IST","172.18.0.3","172.18.0.2","44443","61216","54","44443 → 61216 [RST, ACK] Seq=1 Ack=1 Win=0 Len=0"
"252","Dec  8, 2024 14:51:14.175506338 IST","172.18.0.2","172.18.0.3","61216","2251","58","61216 → 2251 [SYN] Seq=0 Win=1024 Len=0 MSS=1460"
"253","Dec  8, 2024 14:51:14.175509143 IST","172.18.0.3","172.18.0.2","2251","61216","54","2251 → 61216 [RST, ACK] Seq=1 Ack=1 Win=0 Len=0"
"254","Dec  8, 2024 14:51:14.175517605 IST","172.18.0.2","172.18.0.3","61216","50000","58","61216 → 50000 [SYN] Seq=0 Win=1024 Len=0 MSS=1460"
"255","Dec  8, 2024 14:51:14.175520672 IST","172.18.0.3","172.18.0.2","50000","61216","54","50000 → 61216 [RST, ACK] Seq=1 Ack=1 Win=0 Len=0"
"256","Dec  8, 2024 14:51:14.175529015 IST","172.18.0.2","172.18.0.3","61216","617","58","61216 → 617 [SYN] Seq=0 Win=1024 Len=0 MSS=1460"
"257","Dec  8, 2024 14:51:14.175532891 IST","172.18.0.3","172.18.0.2","617","61216","54","617 → 61216 [RST, ACK] Seq=1 Ack=1 Win=0 Len=0"
"258","Dec  8, 2024 14:51:14.175542558 IST","172.18.0.2","172.18.0.3","61216","7496","58","61216 → 7496 [SYN] Seq=0 Win=1024 Len=0 MSS=1460"
"259","Dec  8, 2024 14:51:14.175545436 IST","172.18.0.3","172.18.0.2","7496","61216","54","7496 → 61216 [RST, ACK] Seq=1 Ack=1 Win=0 Len=0"
"260","Dec  8, 2024 14:51:14.175575477 IST","172.18.0.2","172.18.0.3","61216","3971","58","61216 → 3971 [SYN] Seq=0 Win=1024 Len=0 MSS=1460"
"261","Dec  8, 2024 14:51:14.175579091 IST","172.18.0.3","172.18.0.2","3971","61216","54","3971 → 61216 [RST, ACK] Seq=1 Ack=1 Win=0 Len=0"
"262","Dec  8, 2024 14:51:14.175588875 IST","172.18.0.2","172.18.0.3","61216","17877","58","61216 → 17877 [SYN] Seq=0 Win=1024 Len=0 MSS=1460"
"263","Dec  8, 2024 14:51:14.175591813 IST","172.18.0.3","172.18.0.2","17877","61216","54","17877 → 61216 [RST, ACK] Seq=1 Ack=1 Win=0 Len=0"
"264","Dec  8, 2024 14:51:14.175600714 IST","172.18.0.2","172.18.0.3","61216","2998","58","61216 → 2998 [SYN] Seq=0 Win=1024 Len=0 MSS=1460"
"265","Dec  8, 2024 14:51:14.175603521 IST","172.18.0.3","172.18.0.2","2998","61216","54","2998 → 61216 [RST, ACK] Seq=1 Ack=1 Win=0 Len=0"
"266","Dec  8, 2024 14:51:14.175613027 IST","172.18.0.2","172.18.0.3","61216","646","58","61216 → 646 [SYN] Seq=0 Win=1024 Len=0 MSS=1460"
"267","Dec  8, 2024 14:51:14.175615889 IST","172.18.0.3","172.18.0.2","646","61216","54","646 → 61216 [RST, ACK] Seq=1 Ack=1 Win=0 Len=0"
"268","Dec  8, 2024 14:51:14.175624679 IST","172.18.0.2","172.18.0.3","61216","1064","58","61216 → 1064 [SYN] Seq=0 Win=1024 Len=0 MSS=1460"
"269","Dec  8, 2024 14:51:14.175627888 IST","172.18.0.3","172.18.0.2","1064","61216","54","1064 → 61216 [RST, ACK] Seq=1 Ack=1 Win=0 Len=0"
"270","Dec  8, 2024 14:51:14.175636606 IST","172.18.0.2","172.18.0.3","61216","1145","58","61216 → 1145 [SYN] Seq=0 Win=1024 Len=0 MSS=1460"
"271","Dec  8, 2024 14:51:14.175639357 IST","172.18.0.3","172.18.0.2","1145","61216","54","1145 → 61216 [RST, ACK] Seq=1 Ack=1 Win=0 Len=0"
"272","Dec  8, 2024 14:51:14.175647982 IST","172.18.0.2","172.18.0.3","61216","10621","58","61216 → 10621 [SYN] Seq=0 Win=1024 Len=0 MSS=1460"
"273","Dec  8, 2024 14:51:14.175650668 IST","172.18.0.3","172.18.0.2","10621","61216","54","10621 → 61216 [RST, ACK] Seq=1 Ack=1 Win=0 Len=0"
"274","Dec  8, 2024 14:51:14.175660020 IST","172.18.0.2","172.18.0.3","61216","1217","58","61216 → 1217 [SYN] Seq=0 Win=1024 Len=0 MSS=1460"
"275","Dec  8, 2024 14:51:14.175662820 IST","172.18.0.3","172.18.0.2","1217","61216","54","1217 → 61216 [RST, ACK] Seq=1 Ack=1 Win=0 Len=0"
"276","Dec  8, 2024 14:51:14.175671442 IST","172.18.0.2","172.18.0.3","61216","667","58","61216 → 667 [SYN] Seq=0 Win=1024 Len=0 MSS=1460"
"277","Dec  8, 2024 14:51:14.175674312 IST","172.18.0.3","172.18.0.2","667","61216","54","667 → 61216 [RST, ACK] Seq=1 Ack=1 Win=0 Len=0"
"278","Dec  8, 2024 14:51:14.175682555 IST","172.18.0.2","172.18.0.3","61216","56738","58","61216 → 56738 [SYN] Seq=0 Win=1024 Len=0 MSS=1460"
"279","Dec  8, 2024 14:51:14.175685996 IST","172.18.0.3","172.18.0.2","56738","61216","54","56738 → 61216 [RST, ACK] Seq=1 Ack=1 Win=0 Len=0"
"280","Dec  8, 2024 14:51:14.175694111 IST","172.18.0.2","172.18.0.3","61216","3814","58","61216 → 3814 [SYN] Seq=0 Win=1024 Len=0 MSS=1460"
"281","Dec  8, 2024 14:51:14.175696902 IST","172.18.0.3","172.18.0.2","3814","61216","54","3814 → 61216 [RST, ACK] Seq=1 Ack=1 Win=0 Len=0"
"282","Dec  8, 2024 14:51:14.175705173 IST","172.18.0.2","172.18.0.3","61216","3017","58","61216 → 3017 [SYN] Seq=0 Win=1024 Len=0 MSS=1460"
"283","Dec  8, 2024 14:51:14.175708073 IST","172.18.0.3","172.18.0.2","3017","61216","54","3017 → 61216 [RST, ACK] Seq=1 Ack=1 Win=0 Len=0"
"284","Dec  8, 2024 14:51:14.175732136 IST","172.18.0.2","172.18.0.3","61216","3703","58","61216 → 3703 [SYN] Seq=0 Win=1024 Len=0 MSS=1460"
"285","Dec  8, 2024 14:51:14.175735723 IST","172.18.0.3","172.18.0.2","3703","61216","54","3703 → 61216 [RST, ACK] Seq=1 Ack=1 Win=0 Len=0"
