frame.number,frame.time,ip.src,ip.dst,tcp.srcport,tcp.dstport,frame.len,_ws.col.Info
"1","Dec 10, 2024 20:16:59.263571756 IST",,,,,"42","Who has 172.18.0.3? Tell 172.18.0.2"
"2","Dec 10, 2024 20:16:59.263589158 IST",,,,,"42","172.18.0.3 is at 02:42:ac:12:00:03"
"3","Dec 10, 2024 20:16:59.533439972 IST","172.18.0.2","172.18.0.3","52006","8080","58","52006 → 8080 [SYN] Seq=0 Win=1024 Len=0 MSS=1460"
"4","Dec 10, 2024 20:16:59.533464854 IST","172.18.0.3","172.18.0.2","8080","52006","54","8080 → 52006 [RST, ACK] Seq=1 Ack=1 Win=0 Len=0"
"5","Dec 10, 2024 20:16:59.533488460 IST","172.18.0.2","172.18.0.3","52006","80","58","52006 → 80 [SYN] Seq=0 Win=1024 Len=0 MSS=1460"
"6","Dec 10, 2024 20:16:59.533500334 IST","172.18.0.3","172.18.0.2","80","52006","58","80 → 52006 [SYN, ACK] Seq=0 Ack=1 Win=64240 Len=0 MSS=1460"
"7","Dec 10, 2024 20:16:59.533510880 IST","172.18.0.2","172.18.0.3","52006","80","54","52006 → 80 [RST] Seq=1 Win=0 Len=0"
"8","Dec 10, 2024 20:16:59.533523573 IST","172.18.0.2","172.18.0.3","52006","111","58","52006 → 111 [SYN] Seq=0 Win=1024 Len=0 MSS=1460"
"9","Dec 10, 2024 20:16:59.533528063 IST","172.18.0.3","172.18.0.2","111","52006","54","111 → 52006 [RST, ACK] Seq=1 Ack=1 Win=0 Len=0"
"10","Dec 10, 2024 20:16:59.533542010 IST","172.18.0.2","172.18.0.3","52006","1720","58","52006 → 1720 [SYN] Seq=0 Win=1024 Len=0 MSS=1460"
"11","Dec 10, 2024 20:16:59.533546212 IST","172.18.0.3","172.18.0.2","1720","52006","54","1720 → 52006 [RST, ACK] Seq=1 Ack=1 Win=0 Len=0"
"12","Dec 10, 2024 20:16:59.533558890 IST","172.18.0.2","172.18.0.3","52006","22","58","52006 → 22 [SYN] Seq=0 Win=1024 Len=0 MSS=1460"
"13","Dec 10, 2024 20:16:59.533562490 IST","172.18.0.3","172.18.0.2","22","52006","54","22 → 52006 [RST, ACK] Seq=1 Ack=1 Win=0 Len=0"
"14","Dec 10, 2024 20:16:59.533574960 IST","172.18.0.2","172.18.0.3","52006","8888","58","52006 → 8888 [SYN] Seq=0 Win=1024 Len=0 MSS=1460"
"15","Dec 10, 2024 20:16:59.533579148 IST","172.18.0.3","172.18.0.2","8888","52006","54","8888 → 52006 [RST, ACK] Seq=1 Ack=1 Win=0 Len=0"
"16","Dec 10, 2024 20:16:59.533591088 IST","172.18.0.2","172.18.0.3","52006","1025","58","52006 → 1025 [SYN] Seq=0 Win=1024 Len=0 MSS=1460"
"17","Dec 10, 2024 20:16:59.533595010 IST","172.18.0.3","172.18.0.2","1025","52006","54","1025 → 52006 [RST, ACK] Seq=1 Ack=1 Win=0 Len=0"
"18","Dec 10, 2024 20:16:59.533607365 IST","172.18.0.2","172.18.0.3","52006","139","58","52006 → 139 [SYN] Seq=0 Win=1024 Len=0 MSS=1460"
"19","Dec 10, 2024 20:16:59.533611201 IST","172.18.0.3","172.18.0.2","139","52006","54","139 → 52006 [RST, ACK] Seq=1 Ack=1 Win=0 Len=0"
"20","Dec 10, 2024 20:16:59.533622804 IST","172.18.0.2","172.18.0.3","52006","143","58","52006 → 143 [SYN] Seq=0 Win=1024 Len=0 MSS=1460"
"21","Dec 10, 2024 20:16:59.533626436 IST","172.18.0.3","172.18.0.2","143","52006","54","143 → 52006 [RST, ACK] Seq=1 Ack=1 Win=0 Len=0"
"22","Dec 10, 2024 20:16:59.533638514 IST","172.18.0.2","172.18.0.3","52006","587","58","52006 → 587 [SYN] Seq=0 Win=1024 Len=0 MSS=1460"
"23","Dec 10, 2024 20:16:59.533642259 IST","172.18.0.3","172.18.0.2","587","52006","54","587 → 52006 [RST, ACK] Seq=1 Ack=1 Win=0 Len=0"
"24","Dec 10, 2024 20:16:59.533703099 IST","172.18.0.2","172.18.0.3","52006","21","58","52006 → 21 [SYN] Seq=0 Win=1024 Len=0 MSS=1460"
"25","Dec 10, 2024 20:16:59.533708314 IST","172.18.0.3","172.18.0.2","21","52006","54","21 → 52006 [RST, ACK] Seq=1 Ack=1 Win=0 Len=0"
"26","Dec 10, 2024 20:16:59.533720750 IST","172.18.0.2","172.18.0.3","52006","5900","58","52006 → 5900 [SYN] Seq=0 Win=1024 Len=0 MSS=1460"
"27","Dec 10, 2024 20:16:59.533724794 IST","172.18.0.3","172.18.0.2","5900","52006","54","5900 → 52006 [RST, ACK] Seq=1 Ack=1 Win=0 Len=0"
"28","Dec 10, 2024 20:16:59.533739702 IST","172.18.0.2","172.18.0.3","52006","199","58","52006 → 199 [SYN] Seq=0 Win=1024 Len=0 MSS=1460"
"29","Dec 10, 2024 20:16:59.533744009 IST","172.18.0.3","172.18.0.2","199","52006","54","199 → 52006 [RST, ACK] Seq=1 Ack=1 Win=0 Len=0"
"30","Dec 10, 2024 20:16:59.533757175 IST","172.18.0.2","172.18.0.3","52006","25","58","52006 → 25 [SYN] Seq=0 Win=1024 Len=0 MSS=1460"
"31","Dec 10, 2024 20:16:59.533761753 IST","172.18.0.3","172.18.0.2","25","52006","54","25 → 52006 [RST, ACK] Seq=1 Ack=1 Win=0 Len=0"
"32","Dec 10, 2024 20:16:59.533773894 IST","172.18.0.2","172.18.0.3","52006","113","58","52006 → 113 [SYN] Seq=0 Win=1024 Len=0 MSS=1460"
"33","Dec 10, 2024 20:16:59.533777280 IST","172.18.0.3","172.18.0.2","113","52006","54","113 → 52006 [RST, ACK] Seq=1 Ack=1 Win=0 Len=0"
"34","Dec 10, 2024 20:16:59.533789466 IST","172.18.0.2","172.18.0.3","52006","53","58","52006 → 53 [SYN] Seq=0 Win=1024 Len=0 MSS=1460"
"35","Dec 10, 2024 20:16:59.533793017 IST","172.18.0.3","172.18.0.2","53","52006","54","53 → 52006 [RST, ACK] Seq=1 Ack=1 Win=0 Len=0"
"36","Dec 10, 2024 20:16:59.533804871 IST","172.18.0.2","172.18.0.3","52006","443","58","52006 → 443 [SYN] Seq=0 Win=1024 Len=0 MSS=1460"
"37","Dec 10, 2024 20:16:59.533808883 IST","172.18.0.3","172.18.0.2","443","52006","54","443 → 52006 [RST, ACK] Seq=1 Ack=1 Win=0 Len=0"
"38","Dec 10, 2024 20:16:59.533820845 IST","172.18.0.2","172.18.0.3","52006","554","58","52006 → 554 [SYN] Seq=0 Win=1024 Len=0 MSS=1460"
"39","Dec 10, 2024 20:16:59.533824475 IST","172.18.0.3","172.18.0.2","554","52006","54","554 → 52006 [RST, ACK] Seq=1 Ack=1 Win=0 Len=0"
"40","Dec 10, 2024 20:16:59.533836607 IST","172.18.0.2","172.18.0.3","52006","110","58","52006 → 110 [SYN] Seq=0 Win=1024 Len=0 MSS=1460"
"41","Dec 10, 2024 20:16:59.533840587 IST","172.18.0.3","172.18.0.2","110","52006","54","110 → 52006 [RST, ACK] Seq=1 Ack=1 Win=0 Len=0"
"42","Dec 10, 2024 20:16:59.533853243 IST","172.18.0.2","172.18.0.3","52006","993","58","52006 → 993 [SYN] Seq=0 Win=1024 Len=0 MSS=1460"
"43","Dec 10, 2024 20:16:59.533857109 IST","172.18.0.3","172.18.0.2","993","52006","54","993 → 52006 [RST, ACK] Seq=1 Ack=1 Win=0 Len=0"
"44","Dec 10, 2024 20:16:59.533870000 IST","172.18.0.2","172.18.0.3","52006","23","58","52006 → 23 [SYN] Seq=0 Win=1024 Len=0 MSS=1460"
"45","Dec 10, 2024 20:16:59.533873438 IST","172.18.0.3","172.18.0.2","23","52006","54","23 → 52006 [RST, ACK] Seq=1 Ack=1 Win=0 Len=0"
"46","Dec 10, 2024 20:16:59.533885622 IST","172.18.0.2","172.18.0.3","52006","445","58","52006 → 445 [SYN] Seq=0 Win=1024 Len=0 MSS=1460"
"47","Dec 10, 2024 20:16:59.533889100 IST","172.18.0.3","172.18.0.2","445","52006","54","445 → 52006 [RST, ACK] Seq=1 Ack=1 Win=0 Len=0"
"48","Dec 10, 2024 20:16:59.533900887 IST","172.18.0.2","172.18.0.3","52006","3306","58","52006 → 3306 [SYN] Seq=0 Win=1024 Len=0 MSS=1460"
"49","Dec 10, 2024 20:16:59.533904519 IST","172.18.0.3","172.18.0.2","3306","52006","54","3306 → 52006 [RST, ACK] Seq=1 Ack=1 Win=0 Len=0"
"50","Dec 10, 2024 20:16:59.533916076 IST","172.18.0.2","172.18.0.3","52006","3389","58","52006 → 3389 [SYN] Seq=0 Win=1024 Len=0 MSS=1460"
"51","Dec 10, 2024 20:16:59.533919777 IST","172.18.0.3","172.18.0.2","3389","52006","54","3389 → 52006 [RST, ACK] Seq=1 Ack=1 Win=0 Len=0"
"52","Dec 10, 2024 20:16:59.533931303 IST","172.18.0.2","172.18.0.3","52006","256","58","52006 → 256 [SYN] Seq=0 Win=1024 Len=0 MSS=1460"
"53","Dec 10, 2024 20:16:59.533934933 IST","172.18.0.3","172.18.0.2","256","52006","54","256 → 52006 [RST, ACK] Seq=1 Ack=1 Win=0 Len=0"
"54","Dec 10, 2024 20:16:59.533947890 IST","172.18.0.2","172.18.0.3","52006","135","58","52006 → 135 [SYN] Seq=0 Win=1024 Len=0 MSS=1460"
"55","Dec 10, 2024 20:16:59.533951469 IST","172.18.0.3","172.18.0.2","135","52006","54","135 → 52006 [RST, ACK] Seq=1 Ack=1 Win=0 Len=0"
"56","Dec 10, 2024 20:16:59.533963400 IST","172.18.0.2","172.18.0.3","52006","995","58","52006 → 995 [SYN] Seq=0 Win=1024 Len=0 MSS=1460"
"57","Dec 10, 2024 20:16:59.533966836 IST","172.18.0.3","172.18.0.2","995","52006","54","995 → 52006 [RST, ACK] Seq=1 Ack=1 Win=0 Len=0"
"58","Dec 10, 2024 20:16:59.533978190 IST","172.18.0.2","172.18.0.3","52006","1723","58","52006 → 1723 [SYN] Seq=0 Win=1024 Len=0 MSS=1460"
"59","Dec 10, 2024 20:16:59.533981815 IST","172.18.0.3","172.18.0.2","1723","52006","54","1723 → 52006 [RST, ACK] Seq=1 Ack=1 Win=0 Len=0"
"60","Dec 10, 2024 20:16:59.533993771 IST","172.18.0.2","172.18.0.3","52006","49176","58","52006 → 49176 [SYN] Seq=0 Win=1024 Len=0 MSS=1460"
"61","Dec 10, 2024 20:16:59.533997541 IST","172.18.0.3","172.18.0.2","49176","52006","54","49176 → 52006 [RST, ACK] Seq=1 Ack=1 Win=0 Len=0"
"62","Dec 10, 2024 20:16:59.534009304 IST","172.18.0.2","172.18.0.3","52006","12174","58","52006 → 12174 [SYN] Seq=0 Win=1024 Len=0 MSS=1460"
"63","Dec 10, 2024 20:16:59.534013207 IST","172.18.0.3","172.18.0.2","12174","52006","54","12174 → 52006 [RST, ACK] Seq=1 Ack=1 Win=0 Len=0"
"64","Dec 10, 2024 20:16:59.534067315 IST","172.18.0.2","172.18.0.3","52006","27356","58","52006 → 27356 [SYN] Seq=0 Win=1024 Len=0 MSS=1460"
"65","Dec 10, 2024 20:16:59.534071637 IST","172.18.0.3","172.18.0.2","27356","52006","54","27356 → 52006 [RST, ACK] Seq=1 Ack=1 Win=0 Len=0"
"66","Dec 10, 2024 20:16:59.534084521 IST","172.18.0.2","172.18.0.3","52006","15004","58","52006 → 15004 [SYN] Seq=0 Win=1024 Len=0 MSS=1460"
"67","Dec 10, 2024 20:16:59.534088175 IST","172.18.0.3","172.18.0.2","15004","52006","54","15004 → 52006 [RST, ACK] Seq=1 Ack=1 Win=0 Len=0"
"68","Dec 10, 2024 20:16:59.534104037 IST","172.18.0.2","172.18.0.3","52006","4045","58","52006 → 4045 [SYN] Seq=0 Win=1024 Len=0 MSS=1460"
"69","Dec 10, 2024 20:16:59.534107966 IST","172.18.0.3","172.18.0.2","4045","52006","54","4045 → 52006 [RST, ACK] Seq=1 Ack=1 Win=0 Len=0"
"70","Dec 10, 2024 20:16:59.534120088 IST","172.18.0.2","172.18.0.3","52006","20221","58","52006 → 20221 [SYN] Seq=0 Win=1024 Len=0 MSS=1460"
"71","Dec 10, 2024 20:16:59.534123563 IST","172.18.0.3","172.18.0.2","20221","52006","54","20221 → 52006 [RST, ACK] Seq=1 Ack=1 Win=0 Len=0"
"72","Dec 10, 2024 20:16:59.534136001 IST","172.18.0.2","172.18.0.3","52006","8400","58","52006 → 8400 [SYN] Seq=0 Win=1024 Len=0 MSS=1460"
"73","Dec 10, 2024 20:16:59.534139633 IST","172.18.0.3","172.18.0.2","8400","52006","54","8400 → 52006 [RST, ACK] Seq=1 Ack=1 Win=0 Len=0"
"74","Dec 10, 2024 20:16:59.534151251 IST","172.18.0.2","172.18.0.3","52006","563","58","52006 → 563 [SYN] Seq=0 Win=1024 Len=0 MSS=1460"
"75","Dec 10, 2024 20:16:59.534154704 IST","172.18.0.3","172.18.0.2","563","52006","54","563 → 52006 [RST, ACK] Seq=1 Ack=1 Win=0 Len=0"
"76","Dec 10, 2024 20:16:59.534166173 IST","172.18.0.2","172.18.0.3","52006","222","58","52006 → 222 [SYN] Seq=0 Win=1024 Len=0 MSS=1460"
"77","Dec 10, 2024 20:16:59.534169845 IST","172.18.0.3","172.18.0.2","222","52006","54","222 → 52006 [RST, ACK] Seq=1 Ack=1 Win=0 Len=0"
"78","Dec 10, 2024 20:16:59.534182840 IST","172.18.0.2","172.18.0.3","52006","1031","58","52006 → 1031 [SYN] Seq=0 Win=1024 Len=0 MSS=1460"
"79","Dec 10, 2024 20:16:59.534186810 IST","172.18.0.3","172.18.0.2","1031","52006","54","1031 → 52006 [RST, ACK] Seq=1 Ack=1 Win=0 Len=0"
"80","Dec 10, 2024 20:16:59.534198841 IST","172.18.0.2","172.18.0.3","52006","1494","58","52006 → 1494 [SYN] Seq=0 Win=1024 Len=0 MSS=1460"
"81","Dec 10, 2024 20:16:59.534202479 IST","172.18.0.3","172.18.0.2","1494","52006","54","1494 → 52006 [RST, ACK] Seq=1 Ack=1 Win=0 Len=0"
"82","Dec 10, 2024 20:16:59.534215259 IST","172.18.0.2","172.18.0.3","52006","1148","58","52006 → 1148 [SYN] Seq=0 Win=1024 Len=0 MSS=1460"
"83","Dec 10, 2024 20:16:59.534218963 IST","172.18.0.3","172.18.0.2","1148","52006","54","1148 → 52006 [RST, ACK] Seq=1 Ack=1 Win=0 Len=0"
"84","Dec 10, 2024 20:16:59.534231172 IST","172.18.0.2","172.18.0.3","52006","2049","58","52006 → 2049 [SYN] Seq=0 Win=1024 Len=0 MSS=1460"
"85","Dec 10, 2024 20:16:59.534236486 IST","172.18.0.3","172.18.0.2","2049","52006","54","2049 → 52006 [RST, ACK] Seq=1 Ack=1 Win=0 Len=0"
"86","Dec 10, 2024 20:16:59.534249329 IST","172.18.0.2","172.18.0.3","52006","9502","58","52006 → 9502 [SYN] Seq=0 Win=1024 Len=0 MSS=1460"
"87","Dec 10, 2024 20:16:59.534253265 IST","172.18.0.3","172.18.0.2","9502","52006","54","9502 → 52006 [RST, ACK] Seq=1 Ack=1 Win=0 Len=0"
"88","Dec 10, 2024 20:16:59.534265393 IST","172.18.0.2","172.18.0.3","52006","2100","58","52006 → 2100 [SYN] Seq=0 Win=1024 Len=0 MSS=1460"
"89","Dec 10, 2024 20:16:59.534268739 IST","172.18.0.3","172.18.0.2","2100","52006","54","2100 → 52006 [RST, ACK] Seq=1 Ack=1 Win=0 Len=0"
"90","Dec 10, 2024 20:16:59.534280303 IST","172.18.0.2","172.18.0.3","52006","5225","58","52006 → 5225 [SYN] Seq=0 Win=1024 Len=0 MSS=1460"
"91","Dec 10, 2024 20:16:59.534283819 IST","172.18.0.3","172.18.0.2","5225","52006","54","5225 → 52006 [RST, ACK] Seq=1 Ack=1 Win=0 Len=0"
"92","Dec 10, 2024 20:16:59.534295695 IST","172.18.0.2","172.18.0.3","52006","1080","58","52006 → 1080 [SYN] Seq=0 Win=1024 Len=0 MSS=1460"
"93","Dec 10, 2024 20:16:59.534299231 IST","172.18.0.3","172.18.0.2","1080","52006","54","1080 → 52006 [RST, ACK] Seq=1 Ack=1 Win=0 Len=0"
"94","Dec 10, 2024 20:16:59.534311003 IST","172.18.0.2","172.18.0.3","52006","3325","58","52006 → 3325 [SYN] Seq=0 Win=1024 Len=0 MSS=1460"
"95","Dec 10, 2024 20:16:59.534314691 IST","172.18.0.3","172.18.0.2","3325","52006","54","3325 → 52006 [RST, ACK] Seq=1 Ack=1 Win=0 Len=0"
"96","Dec 10, 2024 20:16:59.534326097 IST","172.18.0.2","172.18.0.3","52006","10012","58","52006 → 10012 [SYN] Seq=0 Win=1024 Len=0 MSS=1460"
"97","Dec 10, 2024 20:16:59.534329769 IST","172.18.0.3","172.18.0.2","10012","52006","54","10012 → 52006 [RST, ACK] Seq=1 Ack=1 Win=0 Len=0"
"98","Dec 10, 2024 20:16:59.534341585 IST","172.18.0.2","172.18.0.3","52006","24444","58","52006 → 24444 [SYN] Seq=0 Win=1024 Len=0 MSS=1460"
"99","Dec 10, 2024 20:16:59.534345045 IST","172.18.0.3","172.18.0.2","24444","52006","54","24444 → 52006 [RST, ACK] Seq=1 Ack=1 Win=0 Len=0"
"100","Dec 10, 2024 20:16:59.534357669 IST","172.18.0.2","172.18.0.3","52006","5988","58","52006 → 5988 [SYN] Seq=0 Win=1024 Len=0 MSS=1460"
"101","Dec 10, 2024 20:16:59.534361293 IST","172.18.0.3","172.18.0.2","5988","52006","54","5988 → 52006 [RST, ACK] Seq=1 Ack=1 Win=0 Len=0"
"102","Dec 10, 2024 20:16:59.534372783 IST","172.18.0.2","172.18.0.3","52006","1145","58","52006 → 1145 [SYN] Seq=0 Win=1024 Len=0 MSS=1460"
"103","Dec 10, 2024 20:16:59.534376197 IST","172.18.0.3","172.18.0.2","1145","52006","54","1145 → 52006 [RST, ACK] Seq=1 Ack=1 Win=0 Len=0"
"104","Dec 10, 2024 20:16:59.534388226 IST","172.18.0.2","172.18.0.3","52006","65389","58","52006 → 65389 [SYN] Seq=0 Win=1024 Len=0 MSS=1460"
"105","Dec 10, 2024 20:16:59.534391671 IST","172.18.0.3","172.18.0.2","65389","52006","54","65389 → 52006 [RST, ACK] Seq=1 Ack=1 Win=0 Len=0"
"106","Dec 10, 2024 20:16:59.534403554 IST","172.18.0.2","172.18.0.3","52006","20000","58","52006 → 20000 [SYN] Seq=0 Win=1024 Len=0 MSS=1460"
"107","Dec 10, 2024 20:16:59.534407008 IST","172.18.0.3","172.18.0.2","20000","52006","54","20000 → 52006 [RST, ACK] Seq=1 Ack=1 Win=0 Len=0"
"108","Dec 10, 2024 20:16:59.534418727 IST","172.18.0.2","172.18.0.3","52006","16000","58","52006 → 16000 [SYN] Seq=0 Win=1024 Len=0 MSS=1460"
"109","Dec 10, 2024 20:16:59.534422138 IST","172.18.0.3","172.18.0.2","16000","52006","54","16000 → 52006 [RST, ACK] Seq=1 Ack=1 Win=0 Len=0"
"110","Dec 10, 2024 20:16:59.534433483 IST","172.18.0.2","172.18.0.3","52006","42","58","52006 → 42 [SYN] Seq=0 Win=1024 Len=0 MSS=1460"
"111","Dec 10, 2024 20:16:59.534436969 IST","172.18.0.3","172.18.0.2","42","52006","54","42 → 52006 [RST, ACK] Seq=1 Ack=1 Win=0 Len=0"
"112","Dec 10, 2024 20:16:59.534448681 IST","172.18.0.2","172.18.0.3","52006","3367","58","52006 → 3367 [SYN] Seq=0 Win=1024 Len=0 MSS=1460"
"113","Dec 10, 2024 20:16:59.534452184 IST","172.18.0.3","172.18.0.2","3367","52006","54","3367 → 52006 [RST, ACK] Seq=1 Ack=1 Win=0 Len=0"
"114","Dec 10, 2024 20:16:59.534463652 IST","172.18.0.2","172.18.0.3","52006","12345","58","52006 → 12345 [SYN] Seq=0 Win=1024 Len=0 MSS=1460"
"115","Dec 10, 2024 20:16:59.534467383 IST","172.18.0.3","172.18.0.2","12345","52006","54","12345 → 52006 [RST, ACK] Seq=1 Ack=1 Win=0 Len=0"
"116","Dec 10, 2024 20:16:59.534480020 IST","172.18.0.2","172.18.0.3","52006","27353","58","52006 → 27353 [SYN] Seq=0 Win=1024 Len=0 MSS=1460"
"117","Dec 10, 2024 20:16:59.534484784 IST","172.18.0.3","172.18.0.2","27353","52006","54","27353 → 52006 [RST, ACK] Seq=1 Ack=1 Win=0 Len=0"
"118","Dec 10, 2024 20:16:59.534496920 IST","172.18.0.2","172.18.0.3","52006","9200","58","52006 → 9200 [SYN] Seq=0 Win=1024 Len=0 MSS=1460"
"119","Dec 10, 2024 20:16:59.534500493 IST","172.18.0.3","172.18.0.2","9200","52006","54","9200 → 52006 [RST, ACK] Seq=1 Ack=1 Win=0 Len=0"
"120","Dec 10, 2024 20:16:59.534512171 IST","172.18.0.2","172.18.0.3","52006","481","58","52006 → 481 [SYN] Seq=0 Win=1024 Len=0 MSS=1460"
"121","Dec 10, 2024 20:16:59.534515946 IST","172.18.0.3","172.18.0.2","481","52006","54","481 → 52006 [RST, ACK] Seq=1 Ack=1 Win=0 Len=0"
"122","Dec 10, 2024 20:16:59.534527812 IST","172.18.0.2","172.18.0.3","52006","1717","58","52006 → 1717 [SYN] Seq=0 Win=1024 Len=0 MSS=1460"
"123","Dec 10, 2024 20:16:59.534531552 IST","172.18.0.3","172.18.0.2","1717","52006","54","1717 → 52006 [RST, ACK] Seq=1 Ack=1 Win=0 Len=0"
"124","Dec 10, 2024 20:16:59.534543756 IST","172.18.0.2","172.18.0.3","52006","5666","58","52006 → 5666 [SYN] Seq=0 Win=1024 Len=0 MSS=1460"
"125","Dec 10, 2024 20:16:59.534547235 IST","172.18.0.3","172.18.0.2","5666","52006","54","5666 → 52006 [RST, ACK] Seq=1 Ack=1 Win=0 Len=0"
"126","Dec 10, 2024 20:16:59.534559221 IST","172.18.0.2","172.18.0.3","52006","1461","58","52006 → 1461 [SYN] Seq=0 Win=1024 Len=0 MSS=1460"
"127","Dec 10, 2024 20:16:59.534562964 IST","172.18.0.3","172.18.0.2","1461","52006","54","1461 → 52006 [RST, ACK] Seq=1 Ack=1 Win=0 Len=0"
"128","Dec 10, 2024 20:16:59.534575223 IST","172.18.0.2","172.18.0.3","52006","2111","58","52006 → 2111 [SYN] Seq=0 Win=1024 Len=0 MSS=1460"
"129","Dec 10, 2024 20:16:59.534578920 IST","172.18.0.3","172.18.0.2","2111","52006","54","2111 → 52006 [RST, ACK] Seq=1 Ack=1 Win=0 Len=0"
"130","Dec 10, 2024 20:16:59.534590849 IST","172.18.0.2","172.18.0.3","52006","55555","58","52006 → 55555 [SYN] Seq=0 Win=1024 Len=0 MSS=1460"
"131","Dec 10, 2024 20:16:59.534594374 IST","172.18.0.3","172.18.0.2","55555","52006","54","55555 → 52006 [RST, ACK] Seq=1 Ack=1 Win=0 Len=0"
"132","Dec 10, 2024 20:16:59.534606729 IST","172.18.0.2","172.18.0.3","52006","5120","58","52006 → 5120 [SYN] Seq=0 Win=1024 Len=0 MSS=1460"
"133","Dec 10, 2024 20:16:59.534610717 IST","172.18.0.3","172.18.0.2","5120","52006","54","5120 → 52006 [RST, ACK] Seq=1 Ack=1 Win=0 Len=0"
"134","Dec 10, 2024 20:16:59.534622303 IST","172.18.0.2","172.18.0.3","52006","2035","58","52006 → 2035 [SYN] Seq=0 Win=1024 Len=0 MSS=1460"
"135","Dec 10, 2024 20:16:59.534626041 IST","172.18.0.3","172.18.0.2","2035","52006","54","2035 → 52006 [RST, ACK] Seq=1 Ack=1 Win=0 Len=0"
"136","Dec 10, 2024 20:16:59.534637733 IST","172.18.0.2","172.18.0.3","52006","5101","58","52006 → 5101 [SYN] Seq=0 Win=1024 Len=0 MSS=1460"
"137","Dec 10, 2024 20:16:59.534641498 IST","172.18.0.3","172.18.0.2","5101","52006","54","5101 → 52006 [RST, ACK] Seq=1 Ack=1 Win=0 Len=0"
"138","Dec 10, 2024 20:16:59.534653042 IST","172.18.0.2","172.18.0.3","52006","18101","58","52006 → 18101 [SYN] Seq=0 Win=1024 Len=0 MSS=1460"
"139","Dec 10, 2024 20:16:59.534656596 IST","172.18.0.3","172.18.0.2","18101","52006","54","18101 → 52006 [RST, ACK] Seq=1 Ack=1 Win=0 Len=0"
"140","Dec 10, 2024 20:16:59.534668060 IST","172.18.0.2","172.18.0.3","52006","1296","58","52006 → 1296 [SYN] Seq=0 Win=1024 Len=0 MSS=1460"
"141","Dec 10, 2024 20:16:59.534671830 IST","172.18.0.3","172.18.0.2","1296","52006","54","1296 → 52006 [RST, ACK] Seq=1 Ack=1 Win=0 Len=0"
"142","Dec 10, 2024 20:16:59.534683762 IST","172.18.0.2","172.18.0.3","52006","5922","58","52006 → 5922 [SYN] Seq=0 Win=1024 Len=0 MSS=1460"
"143","Dec 10, 2024 20:16:59.534687271 IST","172.18.0.3","172.18.0.2","5922","52006","54","5922 → 52006 [RST, ACK] Seq=1 Ack=1 Win=0 Len=0"
"144","Dec 10, 2024 20:16:59.534777672 IST","172.18.0.2","172.18.0.3","52006","2041","58","52006 → 2041 [SYN] Seq=0 Win=1024 Len=0 MSS=1460"
"145","Dec 10, 2024 20:16:59.534782733 IST","172.18.0.3","172.18.0.2","2041","52006","54","2041 → 52006 [RST, ACK] Seq=1 Ack=1 Win=0 Len=0"
"146","Dec 10, 2024 20:16:59.534795659 IST","172.18.0.2","172.18.0.3","52006","5862","58","52006 → 5862 [SYN] Seq=0 Win=1024 Len=0 MSS=1460"
"147","Dec 10, 2024 20:16:59.534800034 IST","172.18.0.3","172.18.0.2","5862","52006","54","5862 → 52006 [RST, ACK] Seq=1 Ack=1 Win=0 Len=0"
"148","Dec 10, 2024 20:16:59.534812521 IST","172.18.0.2","172.18.0.3","52006","3221","58","52006 → 3221 [SYN] Seq=0 Win=1024 Len=0 MSS=1460"
"149","Dec 10, 2024 20:16:59.534817244 IST","172.18.0.3","172.18.0.2","3221","52006","54","3221 → 52006 [RST, ACK] Seq=1 Ack=1 Win=0 Len=0"
"150","Dec 10, 2024 20:16:59.534829763 IST","172.18.0.2","172.18.0.3","52006","5911","58","52006 → 5911 [SYN] Seq=0 Win=1024 Len=0 MSS=1460"
"151","Dec 10, 2024 20:16:59.534833600 IST","172.18.0.3","172.18.0.2","5911","52006","54","5911 → 52006 [RST, ACK] Seq=1 Ack=1 Win=0 Len=0"
"152","Dec 10, 2024 20:16:59.534845319 IST","172.18.0.2","172.18.0.3","52006","2383","58","52006 → 2383 [SYN] Seq=0 Win=1024 Len=0 MSS=1460"
"153","Dec 10, 2024 20:16:59.534848946 IST","172.18.0.3","172.18.0.2","2383","52006","54","2383 → 52006 [RST, ACK] Seq=1 Ack=1 Win=0 Len=0"
"154","Dec 10, 2024 20:16:59.534861090 IST","172.18.0.2","172.18.0.3","52006","5001","58","52006 → 5001 [SYN] Seq=0 Win=1024 Len=0 MSS=1460"
"155","Dec 10, 2024 20:16:59.534864595 IST","172.18.0.3","172.18.0.2","5001","52006","54","5001 → 52006 [RST, ACK] Seq=1 Ack=1 Win=0 Len=0"
"156","Dec 10, 2024 20:16:59.534877310 IST","172.18.0.2","172.18.0.3","52006","55055","58","52006 → 55055 [SYN] Seq=0 Win=1024 Len=0 MSS=1460"
"157","Dec 10, 2024 20:16:59.534880920 IST","172.18.0.3","172.18.0.2","55055","52006","54","55055 → 52006 [RST, ACK] Seq=1 Ack=1 Win=0 Len=0"
"158","Dec 10, 2024 20:16:59.534893657 IST","172.18.0.2","172.18.0.3","52006","5280","58","52006 → 5280 [SYN] Seq=0 Win=1024 Len=0 MSS=1460"
"159","Dec 10, 2024 20:16:59.534897274 IST","172.18.0.3","172.18.0.2","5280","52006","54","5280 → 52006 [RST, ACK] Seq=1 Ack=1 Win=0 Len=0"
"160","Dec 10, 2024 20:16:59.534909101 IST","172.18.0.2","172.18.0.3","52006","5226","58","52006 → 5226 [SYN] Seq=0 Win=1024 Len=0 MSS=1460"
"161","Dec 10, 2024 20:16:59.534913049 IST","172.18.0.3","172.18.0.2","5226","52006","54","5226 → 52006 [RST, ACK] Seq=1 Ack=1 Win=0 Len=0"
"162","Dec 10, 2024 20:16:59.534925224 IST","172.18.0.2","172.18.0.3","52006","50001","58","52006 → 50001 [SYN] Seq=0 Win=1024 Len=0 MSS=1460"
"163","Dec 10, 2024 20:16:59.534929122 IST","172.18.0.3","172.18.0.2","50001","52006","54","50001 → 52006 [RST, ACK] Seq=1 Ack=1 Win=0 Len=0"
"164","Dec 10, 2024 20:16:59.534941863 IST","172.18.0.2","172.18.0.3","52006","7800","58","52006 → 7800 [SYN] Seq=0 Win=1024 Len=0 MSS=1460"
"165","Dec 10, 2024 20:16:59.534945359 IST","172.18.0.3","172.18.0.2","7800","52006","54","7800 → 52006 [RST, ACK] Seq=1 Ack=1 Win=0 Len=0"
"166","Dec 10, 2024 20:16:59.534957168 IST","172.18.0.2","172.18.0.3","52006","2288","58","52006 → 2288 [SYN] Seq=0 Win=1024 Len=0 MSS=1460"
"167","Dec 10, 2024 20:16:59.534960733 IST","172.18.0.3","172.18.0.2","2288","52006","54","2288 → 52006 [RST, ACK] Seq=1 Ack=1 Win=0 Len=0"
"168","Dec 10, 2024 20:16:59.534972184 IST","172.18.0.2","172.18.0.3","52006","1011","58","52006 → 1011 [SYN] Seq=0 Win=1024 Len=0 MSS=1460"
"169","Dec 10, 2024 20:16:59.534975680 IST","172.18.0.3","172.18.0.2","1011","52006","54","1011 → 52006 [RST, ACK] Seq=1 Ack=1 Win=0 Len=0"
"170","Dec 10, 2024 20:16:59.534987078 IST","172.18.0.2","172.18.0.3","52006","9503","58","52006 → 9503 [SYN] Seq=0 Win=1024 Len=0 MSS=1460"
"171","Dec 10, 2024 20:16:59.534990762 IST","172.18.0.3","172.18.0.2","9503","52006","54","9503 → 52006 [RST, ACK] Seq=1 Ack=1 Win=0 Len=0"
"172","Dec 10, 2024 20:16:59.535003684 IST","172.18.0.2","172.18.0.3","52006","1085","58","52006 → 1085 [SYN] Seq=0 Win=1024 Len=0 MSS=1460"
"173","Dec 10, 2024 20:16:59.535007324 IST","172.18.0.3","172.18.0.2","1085","52006","54","1085 → 52006 [RST, ACK] Seq=1 Ack=1 Win=0 Len=0"
"174","Dec 10, 2024 20:16:59.535019410 IST","172.18.0.2","172.18.0.3","52006","1186","58","52006 → 1186 [SYN] Seq=0 Win=1024 Len=0 MSS=1460"
"175","Dec 10, 2024 20:16:59.535023083 IST","172.18.0.3","172.18.0.2","1186","52006","54","1186 → 52006 [RST, ACK] Seq=1 Ack=1 Win=0 Len=0"
"176","Dec 10, 2024 20:16:59.535034488 IST","172.18.0.2","172.18.0.3","52006","9207","58","52006 → 9207 [SYN] Seq=0 Win=1024 Len=0 MSS=1460"
"177","Dec 10, 2024 20:16:59.535038143 IST","172.18.0.3","172.18.0.2","9207","52006","54","9207 → 52006 [RST, ACK] Seq=1 Ack=1 Win=0 Len=0"
"178","Dec 10, 2024 20:16:59.535049663 IST","172.18.0.2","172.18.0.3","52006","2251","58","52006 → 2251 [SYN] Seq=0 Win=1024 Len=0 MSS=1460"
"179","Dec 10, 2024 20:16:59.535053400 IST","172.18.0.3","172.18.0.2","2251","52006","54","2251 → 52006 [RST, ACK] Seq=1 Ack=1 Win=0 Len=0"
"180","Dec 10, 2024 20:16:59.535065508 IST","172.18.0.2","172.18.0.3","52006","1533","58","52006 → 1533 [SYN] Seq=0 Win=1024 Len=0 MSS=1460"
"181","Dec 10, 2024 20:16:59.535069966 IST","172.18.0.3","172.18.0.2","1533","52006","54","1533 → 52006 [RST, ACK] Seq=1 Ack=1 Win=0 Len=0"
"182","Dec 10, 2024 20:16:59.535081866 IST","172.18.0.2","172.18.0.3","52006","49154","58","52006 → 49154 [SYN] Seq=0 Win=1024 Len=0 MSS=1460"
"183","Dec 10, 2024 20:16:59.535085639 IST","172.18.0.3","172.18.0.2","49154","52006","54","49154 → 52006 [RST, ACK] Seq=1 Ack=1 Win=0 Len=0"
"184","Dec 10, 2024 20:16:59.535097357 IST","172.18.0.2","172.18.0.3","52006","50636","58","52006 → 50636 [SYN] Seq=0 Win=1024 Len=0 MSS=1460"
"185","Dec 10, 2024 20:16:59.535101040 IST","172.18.0.3","172.18.0.2","50636","52006","54","50636 → 52006 [RST, ACK] Seq=1 Ack=1 Win=0 Len=0"
"186","Dec 10, 2024 20:16:59.535112821 IST","172.18.0.2","172.18.0.3","52006","1183","58","52006 → 1183 [SYN] Seq=0 Win=1024 Len=0 MSS=1460"
"187","Dec 10, 2024 20:16:59.535116310 IST","172.18.0.3","172.18.0.2","1183","52006","54","1183 → 52006 [RST, ACK] Seq=1 Ack=1 Win=0 Len=0"
"188","Dec 10, 2024 20:16:59.535127871 IST","172.18.0.2","172.18.0.3","52006","2003","58","52006 → 2003 [SYN] Seq=0 Win=1024 Len=0 MSS=1460"
"189","Dec 10, 2024 20:16:59.535131329 IST","172.18.0.3","172.18.0.2","2003","52006","54","2003 → 52006 [RST, ACK] Seq=1 Ack=1 Win=0 Len=0"
"190","Dec 10, 2024 20:16:59.535164980 IST","172.18.0.2","172.18.0.3","52006","417","58","52006 → 417 [SYN] Seq=0 Win=1024 Len=0 MSS=1460"
"191","Dec 10, 2024 20:16:59.535176449 IST","172.18.0.3","172.18.0.2","417","52006","54","417 → 52006 [RST, ACK] Seq=1 Ack=1 Win=0 Len=0"
"192","Dec 10, 2024 20:16:59.535198536 IST","172.18.0.2","172.18.0.3","52006","32768","58","52006 → 32768 [SYN] Seq=0 Win=1024 Len=0 MSS=1460"
"193","Dec 10, 2024 20:16:59.535202854 IST","172.18.0.3","172.18.0.2","32768","52006","54","32768 → 52006 [RST, ACK] Seq=1 Ack=1 Win=0 Len=0"
"194","Dec 10, 2024 20:16:59.535216435 IST","172.18.0.2","172.18.0.3","52006","8022","58","52006 → 8022 [SYN] Seq=0 Win=1024 Len=0 MSS=1460"
"195","Dec 10, 2024 20:16:59.535220330 IST","172.18.0.3","172.18.0.2","8022","52006","54","8022 → 52006 [RST, ACK] Seq=1 Ack=1 Win=0 Len=0"
"196","Dec 10, 2024 20:16:59.535234349 IST","172.18.0.2","172.18.0.3","52006","15002","58","52006 → 15002 [SYN] Seq=0 Win=1024 Len=0 MSS=1460"
"197","Dec 10, 2024 20:16:59.535238253 IST","172.18.0.3","172.18.0.2","15002","52006","54","15002 → 52006 [RST, ACK] Seq=1 Ack=1 Win=0 Len=0"
"198","Dec 10, 2024 20:16:59.535250531 IST","172.18.0.2","172.18.0.3","52006","4900","58","52006 → 4900 [SYN] Seq=0 Win=1024 Len=0 MSS=1460"
"199","Dec 10, 2024 20:16:59.535254208 IST","172.18.0.3","172.18.0.2","4900","52006","54","4900 → 52006 [RST, ACK] Seq=1 Ack=1 Win=0 Len=0"
"200","Dec 10, 2024 20:16:59.535266719 IST","172.18.0.2","172.18.0.3","52006","3914","58","52006 → 3914 [SYN] Seq=0 Win=1024 Len=0 MSS=1460"
"201","Dec 10, 2024 20:16:59.535270121 IST","172.18.0.3","172.18.0.2","3914","52006","54","3914 → 52006 [RST, ACK] Seq=1 Ack=1 Win=0 Len=0"
"202","Dec 10, 2024 20:16:59.535281875 IST","172.18.0.2","172.18.0.3","52006","2875","58","52006 → 2875 [SYN] Seq=0 Win=1024 Len=0 MSS=1460"
"203","Dec 10, 2024 20:16:59.535285514 IST","172.18.0.3","172.18.0.2","2875","52006","54","2875 → 52006 [RST, ACK] Seq=1 Ack=1 Win=0 Len=0"
"204","Dec 10, 2024 20:16:59.535297766 IST","172.18.0.2","172.18.0.3","52006","5678","58","52006 → 5678 [SYN] Seq=0 Win=1024 Len=0 MSS=1460"
"205","Dec 10, 2024 20:16:59.535301447 IST","172.18.0.3","172.18.0.2","5678","52006","54","5678 → 52006 [RST, ACK] Seq=1 Ack=1 Win=0 Len=0"
"206","Dec 10, 2024 20:16:59.535314445 IST","172.18.0.2","172.18.0.3","52006","14441","58","52006 → 14441 [SYN] Seq=0 Win=1024 Len=0 MSS=1460"
"207","Dec 10, 2024 20:16:59.535318689 IST","172.18.0.3","172.18.0.2","14441","52006","54","14441 → 52006 [RST, ACK] Seq=1 Ack=1 Win=0 Len=0"
"208","Dec 10, 2024 20:16:59.535330945 IST","172.18.0.2","172.18.0.3","52006","3905","58","52006 → 3905 [SYN] Seq=0 Win=1024 Len=0 MSS=1460"
"209","Dec 10, 2024 20:16:59.535334546 IST","172.18.0.3","172.18.0.2","3905","52006","54","3905 → 52006 [RST, ACK] Seq=1 Ack=1 Win=0 Len=0"
"210","Dec 10, 2024 20:16:59.535346238 IST","172.18.0.2","172.18.0.3","52006","987","58","52006 → 987 [SYN] Seq=0 Win=1024 Len=0 MSS=1460"
"211","Dec 10, 2024 20:16:59.535350349 IST","172.18.0.3","172.18.0.2","987","52006","54","987 → 52006 [RST, ACK] Seq=1 Ack=1 Win=0 Len=0"
"212","Dec 10, 2024 20:16:59.535362661 IST","172.18.0.2","172.18.0.3","52006","19283","58","52006 → 19283 [SYN] Seq=0 Win=1024 Len=0 MSS=1460"
"213","Dec 10, 2024 20:16:59.535370828 IST","172.18.0.3","172.18.0.2","19283","52006","54","19283 → 52006 [RST, ACK] Seq=1 Ack=1 Win=0 Len=0"
"214","Dec 10, 2024 20:16:59.535383192 IST","172.18.0.2","172.18.0.3","52006","1310","58","52006 → 1310 [SYN] Seq=0 Win=1024 Len=0 MSS=1460"
"215","Dec 10, 2024 20:16:59.535386794 IST","172.18.0.3","172.18.0.2","1310","52006","54","1310 → 52006 [RST, ACK] Seq=1 Ack=1 Win=0 Len=0"
"216","Dec 10, 2024 20:16:59.535398777 IST","172.18.0.2","172.18.0.3","52006","1053","58","52006 → 1053 [SYN] Seq=0 Win=1024 Len=0 MSS=1460"
"217","Dec 10, 2024 20:16:59.535402354 IST","172.18.0.3","172.18.0.2","1053","52006","54","1053 → 52006 [RST, ACK] Seq=1 Ack=1 Win=0 Len=0"
"218","Dec 10, 2024 20:16:59.535413717 IST","172.18.0.2","172.18.0.3","52006","3546","58","52006 → 3546 [SYN] Seq=0 Win=1024 Len=0 MSS=1460"
"219","Dec 10, 2024 20:16:59.535417156 IST","172.18.0.3","172.18.0.2","3546","52006","54","3546 → 52006 [RST, ACK] Seq=1 Ack=1 Win=0 Len=0"
"220","Dec 10, 2024 20:16:59.535428918 IST","172.18.0.2","172.18.0.3","52006","1088","58","52006 → 1088 [SYN] Seq=0 Win=1024 Len=0 MSS=1460"
"221","Dec 10, 2024 20:16:59.535432493 IST","172.18.0.3","172.18.0.2","1088","52006","54","1088 → 52006 [RST, ACK] Seq=1 Ack=1 Win=0 Len=0"
"222","Dec 10, 2024 20:16:59.535444520 IST","172.18.0.2","172.18.0.3","52006","81","58","52006 → 81 [SYN] Seq=0 Win=1024 Len=0 MSS=1460"
"223","Dec 10, 2024 20:16:59.535448403 IST","172.18.0.3","172.18.0.2","81","52006","54","81 → 52006 [RST, ACK] Seq=1 Ack=1 Win=0 Len=0"
"224","Dec 10, 2024 20:16:59.535460316 IST","172.18.0.2","172.18.0.3","52006","9999","58","52006 → 9999 [SYN] Seq=0 Win=1024 Len=0 MSS=1460"
"225","Dec 10, 2024 20:16:59.535463993 IST","172.18.0.3","172.18.0.2","9999","52006","54","9999 → 52006 [RST, ACK] Seq=1 Ack=1 Win=0 Len=0"
"226","Dec 10, 2024 20:16:59.535475756 IST","172.18.0.2","172.18.0.3","52006","8899","58","52006 → 8899 [SYN] Seq=0 Win=1024 Len=0 MSS=1460"
"227","Dec 10, 2024 20:16:59.535479238 IST","172.18.0.3","172.18.0.2","8899","52006","54","8899 → 52006 [RST, ACK] Seq=1 Ack=1 Win=0 Len=0"
"228","Dec 10, 2024 20:16:59.535491649 IST","172.18.0.2","172.18.0.3","52006","5030","58","52006 → 5030 [SYN] Seq=0 Win=1024 Len=0 MSS=1460"
"229","Dec 10, 2024 20:16:59.535495257 IST","172.18.0.3","172.18.0.2","5030","52006","54","5030 → 52006 [RST, ACK] Seq=1 Ack=1 Win=0 Len=0"
"230","Dec 10, 2024 20:16:59.535507202 IST","172.18.0.2","172.18.0.3","52006","55600","58","52006 → 55600 [SYN] Seq=0 Win=1024 Len=0 MSS=1460"
"231","Dec 10, 2024 20:16:59.535510664 IST","172.18.0.3","172.18.0.2","55600","52006","54","55600 → 52006 [RST, ACK] Seq=1 Ack=1 Win=0 Len=0"
"232","Dec 10, 2024 20:16:59.535522607 IST","172.18.0.2","172.18.0.3","52006","1062","58","52006 → 1062 [SYN] Seq=0 Win=1024 Len=0 MSS=1460"
"233","Dec 10, 2024 20:16:59.535526271 IST","172.18.0.3","172.18.0.2","1062","52006","54","1062 → 52006 [RST, ACK] Seq=1 Ack=1 Win=0 Len=0"
"234","Dec 10, 2024 20:16:59.535538267 IST","172.18.0.2","172.18.0.3","52006","1187","58","52006 → 1187 [SYN] Seq=0 Win=1024 Len=0 MSS=1460"
"235","Dec 10, 2024 20:16:59.535541920 IST","172.18.0.3","172.18.0.2","1187","52006","54","1187 → 52006 [RST, ACK] Seq=1 Ack=1 Win=0 Len=0"
"236","Dec 10, 2024 20:16:59.535553399 IST","172.18.0.2","172.18.0.3","52006","2701","58","52006 → 2701 [SYN] Seq=0 Win=1024 Len=0 MSS=1460"
"237","Dec 10, 2024 20:16:59.535557083 IST","172.18.0.3","172.18.0.2","2701","52006","54","2701 → 52006 [RST, ACK] Seq=1 Ack=1 Win=0 Len=0"
"238","Dec 10, 2024 20:16:59.535568908 IST","172.18.0.2","172.18.0.3","52006","17","58","52006 → 17 [SYN] Seq=0 Win=1024 Len=0 MSS=1460"
"239","Dec 10, 2024 20:16:59.535572441 IST","172.18.0.3","172.18.0.2","17","52006","54","17 → 52006 [RST, ACK] Seq=1 Ack=1 Win=0 Len=0"
"240","Dec 10, 2024 20:16:59.535584550 IST","172.18.0.2","172.18.0.3","52006","2030","58","52006 → 2030 [SYN] Seq=0 Win=1024 Len=0 MSS=1460"
"241","Dec 10, 2024 20:16:59.535588152 IST","172.18.0.3","172.18.0.2","2030","52006","54","2030 → 52006 [RST, ACK] Seq=1 Ack=1 Win=0 Len=0"
"242","Dec 10, 2024 20:16:59.535599735 IST","172.18.0.2","172.18.0.3","52006","83","58","52006 → 83 [SYN] Seq=0 Win=1024 Len=0 MSS=1460"
"243","Dec 10, 2024 20:16:59.535603482 IST","172.18.0.3","172.18.0.2","83","52006","54","83 → 52006 [RST, ACK] Seq=1 Ack=1 Win=0 Len=0"
"244","Dec 10, 2024 20:16:59.535720218 IST","172.18.0.2","172.18.0.3","52006","15000","58","52006 → 15000 [SYN] Seq=0 Win=1024 Len=0 MSS=1460"
"245","Dec 10, 2024 20:16:59.535726172 IST","172.18.0.3","172.18.0.2","15000","52006","54","15000 → 52006 [RST, ACK] Seq=1 Ack=1 Win=0 Len=0"
"246","Dec 10, 2024 20:16:59.535739670 IST","172.18.0.2","172.18.0.3","52006","1086","58","52006 → 1086 [SYN] Seq=0 Win=1024 Len=0 MSS=1460"
"247","Dec 10, 2024 20:16:59.535743063 IST","172.18.0.3","172.18.0.2","1086","52006","54","1086 → 52006 [RST, ACK] Seq=1 Ack=1 Win=0 Len=0"
"248","Dec 10, 2024 20:16:59.535754535 IST","172.18.0.2","172.18.0.3","52006","1165","58","52006 → 1165 [SYN] Seq=0 Win=1024 Len=0 MSS=1460"
"249","Dec 10, 2024 20:16:59.535757949 IST","172.18.0.3","172.18.0.2","1165","52006","54","1165 → 52006 [RST, ACK] Seq=1 Ack=1 Win=0 Len=0"
"250","Dec 10, 2024 20:16:59.535769391 IST","172.18.0.2","172.18.0.3","52006","27355","58","52006 → 27355 [SYN] Seq=0 Win=1024 Len=0 MSS=1460"
"251","Dec 10, 2024 20:16:59.535772935 IST","172.18.0.3","172.18.0.2","27355","52006","54","27355 → 52006 [RST, ACK] Seq=1 Ack=1 Win=0 Len=0"
"252","Dec 10, 2024 20:16:59.535784274 IST","172.18.0.2","172.18.0.3","52006","6646","58","52006 → 6646 [SYN] Seq=0 Win=1024 Len=0 MSS=1460"
"253","Dec 10, 2024 20:16:59.535787630 IST","172.18.0.3","172.18.0.2","6646","52006","54","6646 → 52006 [RST, ACK] Seq=1 Ack=1 Win=0 Len=0"
"254","Dec 10, 2024 20:16:59.535798907 IST","172.18.0.2","172.18.0.3","52006","4003","58","52006 → 4003 [SYN] Seq=0 Win=1024 Len=0 MSS=1460"
"255","Dec 10, 2024 20:16:59.535802459 IST","172.18.0.3","172.18.0.2","4003","52006","54","4003 → 52006 [RST, ACK] Seq=1 Ack=1 Win=0 Len=0"
"256","Dec 10, 2024 20:16:59.535813665 IST","172.18.0.2","172.18.0.3","52006","32784","58","52006 → 32784 [SYN] Seq=0 Win=1024 Len=0 MSS=1460"
"257","Dec 10, 2024 20:16:59.535817090 IST","172.18.0.3","172.18.0.2","32784","52006","54","32784 → 52006 [RST, ACK] Seq=1 Ack=1 Win=0 Len=0"
"258","Dec 10, 2024 20:16:59.535828859 IST","172.18.0.2","172.18.0.3","52006","3283","58","52006 → 3283 [SYN] Seq=0 Win=1024 Len=0 MSS=1460"
"259","Dec 10, 2024 20:16:59.535832172 IST","172.18.0.3","172.18.0.2","3283","52006","54","3283 → 52006 [RST, ACK] Seq=1 Ack=1 Win=0 Len=0"
"260","Dec 10, 2024 20:16:59.535844948 IST","172.18.0.2","172.18.0.3","52006","1839","58","52006 → 1839 [SYN] Seq=0 Win=1024 Len=0 MSS=1460"
"261","Dec 10, 2024 20:16:59.535848910 IST","172.18.0.3","172.18.0.2","1839","52006","54","1839 → 52006 [RST, ACK] Seq=1 Ack=1 Win=0 Len=0"
"262","Dec 10, 2024 20:16:59.535860864 IST","172.18.0.2","172.18.0.3","52006","901","58","52006 → 901 [SYN] Seq=0 Win=1024 Len=0 MSS=1460"
"263","Dec 10, 2024 20:16:59.535864413 IST","172.18.0.3","172.18.0.2","901","52006","54","901 → 52006 [RST, ACK] Seq=1 Ack=1 Win=0 Len=0"
"264","Dec 10, 2024 20:16:59.535876451 IST","172.18.0.2","172.18.0.3","52006","5901","58","52006 → 5901 [SYN] Seq=0 Win=1024 Len=0 MSS=1460"
"265","Dec 10, 2024 20:16:59.535880091 IST","172.18.0.3","172.18.0.2","5901","52006","54","5901 → 52006 [RST, ACK] Seq=1 Ack=1 Win=0 Len=0"
"266","Dec 10, 2024 20:16:59.535892053 IST","172.18.0.2","172.18.0.3","52006","1233","58","52006 → 1233 [SYN] Seq=0 Win=1024 Len=0 MSS=1460"
"267","Dec 10, 2024 20:16:59.535895825 IST","172.18.0.3","172.18.0.2","1233","52006","54","1233 → 52006 [RST, ACK] Seq=1 Ack=1 Win=0 Len=0"
"268","Dec 10, 2024 20:16:59.535907801 IST","172.18.0.2","172.18.0.3","52006","616","58","52006 → 616 [SYN] Seq=0 Win=1024 Len=0 MSS=1460"
"269","Dec 10, 2024 20:16:59.535911150 IST","172.18.0.3","172.18.0.2","616","52006","54","616 → 52006 [RST, ACK] Seq=1 Ack=1 Win=0 Len=0"
"270","Dec 10, 2024 20:16:59.535922650 IST","172.18.0.2","172.18.0.3","52006","3000","58","52006 → 3000 [SYN] Seq=0 Win=1024 Len=0 MSS=1460"
"271","Dec 10, 2024 20:16:59.535926237 IST","172.18.0.3","172.18.0.2","3000","52006","54","3000 → 52006 [RST, ACK] Seq=1 Ack=1 Win=0 Len=0"
"272","Dec 10, 2024 20:16:59.535938100 IST","172.18.0.2","172.18.0.3","52006","8180","58","52006 → 8180 [SYN] Seq=0 Win=1024 Len=0 MSS=1460"
"273","Dec 10, 2024 20:16:59.535941615 IST","172.18.0.3","172.18.0.2","8180","52006","54","8180 → 52006 [RST, ACK] Seq=1 Ack=1 Win=0 Len=0"
"274","Dec 10, 2024 20:16:59.535953688 IST","172.18.0.2","172.18.0.3","52006","50002","58","52006 → 50002 [SYN] Seq=0 Win=1024 Len=0 MSS=1460"
"275","Dec 10, 2024 20:16:59.535957193 IST","172.18.0.3","172.18.0.2","50002","52006","54","50002 → 52006 [RST, ACK] Seq=1 Ack=1 Win=0 Len=0"
"276","Dec 10, 2024 20:16:59.535969151 IST","172.18.0.2","172.18.0.3","52006","714","58","52006 → 714 [SYN] Seq=0 Win=1024 Len=0 MSS=1460"
"277","Dec 10, 2024 20:16:59.535972715 IST","172.18.0.3","172.18.0.2","714","52006","54","714 → 52006 [RST, ACK] Seq=1 Ack=1 Win=0 Len=0"
"278","Dec 10, 2024 20:16:59.535984175 IST","172.18.0.2","172.18.0.3","52006","2005","58","52006 → 2005 [SYN] Seq=0 Win=1024 Len=0 MSS=1460"
"279","Dec 10, 2024 20:16:59.535987761 IST","172.18.0.3","172.18.0.2","2005","52006","54","2005 → 52006 [RST, ACK] Seq=1 Ack=1 Win=0 Len=0"
"280","Dec 10, 2024 20:16:59.536000067 IST","172.18.0.2","172.18.0.3","52006","1244","58","52006 → 1244 [SYN] Seq=0 Win=1024 Len=0 MSS=1460"
"281","Dec 10, 2024 20:16:59.536003691 IST","172.18.0.3","172.18.0.2","1244","52006","54","1244 → 52006 [RST, ACK] Seq=1 Ack=1 Win=0 Len=0"
"282","Dec 10, 2024 20:16:59.536015098 IST","172.18.0.2","172.18.0.3","52006","5915","58","52006 → 5915 [SYN] Seq=0 Win=1024 Len=0 MSS=1460"
"283","Dec 10, 2024 20:16:59.536018642 IST","172.18.0.3","172.18.0.2","5915","52006","54","5915 → 52006 [RST, ACK] Seq=1 Ack=1 Win=0 Len=0"
"284","Dec 10, 2024 20:16:59.536030235 IST","172.18.0.2","172.18.0.3","52006","4445","58","52006 → 4445 [SYN] Seq=0 Win=1024 Len=0 MSS=1460"
"285","Dec 10, 2024 20:16:59.536033721 IST","172.18.0.3","172.18.0.2","4445","52006","54","4445 → 52006 [RST, ACK] Seq=1 Ack=1 Win=0 Len=0"
"286","Dec 10, 2024 20:16:59.536045829 IST","172.18.0.2","172.18.0.3","52006","2135","58","52006 → 2135 [SYN] Seq=0 Win=1024 Len=0 MSS=1460"
