frame.number,frame.time,ip.src,ip.dst,tcp.srcport,tcp.dstport,frame.len,_ws.col.Info
"1","Dec 16, 2024 14:24:02.794821988 IST",,,,,"42","Who has 172.18.0.3? Tell 172.18.0.2"
"2","Dec 16, 2024 14:24:02.794843873 IST",,,,,"42","172.18.0.3 is at 02:42:ac:12:00:03"
"3","Dec 16, 2024 14:24:02.985068376 IST",,,,,"42","Who has 172.18.0.3? Tell 172.18.0.2"
"4","Dec 16, 2024 14:24:02.985080606 IST",,,,,"42","172.18.0.3 is at 02:42:ac:12:00:03"
"5","Dec 16, 2024 14:24:02.985103052 IST","172.18.0.2","172.18.0.3","39799","445","58","39799 → 445 [SYN] Seq=0 Win=1024 Len=0 MSS=1460"
"6","Dec 16, 2024 14:24:02.985118339 IST","172.18.0.3","172.18.0.2","445","39799","54","445 → 39799 [RST, ACK] Seq=1 Ack=1 Win=0 Len=0"
"7","Dec 16, 2024 14:24:02.985139213 IST","172.18.0.2","172.18.0.3","39799","80","58","39799 → 80 [SYN] Seq=0 Win=1024 Len=0 MSS=1460"
"8","Dec 16, 2024 14:24:02.985150668 IST","172.18.0.3","172.18.0.2","80","39799","58","80 → 39799 [SYN, ACK] Seq=0 Ack=1 Win=64240 Len=0 MSS=1460"
"9","Dec 16, 2024 14:24:02.985160572 IST","172.18.0.2","172.18.0.3","39799","80","54","39799 → 80 [RST] Seq=1 Win=0 Len=0"
"10","Dec 16, 2024 14:24:02.985172697 IST","172.18.0.2","172.18.0.3","39799","587","58","39799 → 587 [SYN] Seq=0 Win=1024 Len=0 MSS=1460"
"11","Dec 16, 2024 14:24:02.985177240 IST","172.18.0.3","172.18.0.2","587","39799","54","587 → 39799 [RST, ACK] Seq=1 Ack=1 Win=0 Len=0"
"12","Dec 16, 2024 14:24:02.985190186 IST","172.18.0.2","172.18.0.3","39799","53","58","39799 → 53 [SYN] Seq=0 Win=1024 Len=0 MSS=1460"
"13","Dec 16, 2024 14:24:02.985194015 IST","172.18.0.3","172.18.0.2","53","39799","54","53 → 39799 [RST, ACK] Seq=1 Ack=1 Win=0 Len=0"
"14","Dec 16, 2024 14:24:02.985207055 IST","172.18.0.2","172.18.0.3","39799","1025","58","39799 → 1025 [SYN] Seq=0 Win=1024 Len=0 MSS=1460"
"15","Dec 16, 2024 14:24:02.985210682 IST","172.18.0.3","172.18.0.2","1025","39799","54","1025 → 39799 [RST, ACK] Seq=1 Ack=1 Win=0 Len=0"
"16","Dec 16, 2024 14:24:02.985222216 IST","172.18.0.2","172.18.0.3","39799","3306","58","39799 → 3306 [SYN] Seq=0 Win=1024 Len=0 MSS=1460"
"17","Dec 16, 2024 14:24:02.985225919 IST","172.18.0.3","172.18.0.2","3306","39799","54","3306 → 39799 [RST, ACK] Seq=1 Ack=1 Win=0 Len=0"
"18","Dec 16, 2024 14:24:02.985237566 IST","172.18.0.2","172.18.0.3","39799","113","58","39799 → 113 [SYN] Seq=0 Win=1024 Len=0 MSS=1460"
"19","Dec 16, 2024 14:24:02.985241240 IST","172.18.0.3","172.18.0.2","113","39799","54","113 → 39799 [RST, ACK] Seq=1 Ack=1 Win=0 Len=0"
"20","Dec 16, 2024 14:24:02.985253020 IST","172.18.0.2","172.18.0.3","39799","3389","58","39799 → 3389 [SYN] Seq=0 Win=1024 Len=0 MSS=1460"
"21","Dec 16, 2024 14:24:02.985256575 IST","172.18.0.3","172.18.0.2","3389","39799","54","3389 → 39799 [RST, ACK] Seq=1 Ack=1 Win=0 Len=0"
"22","Dec 16, 2024 14:24:02.985267949 IST","172.18.0.2","172.18.0.3","39799","993","58","39799 → 993 [SYN] Seq=0 Win=1024 Len=0 MSS=1460"
"23","Dec 16, 2024 14:24:02.985271331 IST","172.18.0.3","172.18.0.2","993","39799","54","993 → 39799 [RST, ACK] Seq=1 Ack=1 Win=0 Len=0"
"24","Dec 16, 2024 14:24:02.985282676 IST","172.18.0.2","172.18.0.3","39799","25","58","39799 → 25 [SYN] Seq=0 Win=1024 Len=0 MSS=1460"
"25","Dec 16, 2024 14:24:02.985286264 IST","172.18.0.3","172.18.0.2","25","39799","54","25 → 39799 [RST, ACK] Seq=1 Ack=1 Win=0 Len=0"
"26","Dec 16, 2024 14:24:02.985342466 IST","172.18.0.2","172.18.0.3","39799","143","58","39799 → 143 [SYN] Seq=0 Win=1024 Len=0 MSS=1460"
"27","Dec 16, 2024 14:24:02.985346614 IST","172.18.0.3","172.18.0.2","143","39799","54","143 → 39799 [RST, ACK] Seq=1 Ack=1 Win=0 Len=0"
"28","Dec 16, 2024 14:24:02.985358586 IST","172.18.0.2","172.18.0.3","39799","5900","58","39799 → 5900 [SYN] Seq=0 Win=1024 Len=0 MSS=1460"
"29","Dec 16, 2024 14:24:02.985362225 IST","172.18.0.3","172.18.0.2","5900","39799","54","5900 → 39799 [RST, ACK] Seq=1 Ack=1 Win=0 Len=0"
"30","Dec 16, 2024 14:24:02.985373137 IST","172.18.0.2","172.18.0.3","39799","23","58","39799 → 23 [SYN] Seq=0 Win=1024 Len=0 MSS=1460"
"31","Dec 16, 2024 14:24:02.985377306 IST","172.18.0.3","172.18.0.2","23","39799","54","23 → 39799 [RST, ACK] Seq=1 Ack=1 Win=0 Len=0"
"32","Dec 16, 2024 14:24:02.985391288 IST","172.18.0.2","172.18.0.3","39799","110","58","39799 → 110 [SYN] Seq=0 Win=1024 Len=0 MSS=1460"
"33","Dec 16, 2024 14:24:02.985461089 IST","172.18.0.3","172.18.0.2","110","39799","54","110 → 39799 [RST, ACK] Seq=1 Ack=1 Win=0 Len=0"
"34","Dec 16, 2024 14:24:02.985491810 IST","172.18.0.2","172.18.0.3","39799","443","58","39799 → 443 [SYN] Seq=0 Win=1024 Len=0 MSS=1460"
"35","Dec 16, 2024 14:24:02.985497461 IST","172.18.0.3","172.18.0.2","443","39799","54","443 → 39799 [RST, ACK] Seq=1 Ack=1 Win=0 Len=0"
"36","Dec 16, 2024 14:24:02.985510822 IST","172.18.0.2","172.18.0.3","39799","8080","58","39799 → 8080 [SYN] Seq=0 Win=1024 Len=0 MSS=1460"
"37","Dec 16, 2024 14:24:02.985514750 IST","172.18.0.3","172.18.0.2","8080","39799","54","8080 → 39799 [RST, ACK] Seq=1 Ack=1 Win=0 Len=0"
"38","Dec 16, 2024 14:24:02.985533123 IST","172.18.0.2","172.18.0.3","39799","21","58","39799 → 21 [SYN] Seq=0 Win=1024 Len=0 MSS=1460"
"39","Dec 16, 2024 14:24:02.985537600 IST","172.18.0.3","172.18.0.2","21","39799","54","21 → 39799 [RST, ACK] Seq=1 Ack=1 Win=0 Len=0"
"40","Dec 16, 2024 14:24:02.985550028 IST","172.18.0.2","172.18.0.3","39799","256","58","39799 → 256 [SYN] Seq=0 Win=1024 Len=0 MSS=1460"
"41","Dec 16, 2024 14:24:02.985553700 IST","172.18.0.3","172.18.0.2","256","39799","54","256 → 39799 [RST, ACK] Seq=1 Ack=1 Win=0 Len=0"
"42","Dec 16, 2024 14:24:02.985565127 IST","172.18.0.2","172.18.0.3","39799","554","58","39799 → 554 [SYN] Seq=0 Win=1024 Len=0 MSS=1460"
"43","Dec 16, 2024 14:24:02.985568732 IST","172.18.0.3","172.18.0.2","554","39799","54","554 → 39799 [RST, ACK] Seq=1 Ack=1 Win=0 Len=0"
"44","Dec 16, 2024 14:24:02.985579788 IST","172.18.0.2","172.18.0.3","39799","1720","58","39799 → 1720 [SYN] Seq=0 Win=1024 Len=0 MSS=1460"
"45","Dec 16, 2024 14:24:02.985583282 IST","172.18.0.3","172.18.0.2","1720","39799","54","1720 → 39799 [RST, ACK] Seq=1 Ack=1 Win=0 Len=0"
"46","Dec 16, 2024 14:24:02.985595037 IST","172.18.0.2","172.18.0.3","39799","22","58","39799 → 22 [SYN] Seq=0 Win=1024 Len=0 MSS=1460"
"47","Dec 16, 2024 14:24:02.985598610 IST","172.18.0.3","172.18.0.2","22","39799","54","22 → 39799 [RST, ACK] Seq=1 Ack=1 Win=0 Len=0"
"48","Dec 16, 2024 14:24:02.985609889 IST","172.18.0.2","172.18.0.3","39799","111","58","39799 → 111 [SYN] Seq=0 Win=1024 Len=0 MSS=1460"
"49","Dec 16, 2024 14:24:02.985613325 IST","172.18.0.3","172.18.0.2","111","39799","54","111 → 39799 [RST, ACK] Seq=1 Ack=1 Win=0 Len=0"
"50","Dec 16, 2024 14:24:02.985624523 IST","172.18.0.2","172.18.0.3","39799","995","58","39799 → 995 [SYN] Seq=0 Win=1024 Len=0 MSS=1460"
"51","Dec 16, 2024 14:24:02.985627895 IST","172.18.0.3","172.18.0.2","995","39799","54","995 → 39799 [RST, ACK] Seq=1 Ack=1 Win=0 Len=0"
"52","Dec 16, 2024 14:24:02.985639116 IST","172.18.0.2","172.18.0.3","39799","1723","58","39799 → 1723 [SYN] Seq=0 Win=1024 Len=0 MSS=1460"
"53","Dec 16, 2024 14:24:02.985642529 IST","172.18.0.3","172.18.0.2","1723","39799","54","1723 → 39799 [RST, ACK] Seq=1 Ack=1 Win=0 Len=0"
"54","Dec 16, 2024 14:24:02.985653909 IST","172.18.0.2","172.18.0.3","39799","139","58","39799 → 139 [SYN] Seq=0 Win=1024 Len=0 MSS=1460"
"55","Dec 16, 2024 14:24:02.985657189 IST","172.18.0.3","172.18.0.2","139","39799","54","139 → 39799 [RST, ACK] Seq=1 Ack=1 Win=0 Len=0"
"56","Dec 16, 2024 14:24:02.985668765 IST","172.18.0.2","172.18.0.3","39799","199","58","39799 → 199 [SYN] Seq=0 Win=1024 Len=0 MSS=1460"
"57","Dec 16, 2024 14:24:02.985672190 IST","172.18.0.3","172.18.0.2","199","39799","54","199 → 39799 [RST, ACK] Seq=1 Ack=1 Win=0 Len=0"
"58","Dec 16, 2024 14:24:02.985684439 IST","172.18.0.2","172.18.0.3","39799","135","58","39799 → 135 [SYN] Seq=0 Win=1024 Len=0 MSS=1460"
"59","Dec 16, 2024 14:24:02.985687960 IST","172.18.0.3","172.18.0.2","135","39799","54","135 → 39799 [RST, ACK] Seq=1 Ack=1 Win=0 Len=0"
"60","Dec 16, 2024 14:24:02.985750534 IST","172.18.0.2","172.18.0.3","39799","8888","58","39799 → 8888 [SYN] Seq=0 Win=1024 Len=0 MSS=1460"
"61","Dec 16, 2024 14:24:02.985794234 IST","172.18.0.3","172.18.0.2","8888","39799","54","8888 → 39799 [RST, ACK] Seq=1 Ack=1 Win=0 Len=0"
"62","Dec 16, 2024 14:24:02.985857938 IST","172.18.0.2","172.18.0.3","39799","1057","58","39799 → 1057 [SYN] Seq=0 Win=1024 Len=0 MSS=1460"
"63","Dec 16, 2024 14:24:02.985865005 IST","172.18.0.3","172.18.0.2","1057","39799","54","1057 → 39799 [RST, ACK] Seq=1 Ack=1 Win=0 Len=0"
"64","Dec 16, 2024 14:24:02.985883103 IST","172.18.0.2","172.18.0.3","39799","27352","58","39799 → 27352 [SYN] Seq=0 Win=1024 Len=0 MSS=1460"
"65","Dec 16, 2024 14:24:02.985886902 IST","172.18.0.3","172.18.0.2","27352","39799","54","27352 → 39799 [RST, ACK] Seq=1 Ack=1 Win=0 Len=0"
"66","Dec 16, 2024 14:24:02.985953639 IST","172.18.0.2","172.18.0.3","39799","1137","58","39799 → 1137 [SYN] Seq=0 Win=1024 Len=0 MSS=1460"
"67","Dec 16, 2024 14:24:02.985957616 IST","172.18.0.3","172.18.0.2","1137","39799","54","1137 → 39799 [RST, ACK] Seq=1 Ack=1 Win=0 Len=0"
"68","Dec 16, 2024 14:24:02.985969848 IST","172.18.0.2","172.18.0.3","39799","5925","58","39799 → 5925 [SYN] Seq=0 Win=1024 Len=0 MSS=1460"
"69","Dec 16, 2024 14:24:02.985973424 IST","172.18.0.3","172.18.0.2","5925","39799","54","5925 → 39799 [RST, ACK] Seq=1 Ack=1 Win=0 Len=0"
"70","Dec 16, 2024 14:24:02.985985221 IST","172.18.0.2","172.18.0.3","39799","545","58","39799 → 545 [SYN] Seq=0 Win=1024 Len=0 MSS=1460"
"71","Dec 16, 2024 14:24:02.985988808 IST","172.18.0.3","172.18.0.2","545","39799","54","545 → 39799 [RST, ACK] Seq=1 Ack=1 Win=0 Len=0"
"72","Dec 16, 2024 14:24:02.986000262 IST","172.18.0.2","172.18.0.3","39799","1166","58","39799 → 1166 [SYN] Seq=0 Win=1024 Len=0 MSS=1460"
"73","Dec 16, 2024 14:24:02.986003735 IST","172.18.0.3","172.18.0.2","1166","39799","54","1166 → 39799 [RST, ACK] Seq=1 Ack=1 Win=0 Len=0"
"74","Dec 16, 2024 14:24:02.986015163 IST","172.18.0.2","172.18.0.3","39799","16000","58","39799 → 16000 [SYN] Seq=0 Win=1024 Len=0 MSS=1460"
"75","Dec 16, 2024 14:24:02.986019737 IST","172.18.0.3","172.18.0.2","16000","39799","54","16000 → 39799 [RST, ACK] Seq=1 Ack=1 Win=0 Len=0"
"76","Dec 16, 2024 14:24:02.986032044 IST","172.18.0.2","172.18.0.3","39799","2222","58","39799 → 2222 [SYN] Seq=0 Win=1024 Len=0 MSS=1460"
"77","Dec 16, 2024 14:24:02.986035506 IST","172.18.0.3","172.18.0.2","2222","39799","54","2222 → 39799 [RST, ACK] Seq=1 Ack=1 Win=0 Len=0"
"78","Dec 16, 2024 14:24:02.986046857 IST","172.18.0.2","172.18.0.3","39799","11111","58","39799 → 11111 [SYN] Seq=0 Win=1024 Len=0 MSS=1460"
"79","Dec 16, 2024 14:24:02.986050471 IST","172.18.0.3","172.18.0.2","11111","39799","54","11111 → 39799 [RST, ACK] Seq=1 Ack=1 Win=0 Len=0"
"80","Dec 16, 2024 14:24:02.986062721 IST","172.18.0.2","172.18.0.3","39799","8194","58","39799 → 8194 [SYN] Seq=0 Win=1024 Len=0 MSS=1460"
"81","Dec 16, 2024 14:24:02.986066311 IST","172.18.0.3","172.18.0.2","8194","39799","54","8194 → 39799 [RST, ACK] Seq=1 Ack=1 Win=0 Len=0"
"82","Dec 16, 2024 14:24:02.986077787 IST","172.18.0.2","172.18.0.3","39799","20005","58","39799 → 20005 [SYN] Seq=0 Win=1024 Len=0 MSS=1460"
"83","Dec 16, 2024 14:24:02.986081265 IST","172.18.0.3","172.18.0.2","20005","39799","54","20005 → 39799 [RST, ACK] Seq=1 Ack=1 Win=0 Len=0"
"84","Dec 16, 2024 14:24:02.986092321 IST","172.18.0.2","172.18.0.3","39799","1067","58","39799 → 1067 [SYN] Seq=0 Win=1024 Len=0 MSS=1460"
"85","Dec 16, 2024 14:24:02.986095739 IST","172.18.0.3","172.18.0.2","1067","39799","54","1067 → 39799 [RST, ACK] Seq=1 Ack=1 Win=0 Len=0"
"86","Dec 16, 2024 14:24:02.986107093 IST","172.18.0.2","172.18.0.3","39799","4129","58","39799 → 4129 [SYN] Seq=0 Win=1024 Len=0 MSS=1460"
"87","Dec 16, 2024 14:24:02.986110521 IST","172.18.0.3","172.18.0.2","4129","39799","54","4129 → 39799 [RST, ACK] Seq=1 Ack=1 Win=0 Len=0"
"88","Dec 16, 2024 14:24:02.986121652 IST","172.18.0.2","172.18.0.3","39799","544","58","39799 → 544 [SYN] Seq=0 Win=1024 Len=0 MSS=1460"
"89","Dec 16, 2024 14:24:02.986124984 IST","172.18.0.3","172.18.0.2","544","39799","54","544 → 39799 [RST, ACK] Seq=1 Ack=1 Win=0 Len=0"
"90","Dec 16, 2024 14:24:02.986182987 IST","172.18.0.2","172.18.0.3","39799","7938","58","39799 → 7938 [SYN] Seq=0 Win=1024 Len=0 MSS=1460"
"91","Dec 16, 2024 14:24:02.986218419 IST","172.18.0.3","172.18.0.2","7938","39799","54","7938 → 39799 [RST, ACK] Seq=1 Ack=1 Win=0 Len=0"
"92","Dec 16, 2024 14:24:02.986249447 IST","172.18.0.2","172.18.0.3","39799","32781","58","39799 → 32781 [SYN] Seq=0 Win=1024 Len=0 MSS=1460"
"93","Dec 16, 2024 14:24:02.986254351 IST","172.18.0.3","172.18.0.2","32781","39799","54","32781 → 39799 [RST, ACK] Seq=1 Ack=1 Win=0 Len=0"
"94","Dec 16, 2024 14:24:02.986267480 IST","172.18.0.2","172.18.0.3","39799","54045","58","39799 → 54045 [SYN] Seq=0 Win=1024 Len=0 MSS=1460"
"95","Dec 16, 2024 14:24:02.986271395 IST","172.18.0.3","172.18.0.2","54045","39799","54","54045 → 39799 [RST, ACK] Seq=1 Ack=1 Win=0 Len=0"
"96","Dec 16, 2024 14:24:02.986283469 IST","172.18.0.2","172.18.0.3","39799","5902","58","39799 → 5902 [SYN] Seq=0 Win=1024 Len=0 MSS=1460"
"97","Dec 16, 2024 14:24:02.986286965 IST","172.18.0.3","172.18.0.2","5902","39799","54","5902 → 39799 [RST, ACK] Seq=1 Ack=1 Win=0 Len=0"
"98","Dec 16, 2024 14:24:02.986298291 IST","172.18.0.2","172.18.0.3","39799","1594","58","39799 → 1594 [SYN] Seq=0 Win=1024 Len=0 MSS=1460"
"99","Dec 16, 2024 14:24:02.986302916 IST","172.18.0.3","172.18.0.2","1594","39799","54","1594 → 39799 [RST, ACK] Seq=1 Ack=1 Win=0 Len=0"
"100","Dec 16, 2024 14:24:02.986353433 IST","172.18.0.2","172.18.0.3","39799","2068","58","39799 → 2068 [SYN] Seq=0 Win=1024 Len=0 MSS=1460"
"101","Dec 16, 2024 14:24:02.986361712 IST","172.18.0.3","172.18.0.2","2068","39799","54","2068 → 39799 [RST, ACK] Seq=1 Ack=1 Win=0 Len=0"
"102","Dec 16, 2024 14:24:02.986381154 IST","172.18.0.2","172.18.0.3","39799","902","58","39799 → 902 [SYN] Seq=0 Win=1024 Len=0 MSS=1460"
"103","Dec 16, 2024 14:24:02.986385126 IST","172.18.0.3","172.18.0.2","902","39799","54","902 → 39799 [RST, ACK] Seq=1 Ack=1 Win=0 Len=0"
"104","Dec 16, 2024 14:24:02.986398081 IST","172.18.0.2","172.18.0.3","39799","1038","58","39799 → 1038 [SYN] Seq=0 Win=1024 Len=0 MSS=1460"
"105","Dec 16, 2024 14:24:02.986402021 IST","172.18.0.3","172.18.0.2","1038","39799","54","1038 → 39799 [RST, ACK] Seq=1 Ack=1 Win=0 Len=0"
"106","Dec 16, 2024 14:24:02.986414328 IST","172.18.0.2","172.18.0.3","39799","109","58","39799 → 109 [SYN] Seq=0 Win=1024 Len=0 MSS=1460"
"107","Dec 16, 2024 14:24:02.986417640 IST","172.18.0.3","172.18.0.2","109","39799","54","109 → 39799 [RST, ACK] Seq=1 Ack=1 Win=0 Len=0"
"108","Dec 16, 2024 14:24:02.986428918 IST","172.18.0.2","172.18.0.3","39799","5904","58","39799 → 5904 [SYN] Seq=0 Win=1024 Len=0 MSS=1460"
"109","Dec 16, 2024 14:24:02.986432469 IST","172.18.0.3","172.18.0.2","5904","39799","54","5904 → 39799 [RST, ACK] Seq=1 Ack=1 Win=0 Len=0"
"110","Dec 16, 2024 14:24:02.986443618 IST","172.18.0.2","172.18.0.3","39799","1782","58","39799 → 1782 [SYN] Seq=0 Win=1024 Len=0 MSS=1460"
"111","Dec 16, 2024 14:24:02.986447198 IST","172.18.0.3","172.18.0.2","1782","39799","54","1782 → 39799 [RST, ACK] Seq=1 Ack=1 Win=0 Len=0"
"112","Dec 16, 2024 14:24:02.986459203 IST","172.18.0.2","172.18.0.3","39799","32775","58","39799 → 32775 [SYN] Seq=0 Win=1024 Len=0 MSS=1460"
"113","Dec 16, 2024 14:24:02.986462859 IST","172.18.0.3","172.18.0.2","32775","39799","54","32775 → 39799 [RST, ACK] Seq=1 Ack=1 Win=0 Len=0"
"114","Dec 16, 2024 14:24:02.986473811 IST","172.18.0.2","172.18.0.3","39799","10243","58","39799 → 10243 [SYN] Seq=0 Win=1024 Len=0 MSS=1460"
"115","Dec 16, 2024 14:24:02.986477448 IST","172.18.0.3","172.18.0.2","10243","39799","54","10243 → 39799 [RST, ACK] Seq=1 Ack=1 Win=0 Len=0"
"116","Dec 16, 2024 14:24:02.986489432 IST","172.18.0.2","172.18.0.3","39799","20221","58","39799 → 20221 [SYN] Seq=0 Win=1024 Len=0 MSS=1460"
"117","Dec 16, 2024 14:24:02.986493458 IST","172.18.0.3","172.18.0.2","20221","39799","54","20221 → 39799 [RST, ACK] Seq=1 Ack=1 Win=0 Len=0"
"118","Dec 16, 2024 14:24:02.986506512 IST","172.18.0.2","172.18.0.3","39799","1044","58","39799 → 1044 [SYN] Seq=0 Win=1024 Len=0 MSS=1460"
"119","Dec 16, 2024 14:24:02.986510170 IST","172.18.0.3","172.18.0.2","1044","39799","54","1044 → 39799 [RST, ACK] Seq=1 Ack=1 Win=0 Len=0"
"120","Dec 16, 2024 14:24:02.986521907 IST","172.18.0.2","172.18.0.3","39799","3005","58","39799 → 3005 [SYN] Seq=0 Win=1024 Len=0 MSS=1460"
"121","Dec 16, 2024 14:24:02.986525647 IST","172.18.0.3","172.18.0.2","3005","39799","54","3005 → 39799 [RST, ACK] Seq=1 Ack=1 Win=0 Len=0"
"122","Dec 16, 2024 14:24:02.986537533 IST","172.18.0.2","172.18.0.3","39799","9998","58","39799 → 9998 [SYN] Seq=0 Win=1024 Len=0 MSS=1460"
"123","Dec 16, 2024 14:24:02.986540936 IST","172.18.0.3","172.18.0.2","9998","39799","54","9998 → 39799 [RST, ACK] Seq=1 Ack=1 Win=0 Len=0"
"124","Dec 16, 2024 14:24:02.986552421 IST","172.18.0.2","172.18.0.3","39799","1100","58","39799 → 1100 [SYN] Seq=0 Win=1024 Len=0 MSS=1460"
"125","Dec 16, 2024 14:24:02.986556156 IST","172.18.0.3","172.18.0.2","1100","39799","54","1100 → 39799 [RST, ACK] Seq=1 Ack=1 Win=0 Len=0"
"126","Dec 16, 2024 14:24:02.986567478 IST","172.18.0.2","172.18.0.3","39799","50000","58","39799 → 50000 [SYN] Seq=0 Win=1024 Len=0 MSS=1460"
"127","Dec 16, 2024 14:24:02.986611996 IST","172.18.0.3","172.18.0.2","50000","39799","54","50000 → 39799 [RST, ACK] Seq=1 Ack=1 Win=0 Len=0"
"128","Dec 16, 2024 14:24:02.986644869 IST","172.18.0.2","172.18.0.3","39799","1072","58","39799 → 1072 [SYN] Seq=0 Win=1024 Len=0 MSS=1460"
"129","Dec 16, 2024 14:24:02.986650520 IST","172.18.0.3","172.18.0.2","1072","39799","54","1072 → 39799 [RST, ACK] Seq=1 Ack=1 Win=0 Len=0"
"130","Dec 16, 2024 14:24:02.986663712 IST","172.18.0.2","172.18.0.3","39799","44176","58","39799 → 44176 [SYN] Seq=0 Win=1024 Len=0 MSS=1460"
"131","Dec 16, 2024 14:24:02.986667317 IST","172.18.0.3","172.18.0.2","44176","39799","54","44176 → 39799 [RST, ACK] Seq=1 Ack=1 Win=0 Len=0"
"132","Dec 16, 2024 14:24:02.986678890 IST","172.18.0.2","172.18.0.3","39799","1186","58","39799 → 1186 [SYN] Seq=0 Win=1024 Len=0 MSS=1460"
"133","Dec 16, 2024 14:24:02.986682701 IST","172.18.0.3","172.18.0.2","1186","39799","54","1186 → 39799 [RST, ACK] Seq=1 Ack=1 Win=0 Len=0"
"134","Dec 16, 2024 14:24:02.986694009 IST","172.18.0.2","172.18.0.3","39799","8011","58","39799 → 8011 [SYN] Seq=0 Win=1024 Len=0 MSS=1460"
"135","Dec 16, 2024 14:24:02.986697706 IST","172.18.0.3","172.18.0.2","8011","39799","54","8011 → 39799 [RST, ACK] Seq=1 Ack=1 Win=0 Len=0"
"136","Dec 16, 2024 14:24:02.986709014 IST","172.18.0.2","172.18.0.3","39799","2002","58","39799 → 2002 [SYN] Seq=0 Win=1024 Len=0 MSS=1460"
"137","Dec 16, 2024 14:24:02.986712454 IST","172.18.0.3","172.18.0.2","2002","39799","54","2002 → 39799 [RST, ACK] Seq=1 Ack=1 Win=0 Len=0"
"138","Dec 16, 2024 14:24:02.986776089 IST","172.18.0.2","172.18.0.3","39799","5999","58","39799 → 5999 [SYN] Seq=0 Win=1024 Len=0 MSS=1460"
"139","Dec 16, 2024 14:24:02.986782528 IST","172.18.0.3","172.18.0.2","5999","39799","54","5999 → 39799 [RST, ACK] Seq=1 Ack=1 Win=0 Len=0"
"140","Dec 16, 2024 14:24:02.986796851 IST","172.18.0.2","172.18.0.3","39799","1169","58","39799 → 1169 [SYN] Seq=0 Win=1024 Len=0 MSS=1460"
"141","Dec 16, 2024 14:24:02.986802045 IST","172.18.0.3","172.18.0.2","1169","39799","54","1169 → 39799 [RST, ACK] Seq=1 Ack=1 Win=0 Len=0"
"142","Dec 16, 2024 14:24:02.986814769 IST","172.18.0.2","172.18.0.3","39799","3546","58","39799 → 3546 [SYN] Seq=0 Win=1024 Len=0 MSS=1460"
"143","Dec 16, 2024 14:24:02.986818835 IST","172.18.0.3","172.18.0.2","3546","39799","54","3546 → 39799 [RST, ACK] Seq=1 Ack=1 Win=0 Len=0"
"144","Dec 16, 2024 14:24:02.986830520 IST","172.18.0.2","172.18.0.3","39799","6666","58","39799 → 6666 [SYN] Seq=0 Win=1024 Len=0 MSS=1460"
"145","Dec 16, 2024 14:24:02.986834255 IST","172.18.0.3","172.18.0.2","6666","39799","54","6666 → 39799 [RST, ACK] Seq=1 Ack=1 Win=0 Len=0"
"146","Dec 16, 2024 14:24:02.986930659 IST","172.18.0.2","172.18.0.3","39799","5555","58","39799 → 5555 [SYN] Seq=0 Win=1024 Len=0 MSS=1460"
"147","Dec 16, 2024 14:24:02.986934782 IST","172.18.0.3","172.18.0.2","5555","39799","54","5555 → 39799 [RST, ACK] Seq=1 Ack=1 Win=0 Len=0"
"148","Dec 16, 2024 14:24:02.986947172 IST","172.18.0.2","172.18.0.3","39799","6101","58","39799 → 6101 [SYN] Seq=0 Win=1024 Len=0 MSS=1460"
"149","Dec 16, 2024 14:24:02.986950659 IST","172.18.0.3","172.18.0.2","6101","39799","54","6101 → 39799 [RST, ACK] Seq=1 Ack=1 Win=0 Len=0"
"150","Dec 16, 2024 14:24:02.986964805 IST","172.18.0.2","172.18.0.3","39799","5226","58","39799 → 5226 [SYN] Seq=0 Win=1024 Len=0 MSS=1460"
"151","Dec 16, 2024 14:24:02.986968438 IST","172.18.0.3","172.18.0.2","5226","39799","54","5226 → 39799 [RST, ACK] Seq=1 Ack=1 Win=0 Len=0"
"152","Dec 16, 2024 14:24:02.986979914 IST","172.18.0.2","172.18.0.3","39799","1112","58","39799 → 1112 [SYN] Seq=0 Win=1024 Len=0 MSS=1460"
"153","Dec 16, 2024 14:24:02.986983990 IST","172.18.0.3","172.18.0.2","1112","39799","54","1112 → 39799 [RST, ACK] Seq=1 Ack=1 Win=0 Len=0"
"154","Dec 16, 2024 14:24:02.986995944 IST","172.18.0.2","172.18.0.3","39799","5087","58","39799 → 5087 [SYN] Seq=0 Win=1024 Len=0 MSS=1460"
"155","Dec 16, 2024 14:24:02.986999567 IST","172.18.0.3","172.18.0.2","5087","39799","54","5087 → 39799 [RST, ACK] Seq=1 Ack=1 Win=0 Len=0"
"156","Dec 16, 2024 14:24:02.987012538 IST","172.18.0.2","172.18.0.3","39799","2525","58","39799 → 2525 [SYN] Seq=0 Win=1024 Len=0 MSS=1460"
"157","Dec 16, 2024 14:24:02.987016157 IST","172.18.0.3","172.18.0.2","2525","39799","54","2525 → 39799 [RST, ACK] Seq=1 Ack=1 Win=0 Len=0"
"158","Dec 16, 2024 14:24:02.987027396 IST","172.18.0.2","172.18.0.3","39799","1076","58","39799 → 1076 [SYN] Seq=0 Win=1024 Len=0 MSS=1460"
"159","Dec 16, 2024 14:24:02.987031056 IST","172.18.0.3","172.18.0.2","1076","39799","54","1076 → 39799 [RST, ACK] Seq=1 Ack=1 Win=0 Len=0"
"160","Dec 16, 2024 14:24:02.987042906 IST","172.18.0.2","172.18.0.3","39799","1183","58","39799 → 1183 [SYN] Seq=0 Win=1024 Len=0 MSS=1460"
"161","Dec 16, 2024 14:24:02.987046367 IST","172.18.0.3","172.18.0.2","1183","39799","54","1183 → 39799 [RST, ACK] Seq=1 Ack=1 Win=0 Len=0"
"162","Dec 16, 2024 14:24:02.987057465 IST","172.18.0.2","172.18.0.3","39799","1055","58","39799 → 1055 [SYN] Seq=0 Win=1024 Len=0 MSS=1460"
"163","Dec 16, 2024 14:24:02.987060946 IST","172.18.0.3","172.18.0.2","1055","39799","54","1055 → 39799 [RST, ACK] Seq=1 Ack=1 Win=0 Len=0"
"164","Dec 16, 2024 14:24:02.987072274 IST","172.18.0.2","172.18.0.3","39799","5910","58","39799 → 5910 [SYN] Seq=0 Win=1024 Len=0 MSS=1460"
"165","Dec 16, 2024 14:24:02.987076217 IST","172.18.0.3","172.18.0.2","5910","39799","54","5910 → 39799 [RST, ACK] Seq=1 Ack=1 Win=0 Len=0"
"166","Dec 16, 2024 14:24:02.987087400 IST","172.18.0.2","172.18.0.3","39799","416","58","39799 → 416 [SYN] Seq=0 Win=1024 Len=0 MSS=1460"
"167","Dec 16, 2024 14:24:02.987091314 IST","172.18.0.3","172.18.0.2","416","39799","54","416 → 39799 [RST, ACK] Seq=1 Ack=1 Win=0 Len=0"
"168","Dec 16, 2024 14:24:02.987102645 IST","172.18.0.2","172.18.0.3","39799","8292","58","39799 → 8292 [SYN] Seq=0 Win=1024 Len=0 MSS=1460"
"169","Dec 16, 2024 14:24:02.987106168 IST","172.18.0.3","172.18.0.2","8292","39799","54","8292 → 39799 [RST, ACK] Seq=1 Ack=1 Win=0 Len=0"
"170","Dec 16, 2024 14:24:02.987117516 IST","172.18.0.2","172.18.0.3","39799","26","58","39799 → 26 [SYN] Seq=0 Win=1024 Len=0 MSS=1460"
"171","Dec 16, 2024 14:24:02.987121393 IST","172.18.0.3","172.18.0.2","26","39799","54","26 → 39799 [RST, ACK] Seq=1 Ack=1 Win=0 Len=0"
"172","Dec 16, 2024 14:24:02.987133022 IST","172.18.0.2","172.18.0.3","39799","65129","58","39799 → 65129 [SYN] Seq=0 Win=1024 Len=0 MSS=1460"
"173","Dec 16, 2024 14:24:02.987136460 IST","172.18.0.3","172.18.0.2","65129","39799","54","65129 → 39799 [RST, ACK] Seq=1 Ack=1 Win=0 Len=0"
"174","Dec 16, 2024 14:24:02.987148658 IST","172.18.0.2","172.18.0.3","39799","3003","58","39799 → 3003 [SYN] Seq=0 Win=1024 Len=0 MSS=1460"
"175","Dec 16, 2024 14:24:02.987152791 IST","172.18.0.3","172.18.0.2","3003","39799","54","3003 → 39799 [RST, ACK] Seq=1 Ack=1 Win=0 Len=0"
"176","Dec 16, 2024 14:24:02.987165307 IST","172.18.0.2","172.18.0.3","39799","5003","58","39799 → 5003 [SYN] Seq=0 Win=1024 Len=0 MSS=1460"
"177","Dec 16, 2024 14:24:02.987169157 IST","172.18.0.3","172.18.0.2","5003","39799","54","5003 → 39799 [RST, ACK] Seq=1 Ack=1 Win=0 Len=0"
"178","Dec 16, 2024 14:24:02.987181118 IST","172.18.0.2","172.18.0.3","39799","1068","58","39799 → 1068 [SYN] Seq=0 Win=1024 Len=0 MSS=1460"
"179","Dec 16, 2024 14:24:02.987184720 IST","172.18.0.3","172.18.0.2","1068","39799","54","1068 → 39799 [RST, ACK] Seq=1 Ack=1 Win=0 Len=0"
"180","Dec 16, 2024 14:24:02.987196588 IST","172.18.0.2","172.18.0.3","39799","4125","58","39799 → 4125 [SYN] Seq=0 Win=1024 Len=0 MSS=1460"
"181","Dec 16, 2024 14:24:02.987200272 IST","172.18.0.3","172.18.0.2","4125","39799","54","4125 → 39799 [RST, ACK] Seq=1 Ack=1 Win=0 Len=0"
"182","Dec 16, 2024 14:24:02.987212092 IST","172.18.0.2","172.18.0.3","39799","8654","58","39799 → 8654 [SYN] Seq=0 Win=1024 Len=0 MSS=1460"
"183","Dec 16, 2024 14:24:02.987215558 IST","172.18.0.3","172.18.0.2","8654","39799","54","8654 → 39799 [RST, ACK] Seq=1 Ack=1 Win=0 Len=0"
"184","Dec 16, 2024 14:24:02.987227514 IST","172.18.0.2","172.18.0.3","39799","1094","58","39799 → 1094 [SYN] Seq=0 Win=1024 Len=0 MSS=1460"
"185","Dec 16, 2024 14:24:02.987231052 IST","172.18.0.3","172.18.0.2","1094","39799","54","1094 → 39799 [RST, ACK] Seq=1 Ack=1 Win=0 Len=0"
"186","Dec 16, 2024 14:24:02.987242658 IST","172.18.0.2","172.18.0.3","39799","34571","58","39799 → 34571 [SYN] Seq=0 Win=1024 Len=0 MSS=1460"
"187","Dec 16, 2024 14:24:02.987246158 IST","172.18.0.3","172.18.0.2","34571","39799","54","34571 → 39799 [RST, ACK] Seq=1 Ack=1 Win=0 Len=0"
"188","Dec 16, 2024 14:24:02.987317530 IST","172.18.0.2","172.18.0.3","39799","8400","58","39799 → 8400 [SYN] Seq=0 Win=1024 Len=0 MSS=1460"
"189","Dec 16, 2024 14:24:02.987324526 IST","172.18.0.3","172.18.0.2","8400","39799","54","8400 → 39799 [RST, ACK] Seq=1 Ack=1 Win=0 Len=0"
"190","Dec 16, 2024 14:24:02.987338160 IST","172.18.0.2","172.18.0.3","39799","10628","58","39799 → 10628 [SYN] Seq=0 Win=1024 Len=0 MSS=1460"
"191","Dec 16, 2024 14:24:02.987342212 IST","172.18.0.3","172.18.0.2","10628","39799","54","10628 → 39799 [RST, ACK] Seq=1 Ack=1 Win=0 Len=0"
"192","Dec 16, 2024 14:24:02.987353928 IST","172.18.0.2","172.18.0.3","39799","8085","58","39799 → 8085 [SYN] Seq=0 Win=1024 Len=0 MSS=1460"
"193","Dec 16, 2024 14:24:02.987357743 IST","172.18.0.3","172.18.0.2","8085","39799","54","8085 → 39799 [RST, ACK] Seq=1 Ack=1 Win=0 Len=0"
"194","Dec 16, 2024 14:24:02.987368994 IST","172.18.0.2","172.18.0.3","39799","6346","58","39799 → 6346 [SYN] Seq=0 Win=1024 Len=0 MSS=1460"
"195","Dec 16, 2024 14:24:02.987372584 IST","172.18.0.3","172.18.0.2","6346","39799","54","6346 → 39799 [RST, ACK] Seq=1 Ack=1 Win=0 Len=0"
"196","Dec 16, 2024 14:24:02.987383995 IST","172.18.0.2","172.18.0.3","39799","705","58","39799 → 705 [SYN] Seq=0 Win=1024 Len=0 MSS=1460"
"197","Dec 16, 2024 14:24:02.987387843 IST","172.18.0.3","172.18.0.2","705","39799","54","705 → 39799 [RST, ACK] Seq=1 Ack=1 Win=0 Len=0"
"198","Dec 16, 2024 14:24:02.987399377 IST","172.18.0.2","172.18.0.3","39799","1248","58","39799 → 1248 [SYN] Seq=0 Win=1024 Len=0 MSS=1460"
"199","Dec 16, 2024 14:24:02.987402907 IST","172.18.0.3","172.18.0.2","1248","39799","54","1248 → 39799 [RST, ACK] Seq=1 Ack=1 Win=0 Len=0"
"200","Dec 16, 2024 14:24:02.987414613 IST","172.18.0.2","172.18.0.3","39799","5718","58","39799 → 5718 [SYN] Seq=0 Win=1024 Len=0 MSS=1460"
"201","Dec 16, 2024 14:24:02.987418352 IST","172.18.0.3","172.18.0.2","5718","39799","54","5718 → 39799 [RST, ACK] Seq=1 Ack=1 Win=0 Len=0"
"202","Dec 16, 2024 14:24:02.987430025 IST","172.18.0.2","172.18.0.3","39799","16012","58","39799 → 16012 [SYN] Seq=0 Win=1024 Len=0 MSS=1460"
"203","Dec 16, 2024 14:24:02.987433575 IST","172.18.0.3","172.18.0.2","16012","39799","54","16012 → 39799 [RST, ACK] Seq=1 Ack=1 Win=0 Len=0"
"204","Dec 16, 2024 14:24:02.987445256 IST","172.18.0.2","172.18.0.3","39799","52822","58","39799 → 52822 [SYN] Seq=0 Win=1024 Len=0 MSS=1460"
"205","Dec 16, 2024 14:24:02.987448921 IST","172.18.0.3","172.18.0.2","52822","39799","54","52822 → 39799 [RST, ACK] Seq=1 Ack=1 Win=0 Len=0"
"206","Dec 16, 2024 14:24:02.987460222 IST","172.18.0.2","172.18.0.3","39799","5030","58","39799 → 5030 [SYN] Seq=0 Win=1024 Len=0 MSS=1460"
"207","Dec 16, 2024 14:24:02.987463706 IST","172.18.0.3","172.18.0.2","5030","39799","54","5030 → 39799 [RST, ACK] Seq=1 Ack=1 Win=0 Len=0"
"208","Dec 16, 2024 14:24:02.987475899 IST","172.18.0.2","172.18.0.3","39799","3372","58","39799 → 3372 [SYN] Seq=0 Win=1024 Len=0 MSS=1460"
"209","Dec 16, 2024 14:24:02.987499580 IST","172.18.0.3","172.18.0.2","3372","39799","54","3372 → 39799 [RST, ACK] Seq=1 Ack=1 Win=0 Len=0"
"210","Dec 16, 2024 14:24:02.987520891 IST","172.18.0.2","172.18.0.3","39799","5922","58","39799 → 5922 [SYN] Seq=0 Win=1024 Len=0 MSS=1460"
"211","Dec 16, 2024 14:24:02.987524894 IST","172.18.0.3","172.18.0.2","5922","39799","54","5922 → 39799 [RST, ACK] Seq=1 Ack=1 Win=0 Len=0"
"212","Dec 16, 2024 14:24:02.987537893 IST","172.18.0.2","172.18.0.3","39799","3689","58","39799 → 3689 [SYN] Seq=0 Win=1024 Len=0 MSS=1460"
"213","Dec 16, 2024 14:24:02.987542292 IST","172.18.0.3","172.18.0.2","3689","39799","54","3689 → 39799 [RST, ACK] Seq=1 Ack=1 Win=0 Len=0"
"214","Dec 16, 2024 14:24:02.987553964 IST","172.18.0.2","172.18.0.3","39799","49400","58","39799 → 49400 [SYN] Seq=0 Win=1024 Len=0 MSS=1460"
"215","Dec 16, 2024 14:24:02.987557672 IST","172.18.0.3","172.18.0.2","49400","39799","54","49400 → 39799 [RST, ACK] Seq=1 Ack=1 Win=0 Len=0"
"216","Dec 16, 2024 14:24:02.987569456 IST","172.18.0.2","172.18.0.3","39799","6007","58","39799 → 6007 [SYN] Seq=0 Win=1024 Len=0 MSS=1460"
"217","Dec 16, 2024 14:24:02.987573019 IST","172.18.0.3","172.18.0.2","6007","39799","54","6007 → 39799 [RST, ACK] Seq=1 Ack=1 Win=0 Len=0"
"218","Dec 16, 2024 14:24:02.987584670 IST","172.18.0.2","172.18.0.3","39799","99","58","39799 → 99 [SYN] Seq=0 Win=1024 Len=0 MSS=1460"
"219","Dec 16, 2024 14:24:02.987588249 IST","172.18.0.3","172.18.0.2","99","39799","54","99 → 39799 [RST, ACK] Seq=1 Ack=1 Win=0 Len=0"
"220","Dec 16, 2024 14:24:02.987607038 IST","172.18.0.2","172.18.0.3","39799","12345","58","39799 → 12345 [SYN] Seq=0 Win=1024 Len=0 MSS=1460"
"221","Dec 16, 2024 14:24:02.987610511 IST","172.18.0.3","172.18.0.2","12345","39799","54","12345 → 39799 [RST, ACK] Seq=1 Ack=1 Win=0 Len=0"
"222","Dec 16, 2024 14:24:02.987621887 IST","172.18.0.2","172.18.0.3","39799","6547","58","39799 → 6547 [SYN] Seq=0 Win=1024 Len=0 MSS=1460"
"223","Dec 16, 2024 14:24:02.987625205 IST","172.18.0.3","172.18.0.2","6547","39799","54","6547 → 39799 [RST, ACK] Seq=1 Ack=1 Win=0 Len=0"
"224","Dec 16, 2024 14:24:02.987636751 IST","172.18.0.2","172.18.0.3","39799","1059","58","39799 → 1059 [SYN] Seq=0 Win=1024 Len=0 MSS=1460"
"225","Dec 16, 2024 14:24:02.987640512 IST","172.18.0.3","172.18.0.2","1059","39799","54","1059 → 39799 [RST, ACK] Seq=1 Ack=1 Win=0 Len=0"
"226","Dec 16, 2024 14:24:02.987653255 IST","172.18.0.2","172.18.0.3","39799","64623","58","39799 → 64623 [SYN] Seq=0 Win=1024 Len=0 MSS=1460"
"227","Dec 16, 2024 14:24:02.987656664 IST","172.18.0.3","172.18.0.2","64623","39799","54","64623 → 39799 [RST, ACK] Seq=1 Ack=1 Win=0 Len=0"
"228","Dec 16, 2024 14:24:02.987668389 IST","172.18.0.2","172.18.0.3","39799","1056","58","39799 → 1056 [SYN] Seq=0 Win=1024 Len=0 MSS=1460"
"229","Dec 16, 2024 14:24:02.987671770 IST","172.18.0.3","172.18.0.2","1056","39799","54","1056 → 39799 [RST, ACK] Seq=1 Ack=1 Win=0 Len=0"
"230","Dec 16, 2024 14:24:02.987683077 IST","172.18.0.2","172.18.0.3","39799","1192","58","39799 → 1192 [SYN] Seq=0 Win=1024 Len=0 MSS=1460"
"231","Dec 16, 2024 14:24:02.987686695 IST","172.18.0.3","172.18.0.2","1192","39799","54","1192 → 39799 [RST, ACK] Seq=1 Ack=1 Win=0 Len=0"
"232","Dec 16, 2024 14:24:02.987698148 IST","172.18.0.2","172.18.0.3","39799","19842","58","39799 → 19842 [SYN] Seq=0 Win=1024 Len=0 MSS=1460"
"233","Dec 16, 2024 14:24:02.987701429 IST","172.18.0.3","172.18.0.2","19842","39799","54","19842 → 39799 [RST, ACK] Seq=1 Ack=1 Win=0 Len=0"
"234","Dec 16, 2024 14:24:02.987714348 IST","172.18.0.2","172.18.0.3","39799","7777","58","39799 → 7777 [SYN] Seq=0 Win=1024 Len=0 MSS=1460"
"235","Dec 16, 2024 14:24:02.987717958 IST","172.18.0.3","172.18.0.2","7777","39799","54","7777 → 39799 [RST, ACK] Seq=1 Ack=1 Win=0 Len=0"
"236","Dec 16, 2024 14:24:02.987729543 IST","172.18.0.2","172.18.0.3","39799","1443","58","39799 → 1443 [SYN] Seq=0 Win=1024 Len=0 MSS=1460"
"237","Dec 16, 2024 14:24:02.987732981 IST","172.18.0.3","172.18.0.2","1443","39799","54","1443 → 39799 [RST, ACK] Seq=1 Ack=1 Win=0 Len=0"
"238","Dec 16, 2024 14:24:02.987744318 IST","172.18.0.2","172.18.0.3","39799","1147","58","39799 → 1147 [SYN] Seq=0 Win=1024 Len=0 MSS=1460"
"239","Dec 16, 2024 14:24:02.987747820 IST","172.18.0.3","172.18.0.2","1147","39799","54","1147 → 39799 [RST, ACK] Seq=1 Ack=1 Win=0 Len=0"
"240","Dec 16, 2024 14:24:02.987759285 IST","172.18.0.2","172.18.0.3","39799","787","58","39799 → 787 [SYN] Seq=0 Win=1024 Len=0 MSS=1460"
"241","Dec 16, 2024 14:24:02.987762781 IST","172.18.0.3","172.18.0.2","787","39799","54","787 → 39799 [RST, ACK] Seq=1 Ack=1 Win=0 Len=0"
"242","Dec 16, 2024 14:24:02.987774152 IST","172.18.0.2","172.18.0.3","39799","1083","58","39799 → 1083 [SYN] Seq=0 Win=1024 Len=0 MSS=1460"
"243","Dec 16, 2024 14:24:02.987777698 IST","172.18.0.3","172.18.0.2","1083","39799","54","1083 → 39799 [RST, ACK] Seq=1 Ack=1 Win=0 Len=0"
"244","Dec 16, 2024 14:24:02.987789302 IST","172.18.0.2","172.18.0.3","39799","3390","58","39799 → 3390 [SYN] Seq=0 Win=1024 Len=0 MSS=1460"
"245","Dec 16, 2024 14:24:02.987846097 IST","172.18.0.3","172.18.0.2","3390","39799","54","3390 → 39799 [RST, ACK] Seq=1 Ack=1 Win=0 Len=0"
"246","Dec 16, 2024 14:24:02.987988153 IST","172.18.0.2","172.18.0.3","39799","49165","58","39799 → 49165 [SYN] Seq=0 Win=1024 Len=0 MSS=1460"
"247","Dec 16, 2024 14:24:02.987996005 IST","172.18.0.3","172.18.0.2","49165","39799","54","49165 → 39799 [RST, ACK] Seq=1 Ack=1 Win=0 Len=0"
"248","Dec 16, 2024 14:24:02.988010523 IST","172.18.0.2","172.18.0.3","39799","2602","58","39799 → 2602 [SYN] Seq=0 Win=1024 Len=0 MSS=1460"
"249","Dec 16, 2024 14:24:02.988014540 IST","172.18.0.3","172.18.0.2","2602","39799","54","2602 → 39799 [RST, ACK] Seq=1 Ack=1 Win=0 Len=0"
"250","Dec 16, 2024 14:24:02.988027737 IST","172.18.0.2","172.18.0.3","39799","3784","58","39799 → 3784 [SYN] Seq=0 Win=1024 Len=0 MSS=1460"
"251","Dec 16, 2024 14:24:02.988031601 IST","172.18.0.3","172.18.0.2","3784","39799","54","3784 → 39799 [RST, ACK] Seq=1 Ack=1 Win=0 Len=0"
"252","Dec 16, 2024 14:24:02.988045584 IST","172.18.0.2","172.18.0.3","39799","212","58","39799 → 212 [SYN] Seq=0 Win=1024 Len=0 MSS=1460"
"253","Dec 16, 2024 14:24:02.988091834 IST","172.18.0.3","172.18.0.2","212","39799","54","212 → 39799 [RST, ACK] Seq=1 Ack=1 Win=0 Len=0"
"254","Dec 16, 2024 14:24:02.988121094 IST","172.18.0.2","172.18.0.3","39799","3030","58","39799 → 3030 [SYN] Seq=0 Win=1024 Len=0 MSS=1460"
"255","Dec 16, 2024 14:24:02.988126753 IST","172.18.0.3","172.18.0.2","3030","39799","54","3030 → 39799 [RST, ACK] Seq=1 Ack=1 Win=0 Len=0"
"256","Dec 16, 2024 14:24:02.988139966 IST","172.18.0.2","172.18.0.3","39799","9050","58","39799 → 9050 [SYN] Seq=0 Win=1024 Len=0 MSS=1460"
"257","Dec 16, 2024 14:24:02.988144176 IST","172.18.0.3","172.18.0.2","9050","39799","54","9050 → 39799 [RST, ACK] Seq=1 Ack=1 Win=0 Len=0"
"258","Dec 16, 2024 14:24:02.988155684 IST","172.18.0.2","172.18.0.3","39799","2035","58","39799 → 2035 [SYN] Seq=0 Win=1024 Len=0 MSS=1460"
"259","Dec 16, 2024 14:24:02.988159212 IST","172.18.0.3","172.18.0.2","2035","39799","54","2035 → 39799 [RST, ACK] Seq=1 Ack=1 Win=0 Len=0"
"260","Dec 16, 2024 14:24:02.988171106 IST","172.18.0.2","172.18.0.3","39799","35500","58","39799 → 35500 [SYN] Seq=0 Win=1024 Len=0 MSS=1460"
"261","Dec 16, 2024 14:24:02.988174648 IST","172.18.0.3","172.18.0.2","35500","39799","54","35500 → 39799 [RST, ACK] Seq=1 Ack=1 Win=0 Len=0"
"262","Dec 16, 2024 14:24:02.988186001 IST","172.18.0.2","172.18.0.3","39799","6112","58","39799 → 6112 [SYN] Seq=0 Win=1024 Len=0 MSS=1460"
"263","Dec 16, 2024 14:24:02.988189403 IST","172.18.0.3","172.18.0.2","6112","39799","54","6112 → 39799 [RST, ACK] Seq=1 Ack=1 Win=0 Len=0"
"264","Dec 16, 2024 14:24:02.988200572 IST","172.18.0.2","172.18.0.3","39799","15000","58","39799 → 15000 [SYN] Seq=0 Win=1024 Len=0 MSS=1460"
"265","Dec 16, 2024 14:24:02.988204037 IST","172.18.0.3","172.18.0.2","15000","39799","54","15000 → 39799 [RST, ACK] Seq=1 Ack=1 Win=0 Len=0"
"266","Dec 16, 2024 14:24:02.988215774 IST","172.18.0.2","172.18.0.3","39799","10566","58","39799 → 10566 [SYN] Seq=0 Win=1024 Len=0 MSS=1460"
"267","Dec 16, 2024 14:24:02.988219390 IST","172.18.0.3","172.18.0.2","10566","39799","54","10566 → 39799 [RST, ACK] Seq=1 Ack=1 Win=0 Len=0"
"268","Dec 16, 2024 14:24:02.988230669 IST","172.18.0.2","172.18.0.3","39799","8099","58","39799 → 8099 [SYN] Seq=0 Win=1024 Len=0 MSS=1460"
"269","Dec 16, 2024 14:24:02.988234180 IST","172.18.0.3","172.18.0.2","8099","39799","54","8099 → 39799 [RST, ACK] Seq=1 Ack=1 Win=0 Len=0"
"270","Dec 16, 2024 14:24:02.988245667 IST","172.18.0.2","172.18.0.3","39799","5631","58","39799 → 5631 [SYN] Seq=0 Win=1024 Len=0 MSS=1460"
"271","Dec 16, 2024 14:24:02.988249486 IST","172.18.0.3","172.18.0.2","5631","39799","54","5631 → 39799 [RST, ACK] Seq=1 Ack=1 Win=0 Len=0"
"272","Dec 16, 2024 14:24:02.988261322 IST","172.18.0.2","172.18.0.3","39799","3766","58","39799 → 3766 [SYN] Seq=0 Win=1024 Len=0 MSS=1460"
"273","Dec 16, 2024 14:24:02.988264702 IST","172.18.0.3","172.18.0.2","3766","39799","54","3766 → 39799 [RST, ACK] Seq=1 Ack=1 Win=0 Len=0"
"274","Dec 16, 2024 14:24:02.988276664 IST","172.18.0.2","172.18.0.3","39799","32779","58","39799 → 32779 [SYN] Seq=0 Win=1024 Len=0 MSS=1460"
"275","Dec 16, 2024 14:24:02.988280061 IST","172.18.0.3","172.18.0.2","32779","39799","54","32779 → 39799 [RST, ACK] Seq=1 Ack=1 Win=0 Len=0"
"276","Dec 16, 2024 14:24:02.988291519 IST","172.18.0.2","172.18.0.3","39799","714","58","39799 → 714 [SYN] Seq=0 Win=1024 Len=0 MSS=1460"
"277","Dec 16, 2024 14:24:02.988295073 IST","172.18.0.3","172.18.0.2","714","39799","54","714 → 39799 [RST, ACK] Seq=1 Ack=1 Win=0 Len=0"
"278","Dec 16, 2024 14:24:02.988306136 IST","172.18.0.2","172.18.0.3","39799","2041","58","39799 → 2041 [SYN] Seq=0 Win=1024 Len=0 MSS=1460"
"279","Dec 16, 2024 14:24:02.988309441 IST","172.18.0.3","172.18.0.2","2041","39799","54","2041 → 39799 [RST, ACK] Seq=1 Ack=1 Win=0 Len=0"
"280","Dec 16, 2024 14:24:02.988320580 IST","172.18.0.2","172.18.0.3","39799","1533","58","39799 → 1533 [SYN] Seq=0 Win=1024 Len=0 MSS=1460"
"281","Dec 16, 2024 14:24:02.988324079 IST","172.18.0.3","172.18.0.2","1533","39799","54","1533 → 39799 [RST, ACK] Seq=1 Ack=1 Win=0 Len=0"
"282","Dec 16, 2024 14:24:02.988335289 IST","172.18.0.2","172.18.0.3","39799","6668","58","39799 → 6668 [SYN] Seq=0 Win=1024 Len=0 MSS=1460"
"283","Dec 16, 2024 14:24:02.988338799 IST","172.18.0.3","172.18.0.2","6668","39799","54","6668 → 39799 [RST, ACK] Seq=1 Ack=1 Win=0 Len=0"
"284","Dec 16, 2024 14:24:02.988349832 IST","172.18.0.2","172.18.0.3","39799","3971","58","39799 → 3971 [SYN] Seq=0 Win=1024 Len=0 MSS=1460"
"285","Dec 16, 2024 14:24:02.988353238 IST","172.18.0.3","172.18.0.2","3971","39799","54","3971 → 39799 [RST, ACK] Seq=1 Ack=1 Win=0 Len=0"
"286","Dec 16, 2024 14:24:02.988364416 IST","172.18.0.2","172.18.0.3","39799","2710","58","39799 → 2710 [SYN] Seq=0 Win=1024 Len=0 MSS=1460"
