frame.number,frame.time,ip.src,ip.dst,tcp.srcport,tcp.dstport,frame.len,_ws.col.Info
"1","Dec  8, 2024 14:59:05.766080014 IST",,,,,"42","Who has 172.18.0.3? Tell 172.18.0.2"
"2","Dec  8, 2024 14:59:05.766100754 IST",,,,,"42","172.18.0.3 is at 02:42:ac:12:00:03"
"3","Dec  8, 2024 14:59:06.016489324 IST","172.18.0.2","172.18.0.3","34067","993","58","34067 → 993 [SYN] Seq=0 Win=1024 Len=0 MSS=1460"
"4","Dec  8, 2024 14:59:06.016515925 IST","172.18.0.3","172.18.0.2","993","34067","54","993 → 34067 [RST, ACK] Seq=1 Ack=1 Win=0 Len=0"
"5","Dec  8, 2024 14:59:06.016543503 IST","172.18.0.2","172.18.0.3","34067","3306","58","34067 → 3306 [SYN] Seq=0 Win=1024 Len=0 MSS=1460"
"6","Dec  8, 2024 14:59:06.016548410 IST","172.18.0.3","172.18.0.2","3306","34067","54","3306 → 34067 [RST, ACK] Seq=1 Ack=1 Win=0 Len=0"
"7","Dec  8, 2024 14:59:06.016562804 IST","172.18.0.2","172.18.0.3","34067","5900","58","34067 → 5900 [SYN] Seq=0 Win=1024 Len=0 MSS=1460"
"8","Dec  8, 2024 14:59:06.016566626 IST","172.18.0.3","172.18.0.2","5900","34067","54","5900 → 34067 [RST, ACK] Seq=1 Ack=1 Win=0 Len=0"
"9","Dec  8, 2024 14:59:06.016579056 IST","172.18.0.2","172.18.0.3","34067","587","58","34067 → 587 [SYN] Seq=0 Win=1024 Len=0 MSS=1460"
"10","Dec  8, 2024 14:59:06.016583243 IST","172.18.0.3","172.18.0.2","587","34067","54","587 → 34067 [RST, ACK] Seq=1 Ack=1 Win=0 Len=0"
"11","Dec  8, 2024 14:59:06.016595167 IST","172.18.0.2","172.18.0.3","34067","995","58","34067 → 995 [SYN] Seq=0 Win=1024 Len=0 MSS=1460"
"12","Dec  8, 2024 14:59:06.016599225 IST","172.18.0.3","172.18.0.2","995","34067","54","995 → 34067 [RST, ACK] Seq=1 Ack=1 Win=0 Len=0"
"13","Dec  8, 2024 14:59:06.016611224 IST","172.18.0.2","172.18.0.3","34067","25","58","34067 → 25 [SYN] Seq=0 Win=1024 Len=0 MSS=1460"
"14","Dec  8, 2024 14:59:06.016614752 IST","172.18.0.3","172.18.0.2","25","34067","54","25 → 34067 [RST, ACK] Seq=1 Ack=1 Win=0 Len=0"
"15","Dec  8, 2024 14:59:06.016626406 IST","172.18.0.2","172.18.0.3","34067","53","58","34067 → 53 [SYN] Seq=0 Win=1024 Len=0 MSS=1460"
"16","Dec  8, 2024 14:59:06.016629940 IST","172.18.0.3","172.18.0.2","53","34067","54","53 → 34067 [RST, ACK] Seq=1 Ack=1 Win=0 Len=0"
"17","Dec  8, 2024 14:59:06.016645104 IST","172.18.0.2","172.18.0.3","34067","23","58","34067 → 23 [SYN] Seq=0 Win=1024 Len=0 MSS=1460"
"18","Dec  8, 2024 14:59:06.016649207 IST","172.18.0.3","172.18.0.2","23","34067","54","23 → 34067 [RST, ACK] Seq=1 Ack=1 Win=0 Len=0"
"19","Dec  8, 2024 14:59:06.016661395 IST","172.18.0.2","172.18.0.3","34067","113","58","34067 → 113 [SYN] Seq=0 Win=1024 Len=0 MSS=1460"
"20","Dec  8, 2024 14:59:06.016664840 IST","172.18.0.3","172.18.0.2","113","34067","54","113 → 34067 [RST, ACK] Seq=1 Ack=1 Win=0 Len=0"
"21","Dec  8, 2024 14:59:06.016676596 IST","172.18.0.2","172.18.0.3","34067","1025","58","34067 → 1025 [SYN] Seq=0 Win=1024 Len=0 MSS=1460"
"22","Dec  8, 2024 14:59:06.016680408 IST","172.18.0.3","172.18.0.2","1025","34067","54","1025 → 34067 [RST, ACK] Seq=1 Ack=1 Win=0 Len=0"
"23","Dec  8, 2024 14:59:06.016740239 IST","172.18.0.2","172.18.0.3","34067","199","58","34067 → 199 [SYN] Seq=0 Win=1024 Len=0 MSS=1460"
"24","Dec  8, 2024 14:59:06.016744229 IST","172.18.0.3","172.18.0.2","199","34067","54","199 → 34067 [RST, ACK] Seq=1 Ack=1 Win=0 Len=0"
"25","Dec  8, 2024 14:59:06.016756215 IST","172.18.0.2","172.18.0.3","34067","256","58","34067 → 256 [SYN] Seq=0 Win=1024 Len=0 MSS=1460"
"26","Dec  8, 2024 14:59:06.016759937 IST","172.18.0.3","172.18.0.2","256","34067","54","256 → 34067 [RST, ACK] Seq=1 Ack=1 Win=0 Len=0"
"27","Dec  8, 2024 14:59:06.016771354 IST","172.18.0.2","172.18.0.3","34067","1720","58","34067 → 1720 [SYN] Seq=0 Win=1024 Len=0 MSS=1460"
"28","Dec  8, 2024 14:59:06.016775320 IST","172.18.0.3","172.18.0.2","1720","34067","54","1720 → 34067 [RST, ACK] Seq=1 Ack=1 Win=0 Len=0"
"29","Dec  8, 2024 14:59:06.016826006 IST","172.18.0.2","172.18.0.3","34067","21","58","34067 → 21 [SYN] Seq=0 Win=1024 Len=0 MSS=1460"
"30","Dec  8, 2024 14:59:06.016834210 IST","172.18.0.3","172.18.0.2","21","34067","54","21 → 34067 [RST, ACK] Seq=1 Ack=1 Win=0 Len=0"
"31","Dec  8, 2024 14:59:06.016852831 IST","172.18.0.2","172.18.0.3","34067","135","58","34067 → 135 [SYN] Seq=0 Win=1024 Len=0 MSS=1460"
"32","Dec  8, 2024 14:59:06.016856856 IST","172.18.0.3","172.18.0.2","135","34067","54","135 → 34067 [RST, ACK] Seq=1 Ack=1 Win=0 Len=0"
"33","Dec  8, 2024 14:59:06.016869530 IST","172.18.0.2","172.18.0.3","34067","445","58","34067 → 445 [SYN] Seq=0 Win=1024 Len=0 MSS=1460"
"34","Dec  8, 2024 14:59:06.016873298 IST","172.18.0.3","172.18.0.2","445","34067","54","445 → 34067 [RST, ACK] Seq=1 Ack=1 Win=0 Len=0"
"35","Dec  8, 2024 14:59:06.016884614 IST","172.18.0.2","172.18.0.3","34067","8080","58","34067 → 8080 [SYN] Seq=0 Win=1024 Len=0 MSS=1460"
"36","Dec  8, 2024 14:59:06.016887967 IST","172.18.0.3","172.18.0.2","8080","34067","54","8080 → 34067 [RST, ACK] Seq=1 Ack=1 Win=0 Len=0"
"37","Dec  8, 2024 14:59:06.016899677 IST","172.18.0.2","172.18.0.3","34067","443","58","34067 → 443 [SYN] Seq=0 Win=1024 Len=0 MSS=1460"
"38","Dec  8, 2024 14:59:06.016903290 IST","172.18.0.3","172.18.0.2","443","34067","54","443 → 34067 [RST, ACK] Seq=1 Ack=1 Win=0 Len=0"
"39","Dec  8, 2024 14:59:06.016915176 IST","172.18.0.2","172.18.0.3","34067","111","58","34067 → 111 [SYN] Seq=0 Win=1024 Len=0 MSS=1460"
"40","Dec  8, 2024 14:59:06.016918663 IST","172.18.0.3","172.18.0.2","111","34067","54","111 → 34067 [RST, ACK] Seq=1 Ack=1 Win=0 Len=0"
"41","Dec  8, 2024 14:59:06.016931042 IST","172.18.0.2","172.18.0.3","34067","139","58","34067 → 139 [SYN] Seq=0 Win=1024 Len=0 MSS=1460"
"42","Dec  8, 2024 14:59:06.016934649 IST","172.18.0.3","172.18.0.2","139","34067","54","139 → 34067 [RST, ACK] Seq=1 Ack=1 Win=0 Len=0"
"43","Dec  8, 2024 14:59:06.016947047 IST","172.18.0.2","172.18.0.3","34067","80","58","34067 → 80 [SYN] Seq=0 Win=1024 Len=0 MSS=1460"
"44","Dec  8, 2024 14:59:06.016958495 IST","172.18.0.3","172.18.0.2","80","34067","58","80 → 34067 [SYN, ACK] Seq=0 Ack=1 Win=64240 Len=0 MSS=1460"
"45","Dec  8, 2024 14:59:06.016968634 IST","172.18.0.2","172.18.0.3","34067","80","54","34067 → 80 [RST] Seq=1 Win=0 Len=0"
"46","Dec  8, 2024 14:59:06.016979863 IST","172.18.0.2","172.18.0.3","34067","22","58","34067 → 22 [SYN] Seq=0 Win=1024 Len=0 MSS=1460"
"47","Dec  8, 2024 14:59:06.016983841 IST","172.18.0.3","172.18.0.2","22","34067","54","22 → 34067 [RST, ACK] Seq=1 Ack=1 Win=0 Len=0"
"48","Dec  8, 2024 14:59:06.016995530 IST","172.18.0.2","172.18.0.3","34067","554","58","34067 → 554 [SYN] Seq=0 Win=1024 Len=0 MSS=1460"
"49","Dec  8, 2024 14:59:06.017030727 IST","172.18.0.3","172.18.0.2","554","34067","54","554 → 34067 [RST, ACK] Seq=1 Ack=1 Win=0 Len=0"
"50","Dec  8, 2024 14:59:06.017057842 IST","172.18.0.2","172.18.0.3","34067","3389","58","34067 → 3389 [SYN] Seq=0 Win=1024 Len=0 MSS=1460"
"51","Dec  8, 2024 14:59:06.017062836 IST","172.18.0.3","172.18.0.2","3389","34067","54","3389 → 34067 [RST, ACK] Seq=1 Ack=1 Win=0 Len=0"
"52","Dec  8, 2024 14:59:06.017076241 IST","172.18.0.2","172.18.0.3","34067","8888","58","34067 → 8888 [SYN] Seq=0 Win=1024 Len=0 MSS=1460"
"53","Dec  8, 2024 14:59:06.017080076 IST","172.18.0.3","172.18.0.2","8888","34067","54","8888 → 34067 [RST, ACK] Seq=1 Ack=1 Win=0 Len=0"
"54","Dec  8, 2024 14:59:06.017093977 IST","172.18.0.2","172.18.0.3","34067","143","58","34067 → 143 [SYN] Seq=0 Win=1024 Len=0 MSS=1460"
"55","Dec  8, 2024 14:59:06.017097584 IST","172.18.0.3","172.18.0.2","143","34067","54","143 → 34067 [RST, ACK] Seq=1 Ack=1 Win=0 Len=0"
"56","Dec  8, 2024 14:59:06.017109355 IST","172.18.0.2","172.18.0.3","34067","110","58","34067 → 110 [SYN] Seq=0 Win=1024 Len=0 MSS=1460"
"57","Dec  8, 2024 14:59:06.017142621 IST","172.18.0.3","172.18.0.2","110","34067","54","110 → 34067 [RST, ACK] Seq=1 Ack=1 Win=0 Len=0"
"58","Dec  8, 2024 14:59:06.017168437 IST","172.18.0.2","172.18.0.3","34067","1723","58","34067 → 1723 [SYN] Seq=0 Win=1024 Len=0 MSS=1460"
"59","Dec  8, 2024 14:59:06.017173289 IST","172.18.0.3","172.18.0.2","1723","34067","54","1723 → 34067 [RST, ACK] Seq=1 Ack=1 Win=0 Len=0"
"60","Dec  8, 2024 14:59:06.017186644 IST","172.18.0.2","172.18.0.3","34067","9968","58","34067 → 9968 [SYN] Seq=0 Win=1024 Len=0 MSS=1460"
"61","Dec  8, 2024 14:59:06.017191111 IST","172.18.0.3","172.18.0.2","9968","34067","54","9968 → 34067 [RST, ACK] Seq=1 Ack=1 Win=0 Len=0"
"62","Dec  8, 2024 14:59:06.017203943 IST","172.18.0.2","172.18.0.3","34067","50636","58","34067 → 50636 [SYN] Seq=0 Win=1024 Len=0 MSS=1460"
"63","Dec  8, 2024 14:59:06.017207613 IST","172.18.0.3","172.18.0.2","50636","34067","54","50636 → 34067 [RST, ACK] Seq=1 Ack=1 Win=0 Len=0"
"64","Dec  8, 2024 14:59:06.017262448 IST","172.18.0.2","172.18.0.3","34067","3372","58","34067 → 3372 [SYN] Seq=0 Win=1024 Len=0 MSS=1460"
"65","Dec  8, 2024 14:59:06.017266206 IST","172.18.0.3","172.18.0.2","3372","34067","54","3372 → 34067 [RST, ACK] Seq=1 Ack=1 Win=0 Len=0"
"66","Dec  8, 2024 14:59:06.017279076 IST","172.18.0.2","172.18.0.3","34067","26214","58","34067 → 26214 [SYN] Seq=0 Win=1024 Len=0 MSS=1460"
"67","Dec  8, 2024 14:59:06.017282320 IST","172.18.0.3","172.18.0.2","26214","34067","54","26214 → 34067 [RST, ACK] Seq=1 Ack=1 Win=0 Len=0"
"68","Dec  8, 2024 14:59:06.017293931 IST","172.18.0.2","172.18.0.3","34067","1130","58","34067 → 1130 [SYN] Seq=0 Win=1024 Len=0 MSS=1460"
"69","Dec  8, 2024 14:59:06.017297222 IST","172.18.0.3","172.18.0.2","1130","34067","54","1130 → 34067 [RST, ACK] Seq=1 Ack=1 Win=0 Len=0"
"70","Dec  8, 2024 14:59:06.017308745 IST","172.18.0.2","172.18.0.3","34067","683","58","34067 → 683 [SYN] Seq=0 Win=1024 Len=0 MSS=1460"
"71","Dec  8, 2024 14:59:06.017312197 IST","172.18.0.3","172.18.0.2","683","34067","54","683 → 34067 [RST, ACK] Seq=1 Ack=1 Win=0 Len=0"
"72","Dec  8, 2024 14:59:06.017323611 IST","172.18.0.2","172.18.0.3","34067","7512","58","34067 → 7512 [SYN] Seq=0 Win=1024 Len=0 MSS=1460"
"73","Dec  8, 2024 14:59:06.017326958 IST","172.18.0.3","172.18.0.2","7512","34067","54","7512 → 34067 [RST, ACK] Seq=1 Ack=1 Win=0 Len=0"
"74","Dec  8, 2024 14:59:06.017338342 IST","172.18.0.2","172.18.0.3","34067","1236","58","34067 → 1236 [SYN] Seq=0 Win=1024 Len=0 MSS=1460"
"75","Dec  8, 2024 14:59:06.017341939 IST","172.18.0.3","172.18.0.2","1236","34067","54","1236 → 34067 [RST, ACK] Seq=1 Ack=1 Win=0 Len=0"
"76","Dec  8, 2024 14:59:06.017353349 IST","172.18.0.2","172.18.0.3","34067","62078","58","34067 → 62078 [SYN] Seq=0 Win=1024 Len=0 MSS=1460"
"77","Dec  8, 2024 14:59:06.017356891 IST","172.18.0.3","172.18.0.2","62078","34067","54","62078 → 34067 [RST, ACK] Seq=1 Ack=1 Win=0 Len=0"
"78","Dec  8, 2024 14:59:06.017368927 IST","172.18.0.2","172.18.0.3","34067","2702","58","34067 → 2702 [SYN] Seq=0 Win=1024 Len=0 MSS=1460"
"79","Dec  8, 2024 14:59:06.017372619 IST","172.18.0.3","172.18.0.2","2702","34067","54","2702 → 34067 [RST, ACK] Seq=1 Ack=1 Win=0 Len=0"
"80","Dec  8, 2024 14:59:06.017384469 IST","172.18.0.2","172.18.0.3","34067","119","58","34067 → 119 [SYN] Seq=0 Win=1024 Len=0 MSS=1460"
"81","Dec  8, 2024 14:59:06.017387983 IST","172.18.0.3","172.18.0.2","119","34067","54","119 → 34067 [RST, ACK] Seq=1 Ack=1 Win=0 Len=0"
"82","Dec  8, 2024 14:59:06.017399119 IST","172.18.0.2","172.18.0.3","34067","1556","58","34067 → 1556 [SYN] Seq=0 Win=1024 Len=0 MSS=1460"
"83","Dec  8, 2024 14:59:06.017402644 IST","172.18.0.3","172.18.0.2","1556","34067","54","1556 → 34067 [RST, ACK] Seq=1 Ack=1 Win=0 Len=0"
"84","Dec  8, 2024 14:59:06.017413659 IST","172.18.0.2","172.18.0.3","34067","8292","58","34067 → 8292 [SYN] Seq=0 Win=1024 Len=0 MSS=1460"
"85","Dec  8, 2024 14:59:06.017417249 IST","172.18.0.3","172.18.0.2","8292","34067","54","8292 → 34067 [RST, ACK] Seq=1 Ack=1 Win=0 Len=0"
"86","Dec  8, 2024 14:59:06.017428691 IST","172.18.0.2","172.18.0.3","34067","625","58","34067 → 625 [SYN] Seq=0 Win=1024 Len=0 MSS=1460"
"87","Dec  8, 2024 14:59:06.017432187 IST","172.18.0.3","172.18.0.2","625","34067","54","625 → 34067 [RST, ACK] Seq=1 Ack=1 Win=0 Len=0"
"88","Dec  8, 2024 14:59:06.017443400 IST","172.18.0.2","172.18.0.3","34067","1010","58","34067 → 1010 [SYN] Seq=0 Win=1024 Len=0 MSS=1460"
"89","Dec  8, 2024 14:59:06.017446795 IST","172.18.0.3","172.18.0.2","1010","34067","54","1010 → 34067 [RST, ACK] Seq=1 Ack=1 Win=0 Len=0"
"90","Dec  8, 2024 14:59:06.017459062 IST","172.18.0.2","172.18.0.3","34067","4004","58","34067 → 4004 [SYN] Seq=0 Win=1024 Len=0 MSS=1460"
"91","Dec  8, 2024 14:59:06.017462627 IST","172.18.0.3","172.18.0.2","4004","34067","54","4004 → 34067 [RST, ACK] Seq=1 Ack=1 Win=0 Len=0"
"92","Dec  8, 2024 14:59:06.017474502 IST","172.18.0.2","172.18.0.3","34067","9944","58","34067 → 9944 [SYN] Seq=0 Win=1024 Len=0 MSS=1460"
"93","Dec  8, 2024 14:59:06.017478223 IST","172.18.0.3","172.18.0.2","9944","34067","54","9944 → 34067 [RST, ACK] Seq=1 Ack=1 Win=0 Len=0"
"94","Dec  8, 2024 14:59:06.017489598 IST","172.18.0.2","172.18.0.3","34067","7920","58","34067 → 7920 [SYN] Seq=0 Win=1024 Len=0 MSS=1460"
"95","Dec  8, 2024 14:59:06.017493154 IST","172.18.0.3","172.18.0.2","7920","34067","54","7920 → 34067 [RST, ACK] Seq=1 Ack=1 Win=0 Len=0"
"96","Dec  8, 2024 14:59:06.017504653 IST","172.18.0.2","172.18.0.3","34067","1063","58","34067 → 1063 [SYN] Seq=0 Win=1024 Len=0 MSS=1460"
"97","Dec  8, 2024 14:59:06.017508079 IST","172.18.0.3","172.18.0.2","1063","34067","54","1063 → 34067 [RST, ACK] Seq=1 Ack=1 Win=0 Len=0"
"98","Dec  8, 2024 14:59:06.017519344 IST","172.18.0.2","172.18.0.3","34067","2200","58","34067 → 2200 [SYN] Seq=0 Win=1024 Len=0 MSS=1460"
"99","Dec  8, 2024 14:59:06.017522798 IST","172.18.0.3","172.18.0.2","2200","34067","54","2200 → 34067 [RST, ACK] Seq=1 Ack=1 Win=0 Len=0"
"100","Dec  8, 2024 14:59:06.017534310 IST","172.18.0.2","172.18.0.3","34067","1310","58","34067 → 1310 [SYN] Seq=0 Win=1024 Len=0 MSS=1460"
"101","Dec  8, 2024 14:59:06.017537900 IST","172.18.0.3","172.18.0.2","1310","34067","54","1310 → 34067 [RST, ACK] Seq=1 Ack=1 Win=0 Len=0"
"102","Dec  8, 2024 14:59:06.017549854 IST","172.18.0.2","172.18.0.3","34067","2160","58","34067 → 2160 [SYN] Seq=0 Win=1024 Len=0 MSS=1460"
"103","Dec  8, 2024 14:59:06.017553587 IST","172.18.0.3","172.18.0.2","2160","34067","54","2160 → 34067 [RST, ACK] Seq=1 Ack=1 Win=0 Len=0"
"104","Dec  8, 2024 14:59:06.017565802 IST","172.18.0.2","172.18.0.3","34067","2107","58","34067 → 2107 [SYN] Seq=0 Win=1024 Len=0 MSS=1460"
"105","Dec  8, 2024 14:59:06.017569170 IST","172.18.0.3","172.18.0.2","2107","34067","54","2107 → 34067 [RST, ACK] Seq=1 Ack=1 Win=0 Len=0"
"106","Dec  8, 2024 14:59:06.017581182 IST","172.18.0.2","172.18.0.3","34067","3000","58","34067 → 3000 [SYN] Seq=0 Win=1024 Len=0 MSS=1460"
"107","Dec  8, 2024 14:59:06.017584815 IST","172.18.0.3","172.18.0.2","3000","34067","54","3000 → 34067 [RST, ACK] Seq=1 Ack=1 Win=0 Len=0"
"108","Dec  8, 2024 14:59:06.017596769 IST","172.18.0.2","172.18.0.3","34067","406","58","34067 → 406 [SYN] Seq=0 Win=1024 Len=0 MSS=1460"
"109","Dec  8, 2024 14:59:06.017600429 IST","172.18.0.3","172.18.0.2","406","34067","54","406 → 34067 [RST, ACK] Seq=1 Ack=1 Win=0 Len=0"
"110","Dec  8, 2024 14:59:06.017614273 IST","172.18.0.2","172.18.0.3","34067","3269","58","34067 → 3269 [SYN] Seq=0 Win=1024 Len=0 MSS=1460"
"111","Dec  8, 2024 14:59:06.017617843 IST","172.18.0.3","172.18.0.2","3269","34067","54","3269 → 34067 [RST, ACK] Seq=1 Ack=1 Win=0 Len=0"
"112","Dec  8, 2024 14:59:06.017629830 IST","172.18.0.2","172.18.0.3","34067","1062","58","34067 → 1062 [SYN] Seq=0 Win=1024 Len=0 MSS=1460"
"113","Dec  8, 2024 14:59:06.017633438 IST","172.18.0.3","172.18.0.2","1062","34067","54","1062 → 34067 [RST, ACK] Seq=1 Ack=1 Win=0 Len=0"
"114","Dec  8, 2024 14:59:06.017645347 IST","172.18.0.2","172.18.0.3","34067","514","58","34067 → 514 [SYN] Seq=0 Win=1024 Len=0 MSS=1460"
"115","Dec  8, 2024 14:59:06.017648855 IST","172.18.0.3","172.18.0.2","514","34067","54","514 → 34067 [RST, ACK] Seq=1 Ack=1 Win=0 Len=0"
"116","Dec  8, 2024 14:59:06.017660514 IST","172.18.0.2","172.18.0.3","34067","1114","58","34067 → 1114 [SYN] Seq=0 Win=1024 Len=0 MSS=1460"
"117","Dec  8, 2024 14:59:06.017666476 IST","172.18.0.3","172.18.0.2","1114","34067","54","1114 → 34067 [RST, ACK] Seq=1 Ack=1 Win=0 Len=0"
"118","Dec  8, 2024 14:59:06.017678507 IST","172.18.0.2","172.18.0.3","34067","3268","58","34067 → 3268 [SYN] Seq=0 Win=1024 Len=0 MSS=1460"
"119","Dec  8, 2024 14:59:06.017681954 IST","172.18.0.3","172.18.0.2","3268","34067","54","3268 → 34067 [RST, ACK] Seq=1 Ack=1 Win=0 Len=0"
"120","Dec  8, 2024 14:59:06.017693690 IST","172.18.0.2","172.18.0.3","34067","16018","58","34067 → 16018 [SYN] Seq=0 Win=1024 Len=0 MSS=1460"
"121","Dec  8, 2024 14:59:06.017697345 IST","172.18.0.3","172.18.0.2","16018","34067","54","16018 → 34067 [RST, ACK] Seq=1 Ack=1 Win=0 Len=0"
"122","Dec  8, 2024 14:59:06.017709132 IST","172.18.0.2","172.18.0.3","34067","13456","58","34067 → 13456 [SYN] Seq=0 Win=1024 Len=0 MSS=1460"
"123","Dec  8, 2024 14:59:06.017712542 IST","172.18.0.3","172.18.0.2","13456","34067","54","13456 → 34067 [RST, ACK] Seq=1 Ack=1 Win=0 Len=0"
"124","Dec  8, 2024 14:59:06.017723719 IST","172.18.0.2","172.18.0.3","34067","3017","58","34067 → 3017 [SYN] Seq=0 Win=1024 Len=0 MSS=1460"
"125","Dec  8, 2024 14:59:06.017727245 IST","172.18.0.3","172.18.0.2","3017","34067","54","3017 → 34067 [RST, ACK] Seq=1 Ack=1 Win=0 Len=0"
"126","Dec  8, 2024 14:59:06.017740561 IST","172.18.0.2","172.18.0.3","34067","16992","58","34067 → 16992 [SYN] Seq=0 Win=1024 Len=0 MSS=1460"
"127","Dec  8, 2024 14:59:06.017744113 IST","172.18.0.3","172.18.0.2","16992","34067","54","16992 → 34067 [RST, ACK] Seq=1 Ack=1 Win=0 Len=0"
"128","Dec  8, 2024 14:59:06.017755895 IST","172.18.0.2","172.18.0.3","34067","30951","58","34067 → 30951 [SYN] Seq=0 Win=1024 Len=0 MSS=1460"
"129","Dec  8, 2024 14:59:06.017759213 IST","172.18.0.3","172.18.0.2","30951","34067","54","30951 → 34067 [RST, ACK] Seq=1 Ack=1 Win=0 Len=0"
"130","Dec  8, 2024 14:59:06.017771276 IST","172.18.0.2","172.18.0.3","34067","8383","58","34067 → 8383 [SYN] Seq=0 Win=1024 Len=0 MSS=1460"
"131","Dec  8, 2024 14:59:06.017774837 IST","172.18.0.3","172.18.0.2","8383","34067","54","8383 → 34067 [RST, ACK] Seq=1 Ack=1 Win=0 Len=0"
"132","Dec  8, 2024 14:59:06.017786561 IST","172.18.0.2","172.18.0.3","34067","999","58","34067 → 999 [SYN] Seq=0 Win=1024 Len=0 MSS=1460"
"133","Dec  8, 2024 14:59:06.017790071 IST","172.18.0.3","172.18.0.2","999","34067","54","999 → 34067 [RST, ACK] Seq=1 Ack=1 Win=0 Len=0"
"134","Dec  8, 2024 14:59:06.017801346 IST","172.18.0.2","172.18.0.3","34067","1147","58","34067 → 1147 [SYN] Seq=0 Win=1024 Len=0 MSS=1460"
"135","Dec  8, 2024 14:59:06.017804935 IST","172.18.0.3","172.18.0.2","1147","34067","54","1147 → 34067 [RST, ACK] Seq=1 Ack=1 Win=0 Len=0"
"136","Dec  8, 2024 14:59:06.017816428 IST","172.18.0.2","172.18.0.3","34067","2399","58","34067 → 2399 [SYN] Seq=0 Win=1024 Len=0 MSS=1460"
"137","Dec  8, 2024 14:59:06.017819966 IST","172.18.0.3","172.18.0.2","2399","34067","54","2399 → 34067 [RST, ACK] Seq=1 Ack=1 Win=0 Len=0"
"138","Dec  8, 2024 14:59:06.017831226 IST","172.18.0.2","172.18.0.3","34067","7025","58","34067 → 7025 [SYN] Seq=0 Win=1024 Len=0 MSS=1460"
"139","Dec  8, 2024 14:59:06.017834505 IST","172.18.0.3","172.18.0.2","7025","34067","54","7025 → 34067 [RST, ACK] Seq=1 Ack=1 Win=0 Len=0"
"140","Dec  8, 2024 14:59:06.017845882 IST","172.18.0.2","172.18.0.3","34067","44501","58","34067 → 44501 [SYN] Seq=0 Win=1024 Len=0 MSS=1460"
"141","Dec  8, 2024 14:59:06.017849312 IST","172.18.0.3","172.18.0.2","44501","34067","54","44501 → 34067 [RST, ACK] Seq=1 Ack=1 Win=0 Len=0"
"142","Dec  8, 2024 14:59:06.017863289 IST","172.18.0.2","172.18.0.3","34067","2008","58","34067 → 2008 [SYN] Seq=0 Win=1024 Len=0 MSS=1460"
"143","Dec  8, 2024 14:59:06.017866981 IST","172.18.0.3","172.18.0.2","2008","34067","54","2008 → 34067 [RST, ACK] Seq=1 Ack=1 Win=0 Len=0"
"144","Dec  8, 2024 14:59:06.017950923 IST","172.18.0.2","172.18.0.3","34067","8443","58","34067 → 8443 [SYN] Seq=0 Win=1024 Len=0 MSS=1460"
"145","Dec  8, 2024 14:59:06.017954635 IST","172.18.0.3","172.18.0.2","8443","34067","54","8443 → 34067 [RST, ACK] Seq=1 Ack=1 Win=0 Len=0"
"146","Dec  8, 2024 14:59:06.017966443 IST","172.18.0.2","172.18.0.3","34067","1972","58","34067 → 1972 [SYN] Seq=0 Win=1024 Len=0 MSS=1460"
"147","Dec  8, 2024 14:59:06.017969929 IST","172.18.0.3","172.18.0.2","1972","34067","54","1972 → 34067 [RST, ACK] Seq=1 Ack=1 Win=0 Len=0"
"148","Dec  8, 2024 14:59:06.017981813 IST","172.18.0.2","172.18.0.3","34067","32785","58","34067 → 32785 [SYN] Seq=0 Win=1024 Len=0 MSS=1460"
"149","Dec  8, 2024 14:59:06.017986422 IST","172.18.0.3","172.18.0.2","32785","34067","54","32785 → 34067 [RST, ACK] Seq=1 Ack=1 Win=0 Len=0"
"150","Dec  8, 2024 14:59:06.017998849 IST","172.18.0.2","172.18.0.3","34067","1073","58","34067 → 1073 [SYN] Seq=0 Win=1024 Len=0 MSS=1460"
"151","Dec  8, 2024 14:59:06.018002533 IST","172.18.0.3","172.18.0.2","1073","34067","54","1073 → 34067 [RST, ACK] Seq=1 Ack=1 Win=0 Len=0"
"152","Dec  8, 2024 14:59:06.018063173 IST","172.18.0.2","172.18.0.3","34067","51493","58","34067 → 51493 [SYN] Seq=0 Win=1024 Len=0 MSS=1460"
"153","Dec  8, 2024 14:59:06.018071462 IST","172.18.0.3","172.18.0.2","51493","34067","54","51493 → 34067 [RST, ACK] Seq=1 Ack=1 Win=0 Len=0"
"154","Dec  8, 2024 14:59:06.018091260 IST","172.18.0.2","172.18.0.3","34067","2121","58","34067 → 2121 [SYN] Seq=0 Win=1024 Len=0 MSS=1460"
"155","Dec  8, 2024 14:59:06.018095195 IST","172.18.0.3","172.18.0.2","2121","34067","54","2121 → 34067 [RST, ACK] Seq=1 Ack=1 Win=0 Len=0"
"156","Dec  8, 2024 14:59:06.018107960 IST","172.18.0.2","172.18.0.3","34067","3766","58","34067 → 3766 [SYN] Seq=0 Win=1024 Len=0 MSS=1460"
"157","Dec  8, 2024 14:59:06.018111411 IST","172.18.0.3","172.18.0.2","3766","34067","54","3766 → 34067 [RST, ACK] Seq=1 Ack=1 Win=0 Len=0"
"158","Dec  8, 2024 14:59:06.018123646 IST","172.18.0.2","172.18.0.3","34067","1443","58","34067 → 1443 [SYN] Seq=0 Win=1024 Len=0 MSS=1460"
"159","Dec  8, 2024 14:59:06.018127478 IST","172.18.0.3","172.18.0.2","1443","34067","54","1443 → 34067 [RST, ACK] Seq=1 Ack=1 Win=0 Len=0"
"160","Dec  8, 2024 14:59:06.018138951 IST","172.18.0.2","172.18.0.3","34067","2105","58","34067 → 2105 [SYN] Seq=0 Win=1024 Len=0 MSS=1460"
"161","Dec  8, 2024 14:59:06.018142314 IST","172.18.0.3","172.18.0.2","2105","34067","54","2105 → 34067 [RST, ACK] Seq=1 Ack=1 Win=0 Len=0"
"162","Dec  8, 2024 14:59:06.018153724 IST","172.18.0.2","172.18.0.3","34067","16001","58","34067 → 16001 [SYN] Seq=0 Win=1024 Len=0 MSS=1460"
"163","Dec  8, 2024 14:59:06.018157141 IST","172.18.0.3","172.18.0.2","16001","34067","54","16001 → 34067 [RST, ACK] Seq=1 Ack=1 Win=0 Len=0"
"164","Dec  8, 2024 14:59:06.018168501 IST","172.18.0.2","172.18.0.3","34067","787","58","34067 → 787 [SYN] Seq=0 Win=1024 Len=0 MSS=1460"
"165","Dec  8, 2024 14:59:06.018171865 IST","172.18.0.3","172.18.0.2","787","34067","54","787 → 34067 [RST, ACK] Seq=1 Ack=1 Win=0 Len=0"
"166","Dec  8, 2024 14:59:06.018183345 IST","172.18.0.2","172.18.0.3","34067","3878","58","34067 → 3878 [SYN] Seq=0 Win=1024 Len=0 MSS=1460"
"167","Dec  8, 2024 14:59:06.018186923 IST","172.18.0.3","172.18.0.2","3878","34067","54","3878 → 34067 [RST, ACK] Seq=1 Ack=1 Win=0 Len=0"
"168","Dec  8, 2024 14:59:06.018198761 IST","172.18.0.2","172.18.0.3","34067","6009","58","34067 → 6009 [SYN] Seq=0 Win=1024 Len=0 MSS=1460"
"169","Dec  8, 2024 14:59:06.018202383 IST","172.18.0.3","172.18.0.2","6009","34067","54","6009 → 34067 [RST, ACK] Seq=1 Ack=1 Win=0 Len=0"
"170","Dec  8, 2024 14:59:06.018213784 IST","172.18.0.2","172.18.0.3","34067","2525","58","34067 → 2525 [SYN] Seq=0 Win=1024 Len=0 MSS=1460"
"171","Dec  8, 2024 14:59:06.018217412 IST","172.18.0.3","172.18.0.2","2525","34067","54","2525 → 34067 [RST, ACK] Seq=1 Ack=1 Win=0 Len=0"
"172","Dec  8, 2024 14:59:06.018229152 IST","172.18.0.2","172.18.0.3","34067","3007","58","34067 → 3007 [SYN] Seq=0 Win=1024 Len=0 MSS=1460"
"173","Dec  8, 2024 14:59:06.018232681 IST","172.18.0.3","172.18.0.2","3007","34067","54","3007 → 34067 [RST, ACK] Seq=1 Ack=1 Win=0 Len=0"
"174","Dec  8, 2024 14:59:06.018244561 IST","172.18.0.2","172.18.0.3","34067","5850","58","34067 → 5850 [SYN] Seq=0 Win=1024 Len=0 MSS=1460"
"175","Dec  8, 2024 14:59:06.018247990 IST","172.18.0.3","172.18.0.2","5850","34067","54","5850 → 34067 [RST, ACK] Seq=1 Ack=1 Win=0 Len=0"
"176","Dec  8, 2024 14:59:06.018259448 IST","172.18.0.2","172.18.0.3","34067","8300","58","34067 → 8300 [SYN] Seq=0 Win=1024 Len=0 MSS=1460"
"177","Dec  8, 2024 14:59:06.018262773 IST","172.18.0.3","172.18.0.2","8300","34067","54","8300 → 34067 [RST, ACK] Seq=1 Ack=1 Win=0 Len=0"
"178","Dec  8, 2024 14:59:06.018273949 IST","172.18.0.2","172.18.0.3","34067","1322","58","34067 → 1322 [SYN] Seq=0 Win=1024 Len=0 MSS=1460"
"179","Dec  8, 2024 14:59:06.018278264 IST","172.18.0.3","172.18.0.2","1322","34067","54","1322 → 34067 [RST, ACK] Seq=1 Ack=1 Win=0 Len=0"
"180","Dec  8, 2024 14:59:06.018290398 IST","172.18.0.2","172.18.0.3","34067","8022","58","34067 → 8022 [SYN] Seq=0 Win=1024 Len=0 MSS=1460"
"181","Dec  8, 2024 14:59:06.018295348 IST","172.18.0.3","172.18.0.2","8022","34067","54","8022 → 34067 [RST, ACK] Seq=1 Ack=1 Win=0 Len=0"
"182","Dec  8, 2024 14:59:06.018307438 IST","172.18.0.2","172.18.0.3","34067","49159","58","34067 → 49159 [SYN] Seq=0 Win=1024 Len=0 MSS=1460"
"183","Dec  8, 2024 14:59:06.018310758 IST","172.18.0.3","172.18.0.2","49159","34067","54","49159 → 34067 [RST, ACK] Seq=1 Ack=1 Win=0 Len=0"
"184","Dec  8, 2024 14:59:06.018322287 IST","172.18.0.2","172.18.0.3","34067","56737","58","34067 → 56737 [SYN] Seq=0 Win=1024 Len=0 MSS=1460"
"185","Dec  8, 2024 14:59:06.018325865 IST","172.18.0.3","172.18.0.2","56737","34067","54","56737 → 34067 [RST, ACK] Seq=1 Ack=1 Win=0 Len=0"
"186","Dec  8, 2024 14:59:06.018338615 IST","172.18.0.2","172.18.0.3","34067","8800","58","34067 → 8800 [SYN] Seq=0 Win=1024 Len=0 MSS=1460"
"187","Dec  8, 2024 14:59:06.018342081 IST","172.18.0.3","172.18.0.2","8800","34067","54","8800 → 34067 [RST, ACK] Seq=1 Ack=1 Win=0 Len=0"
"188","Dec  8, 2024 14:59:06.018353577 IST","172.18.0.2","172.18.0.3","34067","32775","58","34067 → 32775 [SYN] Seq=0 Win=1024 Len=0 MSS=1460"
"189","Dec  8, 2024 14:59:06.018357021 IST","172.18.0.3","172.18.0.2","32775","34067","54","32775 → 34067 [RST, ACK] Seq=1 Ack=1 Win=0 Len=0"
"190","Dec  8, 2024 14:59:06.018368784 IST","172.18.0.2","172.18.0.3","34067","691","58","34067 → 691 [SYN] Seq=0 Win=1024 Len=0 MSS=1460"
"191","Dec  8, 2024 14:59:06.018372229 IST","172.18.0.3","172.18.0.2","691","34067","54","691 → 34067 [RST, ACK] Seq=1 Ack=1 Win=0 Len=0"
"192","Dec  8, 2024 14:59:06.018384084 IST","172.18.0.2","172.18.0.3","34067","3370","58","34067 → 3370 [SYN] Seq=0 Win=1024 Len=0 MSS=1460"
"193","Dec  8, 2024 14:59:06.018387779 IST","172.18.0.3","172.18.0.2","3370","34067","54","3370 → 34067 [RST, ACK] Seq=1 Ack=1 Win=0 Len=0"
"194","Dec  8, 2024 14:59:06.018399191 IST","172.18.0.2","172.18.0.3","34067","1029","58","34067 → 1029 [SYN] Seq=0 Win=1024 Len=0 MSS=1460"
"195","Dec  8, 2024 14:59:06.018402826 IST","172.18.0.3","172.18.0.2","1029","34067","54","1029 → 34067 [RST, ACK] Seq=1 Ack=1 Win=0 Len=0"
"196","Dec  8, 2024 14:59:06.018413940 IST","172.18.0.2","172.18.0.3","34067","99","58","34067 → 99 [SYN] Seq=0 Win=1024 Len=0 MSS=1460"
"197","Dec  8, 2024 14:59:06.018417367 IST","172.18.0.3","172.18.0.2","99","34067","54","99 → 34067 [RST, ACK] Seq=1 Ack=1 Win=0 Len=0"
"198","Dec  8, 2024 14:59:06.018429197 IST","172.18.0.2","172.18.0.3","34067","9103","58","34067 → 9103 [SYN] Seq=0 Win=1024 Len=0 MSS=1460"
"199","Dec  8, 2024 14:59:06.018432726 IST","172.18.0.3","172.18.0.2","9103","34067","54","9103 → 34067 [RST, ACK] Seq=1 Ack=1 Win=0 Len=0"
"200","Dec  8, 2024 14:59:06.018445044 IST","172.18.0.2","172.18.0.3","34067","9877","58","34067 → 9877 [SYN] Seq=0 Win=1024 Len=0 MSS=1460"
"201","Dec  8, 2024 14:59:06.018448733 IST","172.18.0.3","172.18.0.2","9877","34067","54","9877 → 34067 [RST, ACK] Seq=1 Ack=1 Win=0 Len=0"
"202","Dec  8, 2024 14:59:06.018460144 IST","172.18.0.2","172.18.0.3","34067","7004","58","34067 → 7004 [SYN] Seq=0 Win=1024 Len=0 MSS=1460"
"203","Dec  8, 2024 14:59:06.018463765 IST","172.18.0.3","172.18.0.2","7004","34067","54","7004 → 34067 [RST, ACK] Seq=1 Ack=1 Win=0 Len=0"
"204","Dec  8, 2024 14:59:06.018475344 IST","172.18.0.2","172.18.0.3","34067","5825","58","34067 → 5825 [SYN] Seq=0 Win=1024 Len=0 MSS=1460"
"205","Dec  8, 2024 14:59:06.018478735 IST","172.18.0.3","172.18.0.2","5825","34067","54","5825 → 34067 [RST, ACK] Seq=1 Ack=1 Win=0 Len=0"
"206","Dec  8, 2024 14:59:06.018489931 IST","172.18.0.2","172.18.0.3","34067","1998","58","34067 → 1998 [SYN] Seq=0 Win=1024 Len=0 MSS=1460"
"207","Dec  8, 2024 14:59:06.018493213 IST","172.18.0.3","172.18.0.2","1998","34067","54","1998 → 34067 [RST, ACK] Seq=1 Ack=1 Win=0 Len=0"
"208","Dec  8, 2024 14:59:06.018504325 IST","172.18.0.2","172.18.0.3","34067","2001","58","34067 → 2001 [SYN] Seq=0 Win=1024 Len=0 MSS=1460"
"209","Dec  8, 2024 14:59:06.018507725 IST","172.18.0.3","172.18.0.2","2001","34067","54","2001 → 34067 [RST, ACK] Seq=1 Ack=1 Win=0 Len=0"
"210","Dec  8, 2024 14:59:06.018518797 IST","172.18.0.2","172.18.0.3","34067","3998","58","34067 → 3998 [SYN] Seq=0 Win=1024 Len=0 MSS=1460"
"211","Dec  8, 2024 14:59:06.018522437 IST","172.18.0.3","172.18.0.2","3998","34067","54","3998 → 34067 [RST, ACK] Seq=1 Ack=1 Win=0 Len=0"
"212","Dec  8, 2024 14:59:06.018534043 IST","172.18.0.2","172.18.0.3","34067","3006","58","34067 → 3006 [SYN] Seq=0 Win=1024 Len=0 MSS=1460"
"213","Dec  8, 2024 14:59:06.018538545 IST","172.18.0.3","172.18.0.2","3006","34067","54","3006 → 34067 [RST, ACK] Seq=1 Ack=1 Win=0 Len=0"
"214","Dec  8, 2024 14:59:06.018551504 IST","172.18.0.2","172.18.0.3","34067","5999","58","34067 → 5999 [SYN] Seq=0 Win=1024 Len=0 MSS=1460"
"215","Dec  8, 2024 14:59:06.018554915 IST","172.18.0.3","172.18.0.2","5999","34067","54","5999 → 34067 [RST, ACK] Seq=1 Ack=1 Win=0 Len=0"
"216","Dec  8, 2024 14:59:06.018567863 IST","172.18.0.2","172.18.0.3","34067","1580","58","34067 → 1580 [SYN] Seq=0 Win=1024 Len=0 MSS=1460"
"217","Dec  8, 2024 14:59:06.018571393 IST","172.18.0.3","172.18.0.2","1580","34067","54","1580 → 34067 [RST, ACK] Seq=1 Ack=1 Win=0 Len=0"
"218","Dec  8, 2024 14:59:06.018582838 IST","172.18.0.2","172.18.0.3","34067","60443","58","34067 → 60443 [SYN] Seq=0 Win=1024 Len=0 MSS=1460"
"219","Dec  8, 2024 14:59:06.018586242 IST","172.18.0.3","172.18.0.2","60443","34067","54","60443 → 34067 [RST, ACK] Seq=1 Ack=1 Win=0 Len=0"
"220","Dec  8, 2024 14:59:06.018598194 IST","172.18.0.2","172.18.0.3","34067","61900","58","34067 → 61900 [SYN] Seq=0 Win=1024 Len=0 MSS=1460"
"221","Dec  8, 2024 14:59:06.018601970 IST","172.18.0.3","172.18.0.2","61900","34067","54","61900 → 34067 [RST, ACK] Seq=1 Ack=1 Win=0 Len=0"
"222","Dec  8, 2024 14:59:06.018615599 IST","172.18.0.2","172.18.0.3","34067","2103","58","34067 → 2103 [SYN] Seq=0 Win=1024 Len=0 MSS=1460"
"223","Dec  8, 2024 14:59:06.018619094 IST","172.18.0.3","172.18.0.2","2103","34067","54","2103 → 34067 [RST, ACK] Seq=1 Ack=1 Win=0 Len=0"
"224","Dec  8, 2024 14:59:06.018631254 IST","172.18.0.2","172.18.0.3","34067","30000","58","34067 → 30000 [SYN] Seq=0 Win=1024 Len=0 MSS=1460"
"225","Dec  8, 2024 14:59:06.018634879 IST","172.18.0.3","172.18.0.2","30000","34067","54","30000 → 34067 [RST, ACK] Seq=1 Ack=1 Win=0 Len=0"
"226","Dec  8, 2024 14:59:06.018646501 IST","172.18.0.2","172.18.0.3","34067","3221","58","34067 → 3221 [SYN] Seq=0 Win=1024 Len=0 MSS=1460"
"227","Dec  8, 2024 14:59:06.018649918 IST","172.18.0.3","172.18.0.2","3221","34067","54","3221 → 34067 [RST, ACK] Seq=1 Ack=1 Win=0 Len=0"
"228","Dec  8, 2024 14:59:06.018662071 IST","172.18.0.2","172.18.0.3","34067","1137","58","34067 → 1137 [SYN] Seq=0 Win=1024 Len=0 MSS=1460"
"229","Dec  8, 2024 14:59:06.018665472 IST","172.18.0.3","172.18.0.2","1137","34067","54","1137 → 34067 [RST, ACK] Seq=1 Ack=1 Win=0 Len=0"
"230","Dec  8, 2024 14:59:06.018677017 IST","172.18.0.2","172.18.0.3","34067","5666","58","34067 → 5666 [SYN] Seq=0 Win=1024 Len=0 MSS=1460"
"231","Dec  8, 2024 14:59:06.018680720 IST","172.18.0.3","172.18.0.2","5666","34067","54","5666 → 34067 [RST, ACK] Seq=1 Ack=1 Win=0 Len=0"
"232","Dec  8, 2024 14:59:06.018692048 IST","172.18.0.2","172.18.0.3","34067","5004","58","34067 → 5004 [SYN] Seq=0 Win=1024 Len=0 MSS=1460"
"233","Dec  8, 2024 14:59:06.018695522 IST","172.18.0.3","172.18.0.2","5004","34067","54","5004 → 34067 [RST, ACK] Seq=1 Ack=1 Win=0 Len=0"
"234","Dec  8, 2024 14:59:06.018706989 IST","172.18.0.2","172.18.0.3","34067","5200","58","34067 → 5200 [SYN] Seq=0 Win=1024 Len=0 MSS=1460"
"235","Dec  8, 2024 14:59:06.018710423 IST","172.18.0.3","172.18.0.2","5200","34067","54","5200 → 34067 [RST, ACK] Seq=1 Ack=1 Win=0 Len=0"
"236","Dec  8, 2024 14:59:06.018721507 IST","172.18.0.2","172.18.0.3","34067","4445","58","34067 → 4445 [SYN] Seq=0 Win=1024 Len=0 MSS=1460"
"237","Dec  8, 2024 14:59:06.018725018 IST","172.18.0.3","172.18.0.2","4445","34067","54","4445 → 34067 [RST, ACK] Seq=1 Ack=1 Win=0 Len=0"
"238","Dec  8, 2024 14:59:06.018738304 IST","172.18.0.2","172.18.0.3","34067","5910","58","34067 → 5910 [SYN] Seq=0 Win=1024 Len=0 MSS=1460"
"239","Dec  8, 2024 14:59:06.018741699 IST","172.18.0.3","172.18.0.2","5910","34067","54","5910 → 34067 [RST, ACK] Seq=1 Ack=1 Win=0 Len=0"
"240","Dec  8, 2024 14:59:06.018753061 IST","172.18.0.2","172.18.0.3","34067","3995","58","34067 → 3995 [SYN] Seq=0 Win=1024 Len=0 MSS=1460"
"241","Dec  8, 2024 14:59:06.018756500 IST","172.18.0.3","172.18.0.2","3995","34067","54","3995 → 34067 [RST, ACK] Seq=1 Ack=1 Win=0 Len=0"
"242","Dec  8, 2024 14:59:06.018767702 IST","172.18.0.2","172.18.0.3","34067","1433","58","34067 → 1433 [SYN] Seq=0 Win=1024 Len=0 MSS=1460"
"243","Dec  8, 2024 14:59:06.018771140 IST","172.18.0.3","172.18.0.2","1433","34067","54","1433 → 34067 [RST, ACK] Seq=1 Ack=1 Win=0 Len=0"
"244","Dec  8, 2024 14:59:06.018883903 IST","172.18.0.2","172.18.0.3","34067","109","58","34067 → 109 [SYN] Seq=0 Win=1024 Len=0 MSS=1460"
"245","Dec  8, 2024 14:59:06.018888623 IST","172.18.0.3","172.18.0.2","109","34067","54","109 → 34067 [RST, ACK] Seq=1 Ack=1 Win=0 Len=0"
"246","Dec  8, 2024 14:59:06.018901004 IST","172.18.0.2","172.18.0.3","34067","50001","58","34067 → 50001 [SYN] Seq=0 Win=1024 Len=0 MSS=1460"
"247","Dec  8, 2024 14:59:06.018904643 IST","172.18.0.3","172.18.0.2","50001","34067","54","50001 → 34067 [RST, ACK] Seq=1 Ack=1 Win=0 Len=0"
"248","Dec  8, 2024 14:59:06.018916233 IST","172.18.0.2","172.18.0.3","34067","5902","58","34067 → 5902 [SYN] Seq=0 Win=1024 Len=0 MSS=1460"
"249","Dec  8, 2024 14:59:06.018919625 IST","172.18.0.3","172.18.0.2","5902","34067","54","5902 → 34067 [RST, ACK] Seq=1 Ack=1 Win=0 Len=0"
"250","Dec  8, 2024 14:59:06.018931012 IST","172.18.0.2","172.18.0.3","34067","163","58","34067 → 163 [SYN] Seq=0 Win=1024 Len=0 MSS=1460"
"251","Dec  8, 2024 14:59:06.018934391 IST","172.18.0.3","172.18.0.2","163","34067","54","163 → 34067 [RST, ACK] Seq=1 Ack=1 Win=0 Len=0"
"252","Dec  8, 2024 14:59:06.018945696 IST","172.18.0.2","172.18.0.3","34067","524","58","34067 → 524 [SYN] Seq=0 Win=1024 Len=0 MSS=1460"
"253","Dec  8, 2024 14:59:06.018949085 IST","172.18.0.3","172.18.0.2","524","34067","54","524 → 34067 [RST, ACK] Seq=1 Ack=1 Win=0 Len=0"
"254","Dec  8, 2024 14:59:06.018960248 IST","172.18.0.2","172.18.0.3","34067","57797","58","34067 → 57797 [SYN] Seq=0 Win=1024 Len=0 MSS=1460"
"255","Dec  8, 2024 14:59:06.018963610 IST","172.18.0.3","172.18.0.2","57797","34067","54","57797 → 34067 [RST, ACK] Seq=1 Ack=1 Win=0 Len=0"
"256","Dec  8, 2024 14:59:06.018974739 IST","172.18.0.2","172.18.0.3","34067","22939","58","34067 → 22939 [SYN] Seq=0 Win=1024 Len=0 MSS=1460"
"257","Dec  8, 2024 14:59:06.018978291 IST","172.18.0.3","172.18.0.2","22939","34067","54","22939 → 34067 [RST, ACK] Seq=1 Ack=1 Win=0 Len=0"
"258","Dec  8, 2024 14:59:06.018989919 IST","172.18.0.2","172.18.0.3","34067","2111","58","34067 → 2111 [SYN] Seq=0 Win=1024 Len=0 MSS=1460"
"259","Dec  8, 2024 14:59:06.018993261 IST","172.18.0.3","172.18.0.2","2111","34067","54","2111 → 34067 [RST, ACK] Seq=1 Ack=1 Win=0 Len=0"
"260","Dec  8, 2024 14:59:06.019004425 IST","172.18.0.2","172.18.0.3","34067","49155","58","34067 → 49155 [SYN] Seq=0 Win=1024 Len=0 MSS=1460"
"261","Dec  8, 2024 14:59:06.019007809 IST","172.18.0.3","172.18.0.2","49155","34067","54","49155 → 34067 [RST, ACK] Seq=1 Ack=1 Win=0 Len=0"
"262","Dec  8, 2024 14:59:06.019019566 IST","172.18.0.2","172.18.0.3","34067","18988","58","34067 → 18988 [SYN] Seq=0 Win=1024 Len=0 MSS=1460"
"263","Dec  8, 2024 14:59:06.019023150 IST","172.18.0.3","172.18.0.2","18988","34067","54","18988 → 34067 [RST, ACK] Seq=1 Ack=1 Win=0 Len=0"
"264","Dec  8, 2024 14:59:06.019034497 IST","172.18.0.2","172.18.0.3","34067","1309","58","34067 → 1309 [SYN] Seq=0 Win=1024 Len=0 MSS=1460"
"265","Dec  8, 2024 14:59:06.019038344 IST","172.18.0.3","172.18.0.2","1309","34067","54","1309 → 34067 [RST, ACK] Seq=1 Ack=1 Win=0 Len=0"
"266","Dec  8, 2024 14:59:06.019049906 IST","172.18.0.2","172.18.0.3","34067","407","58","34067 → 407 [SYN] Seq=0 Win=1024 Len=0 MSS=1460"
"267","Dec  8, 2024 14:59:06.019053309 IST","172.18.0.3","172.18.0.2","407","34067","54","407 → 34067 [RST, ACK] Seq=1 Ack=1 Win=0 Len=0"
"268","Dec  8, 2024 14:59:06.019064654 IST","172.18.0.2","172.18.0.3","34067","1248","58","34067 → 1248 [SYN] Seq=0 Win=1024 Len=0 MSS=1460"
"269","Dec  8, 2024 14:59:06.019068010 IST","172.18.0.3","172.18.0.2","1248","34067","54","1248 → 34067 [RST, ACK] Seq=1 Ack=1 Win=0 Len=0"
"270","Dec  8, 2024 14:59:06.019079748 IST","172.18.0.2","172.18.0.3","34067","3003","58","34067 → 3003 [SYN] Seq=0 Win=1024 Len=0 MSS=1460"
"271","Dec  8, 2024 14:59:06.019083304 IST","172.18.0.3","172.18.0.2","3003","34067","54","3003 → 34067 [RST, ACK] Seq=1 Ack=1 Win=0 Len=0"
"272","Dec  8, 2024 14:59:06.019094879 IST","172.18.0.2","172.18.0.3","34067","1721","58","34067 → 1721 [SYN] Seq=0 Win=1024 Len=0 MSS=1460"
"273","Dec  8, 2024 14:59:06.019098238 IST","172.18.0.3","172.18.0.2","1721","34067","54","1721 → 34067 [RST, ACK] Seq=1 Ack=1 Win=0 Len=0"
"274","Dec  8, 2024 14:59:06.019110050 IST","172.18.0.2","172.18.0.3","34067","4001","58","34067 → 4001 [SYN] Seq=0 Win=1024 Len=0 MSS=1460"
"275","Dec  8, 2024 14:59:06.019113495 IST","172.18.0.3","172.18.0.2","4001","34067","54","4001 → 34067 [RST, ACK] Seq=1 Ack=1 Win=0 Len=0"
"276","Dec  8, 2024 14:59:06.019124882 IST","172.18.0.2","172.18.0.3","34067","4444","58","34067 → 4444 [SYN] Seq=0 Win=1024 Len=0 MSS=1460"
"277","Dec  8, 2024 14:59:06.019128254 IST","172.18.0.3","172.18.0.2","4444","34067","54","4444 → 34067 [RST, ACK] Seq=1 Ack=1 Win=0 Len=0"
"278","Dec  8, 2024 14:59:06.019139426 IST","172.18.0.2","172.18.0.3","34067","6003","58","34067 → 6003 [SYN] Seq=0 Win=1024 Len=0 MSS=1460"
"279","Dec  8, 2024 14:59:06.019142965 IST","172.18.0.3","172.18.0.2","6003","34067","54","6003 → 34067 [RST, ACK] Seq=1 Ack=1 Win=0 Len=0"
"280","Dec  8, 2024 14:59:06.019154705 IST","172.18.0.2","172.18.0.3","34067","1105","58","34067 → 1105 [SYN] Seq=0 Win=1024 Len=0 MSS=1460"
"281","Dec  8, 2024 14:59:06.019157945 IST","172.18.0.3","172.18.0.2","1105","34067","54","1105 → 34067 [RST, ACK] Seq=1 Ack=1 Win=0 Len=0"
"282","Dec  8, 2024 14:59:06.019169056 IST","172.18.0.2","172.18.0.3","34067","8086","58","34067 → 8086 [SYN] Seq=0 Win=1024 Len=0 MSS=1460"
"283","Dec  8, 2024 14:59:06.019172477 IST","172.18.0.3","172.18.0.2","8086","34067","54","8086 → 34067 [RST, ACK] Seq=1 Ack=1 Win=0 Len=0"
"284","Dec  8, 2024 14:59:06.019183584 IST","172.18.0.2","172.18.0.3","34067","8089","58","34067 → 8089 [SYN] Seq=0 Win=1024 Len=0 MSS=1460"
"285","Dec  8, 2024 14:59:06.019186916 IST","172.18.0.3","172.18.0.2","8089","34067","54","8089 → 34067 [RST, ACK] Seq=1 Ack=1 Win=0 Len=0"
"286","Dec  8, 2024 14:59:06.019198373 IST","172.18.0.2","172.18.0.3","34067","7911","58","34067 → 7911 [SYN] Seq=0 Win=1024 Len=0 MSS=1460"
